
============================================================
Step 0: Entering Phase 1: Hard only (3.0+)
Training pool: 321326 puzzles
============================================================

Step     0 | Loss: 2.8531 Acc: 11.08% | 0.0: 0/500 | 1.x: 0/500 | 2.x: 0/500 | 3.x: 0/500 | 4.x+: 0/500 | Total: 0/2500
Step   100 | Loss: 2.2099 Acc: 10.88%
Step   200 | Loss: 2.2034 Acc: 11.45%
Step   300 | Loss: 1.9480 Acc: 20.31%
Step   400 | Loss: 1.4361 Acc: 37.09%
Step   500 | Loss: 1.2415 Acc: 47.21%
Step   600 | Loss: 1.1839 Acc: 50.78%
Step   700 | Loss: 1.1439 Acc: 52.83%
Step   800 | Loss: 1.1301 Acc: 53.31%
Step   900 | Loss: 1.1016 Acc: 54.40%
Step  1000 | Loss: 1.0879 Acc: 55.34%
Step  1100 | Loss: 1.0631 Acc: 56.03%
Step  1200 | Loss: 1.0791 Acc: 55.71%
Step  1300 | Loss: 1.0571 Acc: 57.64%
Step  1400 | Loss: 1.0610 Acc: 56.47%
Step  1500 | Loss: 1.0525 Acc: 56.56%
Step  1600 | Loss: 1.0372 Acc: 57.07%
Step  1700 | Loss: 1.0260 Acc: 57.45%
Step  1800 | Loss: 1.0303 Acc: 57.98%
Step  1900 | Loss: 1.0369 Acc: 56.61%
Step  2000 | Loss: 1.0313 Acc: 57.94%
Step  2100 | Loss: 1.0061 Acc: 58.32%
Step  2200 | Loss: 1.0176 Acc: 58.10%
Step  2300 | Loss: 0.9951 Acc: 59.10%
Step  2400 | Loss: 1.0140 Acc: 57.52%
Step  2500 | Loss: 1.0109 Acc: 57.64%
Step  2600 | Loss: 1.0040 Acc: 58.23%
Step  2700 | Loss: 0.9885 Acc: 59.64%
Step  2800 | Loss: 0.9850 Acc: 59.06%
Step  2900 | Loss: 0.9970 Acc: 59.35%
Step  3000 | Loss: 0.9833 Acc: 59.44%
Step  3100 | Loss: 0.9798 Acc: 60.81%
Step  3200 | Loss: 0.9653 Acc: 60.68%
Step  3300 | Loss: 0.9790 Acc: 60.04%
Step  3400 | Loss: 0.9664 Acc: 61.07%
Step  3500 | Loss: 0.9963 Acc: 59.79%
Step  3600 | Loss: 0.9577 Acc: 61.11%
Step  3700 | Loss: 0.9433 Acc: 62.15%
Step  3800 | Loss: 0.9410 Acc: 62.39%
Step  3900 | Loss: 0.9677 Acc: 61.73%
Step  4000 | Loss: 0.9750 Acc: 59.98%
Step  4100 | Loss: 0.9644 Acc: 59.58%
Step  4200 | Loss: 0.9624 Acc: 61.36%
Step  4300 | Loss: 0.9558 Acc: 60.67%
Step  4400 | Loss: 0.9374 Acc: 62.29%
Step  4500 | Loss: 0.9604 Acc: 60.14%
Step  4600 | Loss: 0.9395 Acc: 63.02%
Step  4700 | Loss: 0.9417 Acc: 62.64%
Step  4800 | Loss: 0.9214 Acc: 63.00%
Step  4900 | Loss: 0.9205 Acc: 64.16%
Step  5000 | Loss: 0.9511 Acc: 61.48% | 0.0: 113/500 | 1.x: 52/500 | 2.x: 33/500 | 3.x: 15/500 | 4.x+: 5/500 | Total: 218/2500
Step  5100 | Loss: 0.9314 Acc: 62.22%
Step  5200 | Loss: 0.9265 Acc: 62.53%
Step  5300 | Loss: 0.9311 Acc: 62.85%
Step  5400 | Loss: 0.9263 Acc: 63.69%
Step  5500 | Loss: 0.9246 Acc: 63.03%
Step  5600 | Loss: 0.9250 Acc: 63.73%
Step  5700 | Loss: 0.9073 Acc: 65.44%
Step  5800 | Loss: 0.9332 Acc: 61.99%
Step  5900 | Loss: 0.9180 Acc: 63.59%
Step  6000 | Loss: 0.9396 Acc: 62.12%
Step  6100 | Loss: 0.9052 Acc: 64.87%
Step  6200 | Loss: 0.9281 Acc: 63.01%
Step  6300 | Loss: 0.8953 Acc: 65.55%
Step  6400 | Loss: 0.9356 Acc: 64.28%
Step  6500 | Loss: 0.9149 Acc: 64.41%
Step  6600 | Loss: 0.9013 Acc: 65.57%
Step  6700 | Loss: 0.9439 Acc: 60.85%
Step  6800 | Loss: 0.9090 Acc: 65.33%
Step  6900 | Loss: 0.9076 Acc: 63.12%
Step  7000 | Loss: 0.8859 Acc: 66.29%
Step  7100 | Loss: 0.9163 Acc: 64.71%
Step  7200 | Loss: 0.8955 Acc: 65.34%
Step  7300 | Loss: 0.9019 Acc: 63.81%
Step  7400 | Loss: 0.9058 Acc: 65.57%
Step  7500 | Loss: 0.8979 Acc: 65.85%
Step  7600 | Loss: 0.9088 Acc: 65.01%
Step  7700 | Loss: 0.9020 Acc: 64.66%
Step  7800 | Loss: 0.8878 Acc: 65.33%
Step  7900 | Loss: 0.8913 Acc: 65.39%
Step  8000 | Loss: 0.9099 Acc: 63.34%
Step  8100 | Loss: 0.8795 Acc: 65.14%
Step  8200 | Loss: 0.8605 Acc: 68.65%
Step  8300 | Loss: 0.8776 Acc: 66.04%
Step  8400 | Loss: 0.8803 Acc: 65.85%
Step  8500 | Loss: 0.8789 Acc: 66.98%
Step  8600 | Loss: 0.8480 Acc: 69.48%
Step  8700 | Loss: 0.8736 Acc: 67.01%
Step  8800 | Loss: 0.8677 Acc: 66.95%
Step  8900 | Loss: 0.8998 Acc: 67.00%
Step  9000 | Loss: 0.8763 Acc: 67.05%
Step  9100 | Loss: 0.8805 Acc: 67.23%
Step  9200 | Loss: 0.8707 Acc: 66.40%
Step  9300 | Loss: 0.9065 Acc: 65.88%
Step  9400 | Loss: 0.8957 Acc: 67.63%
Step  9500 | Loss: 0.8814 Acc: 66.75%
Step  9600 | Loss: 0.8830 Acc: 68.24%
Step  9700 | Loss: 0.8854 Acc: 65.65%
Step  9800 | Loss: 0.8909 Acc: 65.73%
Step  9900 | Loss: 0.8839 Acc: 66.92%
Step 10000 | Loss: 0.8562 Acc: 67.52% | 0.0: 254/500 | 1.x: 152/500 | 2.x: 108/500 | 3.x: 47/500 | 4.x+: 32/500 | Total: 593/2500
Step 10100 | Loss: 0.8668 Acc: 67.06%
Step 10200 | Loss: 0.9238 Acc: 63.70%
Step 10300 | Loss: 0.8568 Acc: 67.21%
Step 10400 | Loss: 0.8579 Acc: 69.50%
Step 10500 | Loss: 0.8686 Acc: 67.23%
Step 10600 | Loss: 0.8609 Acc: 69.20%
Step 10700 | Loss: 0.8453 Acc: 68.63%
Step 10800 | Loss: 0.8660 Acc: 68.27%
Step 10900 | Loss: 0.8669 Acc: 67.97%
Step 11000 | Loss: 0.8526 Acc: 67.85%
Step 11100 | Loss: 0.8557 Acc: 68.50%
Step 11200 | Loss: 0.8672 Acc: 66.82%
Step 11300 | Loss: 0.8279 Acc: 69.80%
Step 11400 | Loss: 0.8633 Acc: 68.63%
Step 11500 | Loss: 0.8370 Acc: 68.63%
Step 11600 | Loss: 0.8619 Acc: 69.09%
Step 11700 | Loss: 0.8615 Acc: 67.43%
Step 11800 | Loss: 0.8581 Acc: 68.43%
Step 11900 | Loss: 0.8372 Acc: 71.84%
Step 12000 | Loss: 0.8501 Acc: 69.22%
Step 12100 | Loss: 0.8587 Acc: 69.41%
Step 12200 | Loss: 0.8621 Acc: 68.91%
Step 12300 | Loss: 0.8562 Acc: 67.94%
Step 12400 | Loss: 0.8389 Acc: 70.45%
Step 12500 | Loss: 0.8926 Acc: 68.01%
Step 12600 | Loss: 0.8331 Acc: 71.31%
Step 12700 | Loss: 0.8779 Acc: 68.34%
Step 12800 | Loss: 0.8641 Acc: 68.07%
Step 12900 | Loss: 0.8334 Acc: 69.44%
Step 13000 | Loss: 0.8445 Acc: 68.33%
Step 13100 | Loss: 0.8694 Acc: 68.17%
Step 13200 | Loss: 0.8358 Acc: 69.61%
Step 13300 | Loss: 0.8513 Acc: 70.02%
Step 13400 | Loss: 0.8302 Acc: 70.90%
Step 13500 | Loss: 0.8498 Acc: 68.40%
Step 13600 | Loss: 0.8548 Acc: 69.33%
Step 13700 | Loss: 0.9044 Acc: 65.75%
Step 13800 | Loss: 0.8348 Acc: 70.24%
Step 13900 | Loss: 0.8685 Acc: 67.60%
Step 14000 | Loss: 0.8311 Acc: 69.71%
Step 14100 | Loss: 0.8499 Acc: 68.11%
Step 14200 | Loss: 0.8521 Acc: 70.99%
Step 14300 | Loss: 0.8085 Acc: 71.92%
Step 14400 | Loss: 0.8717 Acc: 68.59%
Step 14500 | Loss: 0.8056 Acc: 72.93%
Step 14600 | Loss: 0.8277 Acc: 71.21%
Step 14700 | Loss: 0.8471 Acc: 68.98%
Step 14800 | Loss: 0.8661 Acc: 68.02%
Step 14900 | Loss: 0.8541 Acc: 68.51%
Step 15000 | Loss: 0.8560 Acc: 69.20% | 0.0: 339/500 | 1.x: 211/500 | 2.x: 144/500 | 3.x: 87/500 | 4.x+: 47/500 | Total: 828/2500
Step 15100 | Loss: 0.8443 Acc: 69.63%
Step 15200 | Loss: 0.8338 Acc: 69.15%
Step 15300 | Loss: 0.8362 Acc: 72.00%
Step 15400 | Loss: 0.8332 Acc: 69.68%
Step 15500 | Loss: 0.8560 Acc: 71.38%
Step 15600 | Loss: 0.8444 Acc: 70.57%
Step 15700 | Loss: 0.8389 Acc: 70.96%
Step 15800 | Loss: 0.8461 Acc: 68.45%
Step 15900 | Loss: 0.8775 Acc: 69.53%
Step 16000 | Loss: 0.8731 Acc: 68.67%
Step 16100 | Loss: 0.8557 Acc: 67.97%
Step 16200 | Loss: 0.8279 Acc: 70.17%
Step 16300 | Loss: 0.8399 Acc: 69.06%
Step 16400 | Loss: 0.8562 Acc: 69.19%
Step 16500 | Loss: 0.8339 Acc: 71.87%
Step 16600 | Loss: 0.8247 Acc: 71.46%
Step 16700 | Loss: 0.8538 Acc: 70.73%
Step 16800 | Loss: 0.8327 Acc: 69.82%
Step 16900 | Loss: 0.8170 Acc: 71.47%
Step 17000 | Loss: 0.8251 Acc: 72.51%
Step 17100 | Loss: 0.8307 Acc: 72.08%
Step 17200 | Loss: 0.8329 Acc: 70.15%
Step 17300 | Loss: 0.8459 Acc: 68.63%
Step 17400 | Loss: 0.8531 Acc: 69.28%
Step 17500 | Loss: 0.8168 Acc: 71.83%
Step 17600 | Loss: 0.8628 Acc: 69.06%
Step 17700 | Loss: 0.8092 Acc: 72.16%
Step 17800 | Loss: 0.8317 Acc: 71.28%
Step 17900 | Loss: 0.8214 Acc: 71.98%
Step 18000 | Loss: 0.8027 Acc: 72.56%
Step 18100 | Loss: 0.8444 Acc: 69.18%
Step 18200 | Loss: 0.7966 Acc: 72.41%
Step 18300 | Loss: 0.8146 Acc: 71.07%
Step 18400 | Loss: 0.8431 Acc: 71.33%
Step 18500 | Loss: 0.8338 Acc: 71.55%
Step 18600 | Loss: 0.8343 Acc: 70.49%
Step 18700 | Loss: 0.8061 Acc: 71.33%
Step 18800 | Loss: 0.8328 Acc: 70.19%
Step 18900 | Loss: 0.8695 Acc: 70.36%
Step 19000 | Loss: 0.8484 Acc: 70.41%
Step 19100 | Loss: 0.7957 Acc: 73.43%
Step 19200 | Loss: 0.8386 Acc: 69.61%
Step 19300 | Loss: 0.8381 Acc: 69.94%
Step 19400 | Loss: 0.7949 Acc: 73.84%
Step 19500 | Loss: 0.8327 Acc: 71.57%
Step 19600 | Loss: 0.8344 Acc: 70.07%
Step 19700 | Loss: 0.8248 Acc: 72.07%
Step 19800 | Loss: 0.8223 Acc: 72.00%
Step 19900 | Loss: 0.8175 Acc: 71.92%

============================================================
Step 20000: Entering Phase 2: Medium-Hard+ (2.0+)
Training pool: 892000 puzzles
============================================================

Step 20000 | Loss: 0.7791 Acc: 74.69% | 0.0: 408/500 | 1.x: 315/500 | 2.x: 222/500 | 3.x: 175/500 | 4.x+: 142/500 | Total: 1262/2500
Step 20100 | Loss: 0.7907 Acc: 73.18%
Step 20200 | Loss: 0.7419 Acc: 76.73%
Step 20300 | Loss: 0.7826 Acc: 75.31%
Step 20400 | Loss: 0.7927 Acc: 72.14%
Step 20500 | Loss: 0.8285 Acc: 73.09%
Step 20600 | Loss: 0.7677 Acc: 73.89%
Step 20700 | Loss: 0.8047 Acc: 71.04%
Step 20800 | Loss: 0.7920 Acc: 74.24%
Step 20900 | Loss: 0.8010 Acc: 73.28%
Step 21000 | Loss: 0.7650 Acc: 74.06%
Step 21100 | Loss: 0.7656 Acc: 75.14%
Step 21200 | Loss: 0.7569 Acc: 76.42%
Step 21300 | Loss: 0.7893 Acc: 75.21%
Step 21400 | Loss: 0.7877 Acc: 72.42%
Step 21500 | Loss: 0.7751 Acc: 74.21%
Step 21600 | Loss: 0.8084 Acc: 73.18%
Step 21700 | Loss: 0.8025 Acc: 72.31%
Step 21800 | Loss: 0.7860 Acc: 74.33%
Step 21900 | Loss: 0.7577 Acc: 74.75%
Step 22000 | Loss: 0.7787 Acc: 74.52%
Step 22100 | Loss: 0.7826 Acc: 76.30%
Step 22200 | Loss: 0.7459 Acc: 77.45%
Step 22300 | Loss: 0.7458 Acc: 77.06%
Step 22400 | Loss: 0.7732 Acc: 75.09%
Step 22500 | Loss: 0.7615 Acc: 76.18%
Step 22600 | Loss: 0.7745 Acc: 75.67%
Step 22700 | Loss: 0.8282 Acc: 70.05%
Step 22800 | Loss: 0.7918 Acc: 72.39%
Step 22900 | Loss: 0.7552 Acc: 76.25%
Step 23000 | Loss: 0.7643 Acc: 76.85%
Step 23100 | Loss: 0.7308 Acc: 78.38%
Step 23200 | Loss: 0.7936 Acc: 72.13%
Step 23300 | Loss: 0.7612 Acc: 76.06%
Step 23400 | Loss: 0.7925 Acc: 75.99%
Step 23500 | Loss: 0.7966 Acc: 73.18%
Step 23600 | Loss: 0.7705 Acc: 75.49%
Step 23700 | Loss: 0.7554 Acc: 75.86%
Step 23800 | Loss: 0.7823 Acc: 73.62%
Step 23900 | Loss: 0.7511 Acc: 76.24%
Step 24000 | Loss: 0.7891 Acc: 72.33%
Step 24100 | Loss: 0.7721 Acc: 74.03%
Step 24200 | Loss: 0.8079 Acc: 73.82%
Step 24300 | Loss: 0.7271 Acc: 78.11%
Step 24400 | Loss: 0.7805 Acc: 74.36%
Step 24500 | Loss: 0.7595 Acc: 74.94%
Step 24600 | Loss: 0.8135 Acc: 73.23%
Step 24700 | Loss: 0.8043 Acc: 73.14%
Step 24800 | Loss: 0.7690 Acc: 75.28%
Step 24900 | Loss: 0.7949 Acc: 72.95%
Step 25000 | Loss: 0.7405 Acc: 77.01% | 0.0: 439/500 | 1.x: 295/500 | 2.x: 235/500 | 3.x: 166/500 | 4.x+: 127/500 | Total: 1262/2500
Step 25100 | Loss: 0.7676 Acc: 75.85%
Step 25200 | Loss: 0.7661 Acc: 74.67%
Step 25300 | Loss: 0.7582 Acc: 75.18%
Step 25400 | Loss: 0.7522 Acc: 76.76%
Step 25500 | Loss: 0.7784 Acc: 74.86%
Step 25600 | Loss: 0.7384 Acc: 76.62%
Step 25700 | Loss: 0.7889 Acc: 73.07%
Step 25800 | Loss: 0.7813 Acc: 72.49%
Step 25900 | Loss: 0.7489 Acc: 77.08%
Step 26000 | Loss: 0.7720 Acc: 75.88%
Step 26100 | Loss: 0.7675 Acc: 75.01%
Step 26200 | Loss: 0.7513 Acc: 75.87%
Step 26300 | Loss: 0.7217 Acc: 79.02%
Step 26400 | Loss: 0.7673 Acc: 75.21%
Step 26500 | Loss: 0.7670 Acc: 75.01%
Step 26600 | Loss: 0.8030 Acc: 74.40%
Step 26700 | Loss: 0.7485 Acc: 76.76%
Step 26800 | Loss: 0.7635 Acc: 78.54%
Step 26900 | Loss: 0.7649 Acc: 75.38%
Step 27000 | Loss: 0.7837 Acc: 76.39%
Step 27100 | Loss: 0.7442 Acc: 77.51%
Step 27200 | Loss: 0.7700 Acc: 76.38%
Step 27300 | Loss: 0.7644 Acc: 77.45%
Step 27400 | Loss: 0.7363 Acc: 76.88%
Step 27500 | Loss: 0.7688 Acc: 75.85%
Step 27600 | Loss: 0.7462 Acc: 76.56%
Step 27700 | Loss: 0.7872 Acc: 76.07%
Step 27800 | Loss: 0.7630 Acc: 75.63%
Step 27900 | Loss: 0.7677 Acc: 77.36%
Step 28000 | Loss: 0.7712 Acc: 74.33%
Step 28100 | Loss: 0.7257 Acc: 77.87%
Step 28200 | Loss: 0.7711 Acc: 76.42%
Step 28300 | Loss: 0.7559 Acc: 75.62%
Step 28400 | Loss: 0.7817 Acc: 75.05%
Step 28500 | Loss: 0.7788 Acc: 73.62%
Step 28600 | Loss: 0.7448 Acc: 78.39%
Step 28700 | Loss: 0.7541 Acc: 76.14%
Step 28800 | Loss: 0.7443 Acc: 78.90%
Step 28900 | Loss: 0.7623 Acc: 75.66%
Step 29000 | Loss: 0.7890 Acc: 74.31%
Step 29100 | Loss: 0.7707 Acc: 74.92%
Step 29200 | Loss: 0.8428 Acc: 69.86%
Step 29300 | Loss: 0.7600 Acc: 75.94%
Step 29400 | Loss: 0.7904 Acc: 75.98%
Step 29500 | Loss: 0.7717 Acc: 76.66%
Step 29600 | Loss: 0.7343 Acc: 78.34%
Step 29700 | Loss: 0.8252 Acc: 72.70%
Step 29800 | Loss: 0.7420 Acc: 76.49%
Step 29900 | Loss: 0.7813 Acc: 74.74%
Step 30000 | Loss: 0.7740 Acc: 75.34% | 0.0: 447/500 | 1.x: 329/500 | 2.x: 234/500 | 3.x: 189/500 | 4.x+: 134/500 | Total: 1333/2500
Step 30100 | Loss: 0.7722 Acc: 76.59%
Step 30200 | Loss: 0.8114 Acc: 72.52%
Step 30300 | Loss: 0.7604 Acc: 75.35%
Step 30400 | Loss: 0.7472 Acc: 77.00%
Step 30500 | Loss: 0.7911 Acc: 76.32%
Step 30600 | Loss: 0.7680 Acc: 76.70%
Step 30700 | Loss: 0.7739 Acc: 74.98%
Step 30800 | Loss: 0.7571 Acc: 77.48%
Step 30900 | Loss: 0.7341 Acc: 77.11%
Step 31000 | Loss: 0.7437 Acc: 76.77%
Step 31100 | Loss: 0.7555 Acc: 77.46%
Step 31200 | Loss: 0.7720 Acc: 75.27%
Step 31300 | Loss: 0.7754 Acc: 76.97%
Step 31400 | Loss: 0.7723 Acc: 75.70%
Step 31500 | Loss: 0.7313 Acc: 77.45%
Step 31600 | Loss: 0.7229 Acc: 78.84%
Step 31700 | Loss: 0.7350 Acc: 77.37%
Step 31800 | Loss: 0.7574 Acc: 77.88%
Step 31900 | Loss: 0.7555 Acc: 76.22%
Step 32000 | Loss: 0.7330 Acc: 77.52%
Step 32100 | Loss: 0.7437 Acc: 77.24%
Step 32200 | Loss: 0.7352 Acc: 78.12%
Step 32300 | Loss: 0.7378 Acc: 78.91%
Step 32400 | Loss: 0.7565 Acc: 77.17%
Step 32500 | Loss: 0.7599 Acc: 76.90%
Step 32600 | Loss: 0.7330 Acc: 79.32%
Step 32700 | Loss: 0.7465 Acc: 77.45%
Step 32800 | Loss: 0.7425 Acc: 78.48%
Step 32900 | Loss: 0.7376 Acc: 78.63%
Step 33000 | Loss: 0.7767 Acc: 76.39%
Step 33100 | Loss: 0.7850 Acc: 74.37%
Step 33200 | Loss: 0.7996 Acc: 76.07%
Step 33300 | Loss: 0.7574 Acc: 78.10%
Step 33400 | Loss: 0.7425 Acc: 78.42%
Step 33500 | Loss: 0.8307 Acc: 71.09%
Step 33600 | Loss: 0.7829 Acc: 75.74%
Step 33700 | Loss: 0.7588 Acc: 77.41%
Step 33800 | Loss: 0.7168 Acc: 80.37%
Step 33900 | Loss: 0.7757 Acc: 77.52%
Step 34000 | Loss: 0.7461 Acc: 77.22%
Step 34100 | Loss: 0.7540 Acc: 77.11%
Step 34200 | Loss: 0.7637 Acc: 77.15%
Step 34300 | Loss: 0.7795 Acc: 74.59%
Step 34400 | Loss: 0.7684 Acc: 75.97%
Step 34500 | Loss: 0.7510 Acc: 77.90%
Step 34600 | Loss: 0.7412 Acc: 77.74%
Step 34700 | Loss: 0.8008 Acc: 74.39%
Step 34800 | Loss: 0.7575 Acc: 77.81%
Step 34900 | Loss: 0.7448 Acc: 77.21%
Step 35000 | Loss: 0.7448 Acc: 78.81% | 0.0: 459/500 | 1.x: 358/500 | 2.x: 303/500 | 3.x: 219/500 | 4.x+: 176/500 | Total: 1515/2500
Step 35100 | Loss: 0.7810 Acc: 76.62%
Step 35200 | Loss: 0.7875 Acc: 76.08%
Step 35300 | Loss: 0.8161 Acc: 72.99%
Step 35400 | Loss: 0.7879 Acc: 73.91%
Step 35500 | Loss: 0.7479 Acc: 75.86%
Step 35600 | Loss: 0.7515 Acc: 78.04%
Step 35700 | Loss: 0.7388 Acc: 77.98%
Step 35800 | Loss: 0.7413 Acc: 78.62%
Step 35900 | Loss: 0.7464 Acc: 78.53%
Step 36000 | Loss: 0.7395 Acc: 78.30%
Step 36100 | Loss: 0.7795 Acc: 75.97%
Step 36200 | Loss: 0.7254 Acc: 79.24%
Step 36300 | Loss: 0.8693 Acc: 69.83%
Step 36400 | Loss: 0.6958 Acc: 80.86%
Step 36500 | Loss: 0.7285 Acc: 79.61%
Step 36600 | Loss: 0.7575 Acc: 76.98%
Step 36700 | Loss: 0.7176 Acc: 80.82%
Step 36800 | Loss: 0.7724 Acc: 76.46%
Step 36900 | Loss: 0.7601 Acc: 77.05%
Step 37000 | Loss: 0.8011 Acc: 74.24%
Step 37100 | Loss: 0.7182 Acc: 79.69%
Step 37200 | Loss: 0.7412 Acc: 78.03%
Step 37300 | Loss: 0.7122 Acc: 80.75%
Step 37400 | Loss: 0.7283 Acc: 79.57%
Step 37500 | Loss: 0.7306 Acc: 79.69%
Step 37600 | Loss: 0.6910 Acc: 81.46%
Step 37700 | Loss: 0.7432 Acc: 78.25%
Step 37800 | Loss: 0.7212 Acc: 80.54%
Step 37900 | Loss: 0.7772 Acc: 74.86%
Step 38000 | Loss: 0.7308 Acc: 79.31%
Step 38100 | Loss: 0.7757 Acc: 75.36%
Step 38200 | Loss: 0.7732 Acc: 76.61%
Step 38300 | Loss: 0.7205 Acc: 79.55%
Step 38400 | Loss: 0.7613 Acc: 78.55%
Step 38500 | Loss: 0.7268 Acc: 79.09%
Step 38600 | Loss: 0.7092 Acc: 80.39%
Step 38700 | Loss: 0.7493 Acc: 77.48%
Step 38800 | Loss: 0.7160 Acc: 79.51%
Step 38900 | Loss: 0.7470 Acc: 77.84%
Step 39000 | Loss: 0.7220 Acc: 80.34%
Step 39100 | Loss: 0.7451 Acc: 77.76%
Step 39200 | Loss: 0.7136 Acc: 81.11%
Step 39300 | Loss: 0.7315 Acc: 79.37%
Step 39400 | Loss: 0.7714 Acc: 76.92%
Step 39500 | Loss: 0.6994 Acc: 81.97%
Step 39600 | Loss: 0.7242 Acc: 79.83%
Step 39700 | Loss: 0.7122 Acc: 81.04%
Step 39800 | Loss: 0.7590 Acc: 78.96%
Step 39900 | Loss: 0.6920 Acc: 81.26%

============================================================
Step 40000: Entering Phase 3: Medium+ (1.0+)
Training pool: 1703919 puzzles
============================================================

Step 40000 | Loss: 0.6394 Acc: 83.91% | 0.0: 482/500 | 1.x: 381/500 | 2.x: 325/500 | 3.x: 241/500 | 4.x+: 213/500 | Total: 1642/2500
Step 40100 | Loss: 0.6639 Acc: 83.98%
Step 40200 | Loss: 0.7294 Acc: 78.93%
Step 40300 | Loss: 0.6929 Acc: 81.24%
Step 40400 | Loss: 0.7643 Acc: 77.90%
Step 40500 | Loss: 0.6644 Acc: 83.00%
Step 40600 | Loss: 0.6433 Acc: 83.53%
Step 40700 | Loss: 0.6678 Acc: 82.51%
Step 40800 | Loss: 0.6413 Acc: 85.33%
Step 40900 | Loss: 0.6552 Acc: 83.41%
Step 41000 | Loss: 0.7507 Acc: 78.44%
Step 41100 | Loss: 0.6664 Acc: 82.40%
Step 41200 | Loss: 0.6840 Acc: 81.85%
Step 41300 | Loss: 0.6724 Acc: 82.86%
Step 41400 | Loss: 0.6524 Acc: 83.98%
Step 41500 | Loss: 0.7252 Acc: 80.35%
Step 41600 | Loss: 0.6501 Acc: 84.18%
Step 41700 | Loss: 0.6871 Acc: 80.97%
Step 41800 | Loss: 0.6680 Acc: 82.18%
Step 41900 | Loss: 0.6714 Acc: 81.97%
Step 42000 | Loss: 0.6463 Acc: 84.62%
Step 42100 | Loss: 0.6620 Acc: 83.32%
Step 42200 | Loss: 0.6636 Acc: 83.49%
Step 42300 | Loss: 0.6683 Acc: 82.22%
Step 42400 | Loss: 0.6810 Acc: 82.55%
Step 42500 | Loss: 0.6789 Acc: 82.16%
Step 42600 | Loss: 0.7374 Acc: 79.23%
Step 42700 | Loss: 0.6831 Acc: 81.96%
Step 42800 | Loss: 0.6194 Acc: 86.15%
Step 42900 | Loss: 0.7691 Acc: 77.60%
Step 43000 | Loss: 0.6065 Acc: 85.60%
Step 43100 | Loss: 0.6787 Acc: 82.39%
Step 43200 | Loss: 0.6290 Acc: 85.06%
Step 43300 | Loss: 0.7324 Acc: 80.06%
Step 43400 | Loss: 0.6462 Acc: 83.85%
Step 43500 | Loss: 0.6580 Acc: 82.59%
Step 43600 | Loss: 0.6281 Acc: 84.60%
Step 43700 | Loss: 0.7066 Acc: 80.65%
Step 43800 | Loss: 0.6534 Acc: 84.43%
Step 43900 | Loss: 0.7175 Acc: 79.14%
Step 44000 | Loss: 0.6414 Acc: 85.53%
Step 44100 | Loss: 0.6818 Acc: 83.09%
Step 44200 | Loss: 0.5871 Acc: 87.30%
Step 44300 | Loss: 0.6957 Acc: 81.22%
Step 44400 | Loss: 0.7014 Acc: 82.27%
Step 44500 | Loss: 0.6365 Acc: 85.54%
Step 44600 | Loss: 0.8003 Acc: 76.31%
Step 44700 | Loss: 0.7166 Acc: 80.38%
Step 44800 | Loss: 0.6240 Acc: 86.06%
Step 44900 | Loss: 0.6673 Acc: 83.05%
Step 45000 | Loss: 0.6484 Acc: 83.83% | 0.0: 482/500 | 1.x: 412/500 | 2.x: 344/500 | 3.x: 283/500 | 4.x+: 224/500 | Total: 1745/2500
Step 45100 | Loss: 0.7376 Acc: 79.86%
Step 45200 | Loss: 0.6586 Acc: 83.31%
Step 45300 | Loss: 0.6845 Acc: 80.37%
Step 45400 | Loss: 0.6272 Acc: 85.38%
Step 45500 | Loss: 0.6794 Acc: 83.25%
Step 45600 | Loss: 0.6701 Acc: 82.13%
Step 45700 | Loss: 0.6848 Acc: 81.71%
Step 45800 | Loss: 0.6192 Acc: 86.64%
Step 45900 | Loss: 0.6486 Acc: 84.54%
Step 46000 | Loss: 0.6670 Acc: 82.28%
Step 46100 | Loss: 0.6487 Acc: 83.90%
Step 46200 | Loss: 0.6654 Acc: 83.27%
Step 46300 | Loss: 0.6730 Acc: 82.82%
Step 46400 | Loss: 0.6755 Acc: 82.69%
Step 46500 | Loss: 0.5955 Acc: 85.96%
Step 46600 | Loss: 0.6813 Acc: 83.07%
Step 46700 | Loss: 0.7565 Acc: 77.33%
Step 46800 | Loss: 0.6943 Acc: 81.37%
Step 46900 | Loss: 0.6208 Acc: 86.03%
Step 47000 | Loss: 0.6866 Acc: 82.22%
Step 47100 | Loss: 0.7258 Acc: 81.17%
Step 47200 | Loss: 0.6273 Acc: 84.98%
Step 47300 | Loss: 0.6896 Acc: 81.06%
Step 47400 | Loss: 0.6704 Acc: 83.02%
Step 47500 | Loss: 0.6565 Acc: 84.19%
Step 47600 | Loss: 0.6638 Acc: 83.49%
Step 47700 | Loss: 0.6785 Acc: 82.70%
Step 47800 | Loss: 0.6251 Acc: 86.27%
Step 47900 | Loss: 0.6649 Acc: 83.49%
Step 48000 | Loss: 0.6852 Acc: 82.44%
Step 48100 | Loss: 0.7299 Acc: 80.20%
Step 48200 | Loss: 0.6379 Acc: 84.51%
Step 48300 | Loss: 0.6273 Acc: 85.72%
Step 48400 | Loss: 0.6161 Acc: 84.79%
Step 48500 | Loss: 0.6124 Acc: 85.79%
Step 48600 | Loss: 0.6405 Acc: 85.08%
Step 48700 | Loss: 0.6617 Acc: 84.12%
Step 48800 | Loss: 0.6264 Acc: 85.29%
Step 48900 | Loss: 0.6611 Acc: 83.38%
Step 49000 | Loss: 0.6598 Acc: 83.47%
Step 49100 | Loss: 0.6523 Acc: 84.39%
Step 49200 | Loss: 0.6250 Acc: 85.37%
Step 49300 | Loss: 0.6770 Acc: 82.88%
Step 49400 | Loss: 0.6403 Acc: 84.72%
Step 49500 | Loss: 0.6967 Acc: 81.23%
Step 49600 | Loss: 0.6099 Acc: 86.12%
Step 49700 | Loss: 0.7079 Acc: 82.00%
Step 49800 | Loss: 0.6281 Acc: 85.10%
Step 49900 | Loss: 0.6617 Acc: 83.83%
Step 50000 | Loss: 0.5833 Acc: 87.81% | 0.0: 485/500 | 1.x: 408/500 | 2.x: 343/500 | 3.x: 281/500 | 4.x+: 253/500 | Total: 1770/2500
Step 50100 | Loss: 0.6586 Acc: 84.17%
Step 50200 | Loss: 0.6749 Acc: 81.78%
Step 50300 | Loss: 0.6344 Acc: 84.25%
Step 50400 | Loss: 0.6243 Acc: 85.92%
Step 50500 | Loss: 0.6302 Acc: 86.12%
Step 50600 | Loss: 0.7094 Acc: 81.91%
Step 50700 | Loss: 0.6204 Acc: 84.92%
Step 50800 | Loss: 0.6723 Acc: 82.79%
Step 50900 | Loss: 0.6283 Acc: 85.18%
Step 51000 | Loss: 0.7174 Acc: 81.34%
Step 51100 | Loss: 0.6018 Acc: 87.26%
Step 51200 | Loss: 0.6893 Acc: 82.47%
Step 51300 | Loss: 0.7089 Acc: 80.93%
Step 51400 | Loss: 0.6582 Acc: 83.83%
Step 51500 | Loss: 0.6448 Acc: 84.60%
Step 51600 | Loss: 0.6570 Acc: 82.74%
Step 51700 | Loss: 0.6333 Acc: 85.21%
Step 51800 | Loss: 0.6901 Acc: 83.20%
Step 51900 | Loss: 0.5848 Acc: 87.32%
Step 52000 | Loss: 0.6440 Acc: 83.71%
Step 52100 | Loss: 0.6142 Acc: 85.90%
Step 52200 | Loss: 0.8294 Acc: 74.90%
Step 52300 | Loss: 0.6200 Acc: 85.12%
Step 52400 | Loss: 0.6666 Acc: 82.92%
Step 52500 | Loss: 0.6479 Acc: 83.74%
Step 52600 | Loss: 0.7082 Acc: 80.85%
Step 52700 | Loss: 0.6256 Acc: 85.72%
Step 52800 | Loss: 0.6953 Acc: 82.03%
Step 52900 | Loss: 0.6424 Acc: 84.43%
Step 53000 | Loss: 0.6140 Acc: 85.81%
Step 53100 | Loss: 0.6707 Acc: 84.36%
Step 53200 | Loss: 0.6851 Acc: 81.70%
Step 53300 | Loss: 0.7198 Acc: 81.21%
Step 53400 | Loss: 0.6404 Acc: 84.08%
Step 53500 | Loss: 0.6409 Acc: 85.36%
Step 53600 | Loss: 0.6436 Acc: 85.27%
Step 53700 | Loss: 0.6945 Acc: 82.83%
Step 53800 | Loss: 0.6274 Acc: 84.99%
Step 53900 | Loss: 0.6767 Acc: 82.36%
Step 54000 | Loss: 0.6855 Acc: 82.47%
Step 54100 | Loss: 0.6376 Acc: 84.31%
Step 54200 | Loss: 0.6617 Acc: 84.39%
Step 54300 | Loss: 0.6645 Acc: 83.25%
Step 54400 | Loss: 0.5926 Acc: 87.84%
Step 54500 | Loss: 0.6425 Acc: 84.88%
Step 54600 | Loss: 0.6305 Acc: 85.36%
Step 54700 | Loss: 0.6188 Acc: 85.35%
Step 54800 | Loss: 0.6119 Acc: 86.25%
Step 54900 | Loss: 0.7007 Acc: 82.03%
Step 55000 | Loss: 0.6557 Acc: 84.48% | 0.0: 465/500 | 1.x: 389/500 | 2.x: 330/500 | 3.x: 283/500 | 4.x+: 234/500 | Total: 1701/2500
Step 55100 | Loss: 0.5671 Acc: 88.63%
Step 55200 | Loss: 0.6195 Acc: 85.40%
Step 55300 | Loss: 0.7092 Acc: 81.24%
Step 55400 | Loss: 0.6616 Acc: 83.87%
Step 55500 | Loss: 0.6589 Acc: 83.44%
Step 55600 | Loss: 0.7078 Acc: 80.74%
Step 55700 | Loss: 0.6324 Acc: 85.49%
Step 55800 | Loss: 0.5816 Acc: 87.16%
Step 55900 | Loss: 0.6398 Acc: 84.64%
Step 56000 | Loss: 0.6587 Acc: 83.85%
Step 56100 | Loss: 0.6594 Acc: 83.35%
Step 56200 | Loss: 0.6528 Acc: 84.02%
Step 56300 | Loss: 0.6494 Acc: 84.20%
Step 56400 | Loss: 0.6495 Acc: 83.25%
Step 56500 | Loss: 0.6511 Acc: 83.94%
Step 56600 | Loss: 0.6627 Acc: 83.31%
Step 56700 | Loss: 0.6683 Acc: 83.49%
Step 56800 | Loss: 0.5790 Acc: 87.32%
Step 56900 | Loss: 0.7461 Acc: 79.19%
Step 57000 | Loss: 0.6849 Acc: 82.91%
Step 57100 | Loss: 0.6295 Acc: 84.98%
Step 57200 | Loss: 0.6220 Acc: 85.58%
Step 57300 | Loss: 0.6208 Acc: 85.09%
Step 57400 | Loss: 0.6075 Acc: 85.57%
Step 57500 | Loss: 0.6179 Acc: 85.22%
Step 57600 | Loss: 0.6688 Acc: 83.80%
Step 57700 | Loss: 0.6466 Acc: 83.84%
Step 57800 | Loss: 0.5688 Acc: 86.62%
Step 57900 | Loss: 0.6721 Acc: 83.79%
Step 58000 | Loss: 0.6114 Acc: 85.44%
Step 58100 | Loss: 0.6582 Acc: 83.76%
Step 58200 | Loss: 0.6408 Acc: 84.22%
Step 58300 | Loss: 0.6033 Acc: 85.77%
Step 58400 | Loss: 0.7551 Acc: 78.74%
Step 58500 | Loss: 0.6136 Acc: 86.13%
Step 58600 | Loss: 0.6006 Acc: 86.26%
Step 58700 | Loss: 0.6701 Acc: 84.22%
Step 58800 | Loss: 0.6664 Acc: 82.79%
Step 58900 | Loss: 0.6515 Acc: 84.31%
Step 59000 | Loss: 0.6436 Acc: 83.74%
Step 59100 | Loss: 0.6412 Acc: 83.61%
Step 59200 | Loss: 0.6094 Acc: 85.45%
Step 59300 | Loss: 0.6713 Acc: 82.70%
Step 59400 | Loss: 0.5767 Acc: 87.38%
Step 59500 | Loss: 0.6149 Acc: 85.63%
Step 59600 | Loss: 0.6769 Acc: 81.93%
Step 59700 | Loss: 0.6221 Acc: 85.60%
Step 59800 | Loss: 0.6227 Acc: 84.86%
Step 59900 | Loss: 0.7084 Acc: 81.09%

============================================================
Step 60000: Entering Phase 4: All (0.0+)
Training pool: 2997500 puzzles
============================================================

Step 60000 | Loss: 0.5314 Acc: 89.47% | 0.0: 480/500 | 1.x: 403/500 | 2.x: 348/500 | 3.x: 297/500 | 4.x+: 260/500 | Total: 1788/2500
Step 60100 | Loss: 0.5058 Acc: 89.84%
Step 60200 | Loss: 0.6548 Acc: 85.08%
Step 60300 | Loss: 0.6849 Acc: 83.08%
Step 60400 | Loss: 0.5729 Acc: 88.02%
Step 60500 | Loss: 0.4965 Acc: 91.05%
Step 60600 | Loss: 0.6046 Acc: 86.41%
Step 60700 | Loss: 0.7392 Acc: 81.05%
Step 60800 | Loss: 0.5139 Acc: 89.59%
Step 60900 | Loss: 0.5716 Acc: 88.42%
Step 61000 | Loss: 0.5812 Acc: 88.22%
Step 61100 | Loss: 0.5551 Acc: 88.44%
Step 61200 | Loss: 0.5602 Acc: 87.52%
Step 61300 | Loss: 0.5573 Acc: 88.65%
Step 61400 | Loss: 0.5563 Acc: 88.07%
Step 61500 | Loss: 0.6941 Acc: 81.70%
Step 61600 | Loss: 0.6582 Acc: 84.05%
Step 61700 | Loss: 0.6510 Acc: 84.41%
Step 61800 | Loss: 0.5545 Acc: 88.36%
Step 61900 | Loss: 0.5478 Acc: 87.41%
Step 62000 | Loss: 0.5751 Acc: 86.71%
Step 62100 | Loss: 0.5633 Acc: 87.87%
Step 62200 | Loss: 0.5858 Acc: 86.99%
Step 62300 | Loss: 0.6186 Acc: 86.48%
Step 62400 | Loss: 0.5369 Acc: 89.05%
Step 62500 | Loss: 0.5636 Acc: 88.35%
Step 62600 | Loss: 0.5771 Acc: 87.29%
Step 62700 | Loss: 0.6182 Acc: 85.73%
Step 62800 | Loss: 0.5588 Acc: 88.14%
Step 62900 | Loss: 0.5837 Acc: 87.27%
Step 63000 | Loss: 0.5724 Acc: 87.00%
Step 63100 | Loss: 0.5591 Acc: 87.96%
Step 63200 | Loss: 0.6855 Acc: 83.45%
Step 63300 | Loss: 0.5469 Acc: 88.55%
Step 63400 | Loss: 0.7072 Acc: 81.77%
Step 63500 | Loss: 0.5533 Acc: 88.18%
Step 63600 | Loss: 0.6287 Acc: 84.98%
Step 63700 | Loss: 0.6291 Acc: 85.34%
Step 63800 | Loss: 1.0555 Acc: 63.96%
Step 63900 | Loss: 0.5576 Acc: 87.88%
Step 64000 | Loss: 0.5398 Acc: 88.14%
Step 64100 | Loss: 0.6317 Acc: 85.59%
Step 64200 | Loss: 0.5238 Acc: 89.33%
Step 64300 | Loss: 0.6961 Acc: 82.65%
Step 64400 | Loss: 0.5904 Acc: 87.43%
Step 64500 | Loss: 0.5476 Acc: 88.60%
Step 64600 | Loss: 0.6151 Acc: 86.07%
Step 64700 | Loss: 0.6741 Acc: 83.29%
Step 64800 | Loss: 0.5643 Acc: 88.00%
Step 64900 | Loss: 0.6452 Acc: 84.54%
Step 65000 | Loss: 0.5952 Acc: 87.08% | 0.0: 455/500 | 1.x: 366/500 | 2.x: 296/500 | 3.x: 266/500 | 4.x+: 214/500 | Total: 1597/2500
Step 65100 | Loss: 0.5816 Acc: 87.32%
Step 65200 | Loss: 0.5756 Acc: 87.17%
Step 65300 | Loss: 0.5442 Acc: 88.68%
Step 65400 | Loss: 0.6007 Acc: 86.69%
Step 65500 | Loss: 0.5507 Acc: 88.64%
Step 65600 | Loss: 0.6496 Acc: 85.77%
Step 65700 | Loss: 0.5771 Acc: 86.94%
Step 65800 | Loss: 0.4951 Acc: 90.25%
Step 65900 | Loss: 0.5238 Acc: 90.07%
Step 66000 | Loss: 0.5768 Acc: 87.05%
Step 66100 | Loss: 0.7301 Acc: 81.61%
Step 66200 | Loss: 0.5852 Acc: 87.79%
Step 66300 | Loss: 0.5452 Acc: 88.68%
Step 66400 | Loss: 0.5624 Acc: 87.67%
Step 66500 | Loss: 0.5879 Acc: 86.46%
Step 66600 | Loss: 0.5419 Acc: 88.40%
Step 66700 | Loss: 0.6760 Acc: 83.11%
Step 66800 | Loss: 0.6287 Acc: 85.25%
Step 66900 | Loss: 1.0063 Acc: 73.67%
Step 67000 | Loss: 0.6835 Acc: 82.99%
Step 67100 | Loss: 0.5757 Acc: 87.06%
Step 67200 | Loss: 0.6036 Acc: 86.25%
Step 67300 | Loss: 0.6155 Acc: 86.12%
Step 67400 | Loss: 0.5781 Acc: 88.32%
Step 67500 | Loss: 0.5936 Acc: 86.49%
Step 67600 | Loss: 0.6392 Acc: 84.94%
Step 67700 | Loss: 0.6792 Acc: 82.81%
Step 67800 | Loss: 0.5267 Acc: 89.51%
Step 67900 | Loss: 0.6475 Acc: 85.01%
Step 68000 | Loss: 0.5003 Acc: 90.23%
Step 68100 | Loss: 0.6432 Acc: 85.30%
Step 68200 | Loss: 0.6764 Acc: 83.20%
Step 68300 | Loss: 0.6126 Acc: 85.78%
Step 68400 | Loss: 0.6434 Acc: 85.11%
Step 68500 | Loss: 0.8146 Acc: 77.07%
Step 68600 | Loss: 0.5899 Acc: 86.52%
Step 68700 | Loss: 0.5754 Acc: 87.42%
Step 68800 | Loss: 0.5571 Acc: 88.46%
Step 68900 | Loss: 0.6422 Acc: 85.20%
Step 69000 | Loss: 0.5028 Acc: 91.04%
Step 69100 | Loss: 0.7045 Acc: 82.23%
Step 69200 | Loss: 0.6332 Acc: 85.13%
Step 69300 | Loss: 0.5712 Acc: 87.89%
Step 69400 | Loss: 0.5773 Acc: 87.81%
Step 69500 | Loss: 0.6654 Acc: 84.31%
Step 69600 | Loss: 0.5885 Acc: 86.79%
Step 69700 | Loss: 0.5299 Acc: 88.70%
Step 69800 | Loss: 0.7272 Acc: 80.95%
Step 69900 | Loss: 0.6528 Acc: 83.47%
Step 70000 | Loss: 0.5901 Acc: 86.99% | 0.0: 451/500 | 1.x: 357/500 | 2.x: 288/500 | 3.x: 248/500 | 4.x+: 200/500 | Total: 1544/2500
Step 70100 | Loss: 0.6098 Acc: 86.40%
Step 70200 | Loss: 0.5440 Acc: 88.20%
Step 70300 | Loss: 0.6584 Acc: 84.11%
Step 70400 | Loss: 0.5662 Acc: 88.53%
Step 70500 | Loss: 0.6662 Acc: 83.72%
Step 70600 | Loss: 0.6065 Acc: 86.12%
Step 70700 | Loss: 0.5853 Acc: 86.95%
Step 70800 | Loss: 0.5406 Acc: 88.28%
Step 70900 | Loss: 0.5667 Acc: 87.57%
Step 71000 | Loss: 0.6303 Acc: 85.42%
Step 71100 | Loss: 0.6358 Acc: 84.96%
Step 71200 | Loss: 0.5203 Acc: 89.51%
Step 71300 | Loss: 0.5591 Acc: 88.71%
Step 71400 | Loss: 0.5769 Acc: 87.07%
Step 71500 | Loss: 0.5633 Acc: 87.70%
Step 71600 | Loss: 0.7834 Acc: 77.37%
Step 71700 | Loss: 0.6330 Acc: 85.17%
Step 71800 | Loss: 0.5851 Acc: 86.88%
Step 71900 | Loss: 0.7063 Acc: 81.77%
Step 72000 | Loss: 0.5496 Acc: 89.09%
Step 72100 | Loss: 0.6070 Acc: 86.53%
Step 72200 | Loss: 0.5404 Acc: 89.15%
Step 72300 | Loss: 0.7842 Acc: 78.62%
Step 72400 | Loss: 0.5169 Acc: 90.14%
Step 72500 | Loss: 0.6064 Acc: 86.87%
Step 72600 | Loss: 0.9985 Acc: 66.83%
Step 72700 | Loss: 0.5700 Acc: 87.15%
Step 72800 | Loss: 0.5740 Acc: 87.50%
Step 72900 | Loss: 0.6485 Acc: 84.26%
Step 73000 | Loss: 0.5631 Acc: 87.92%
Step 73100 | Loss: 0.4941 Acc: 90.47%
Step 73200 | Loss: 0.6778 Acc: 83.91%
Step 73300 | Loss: 0.6534 Acc: 84.28%
Step 73400 | Loss: 0.6086 Acc: 86.82%
Step 73500 | Loss: 0.5532 Acc: 87.60%
Step 73600 | Loss: 0.5271 Acc: 89.28%
Step 73700 | Loss: 0.5868 Acc: 87.44%
Step 73800 | Loss: 0.5800 Acc: 87.56%
Step 73900 | Loss: 0.5672 Acc: 87.66%
Step 74000 | Loss: 0.6126 Acc: 86.22%
Step 74100 | Loss: 0.6179 Acc: 85.38%
Step 74200 | Loss: 1.3067 Acc: 50.26%
Step 74300 | Loss: 0.5394 Acc: 90.18%
Step 74400 | Loss: 0.5982 Acc: 86.07%
Step 74500 | Loss: 0.5714 Acc: 87.77%
Step 74600 | Loss: 0.5251 Acc: 89.55%
Step 74700 | Loss: 0.6955 Acc: 82.75%
Step 74800 | Loss: 0.5299 Acc: 88.79%
Step 74900 | Loss: 0.6538 Acc: 84.27%
Step 75000 | Loss: 0.6698 Acc: 84.53% | 0.0: 414/500 | 1.x: 327/500 | 2.x: 264/500 | 3.x: 223/500 | 4.x+: 182/500 | Total: 1410/2500
Step 75100 | Loss: 0.6985 Acc: 83.34%
Step 75200 | Loss: 0.6433 Acc: 85.54%
Step 75300 | Loss: 0.5828 Acc: 86.63%
Step 75400 | Loss: 0.5949 Acc: 87.81%
Step 75500 | Loss: 0.6056 Acc: 86.70%
Step 75600 | Loss: 0.5976 Acc: 86.89%
Step 75700 | Loss: 0.6574 Acc: 83.50%
Step 75800 | Loss: 0.5608 Acc: 88.37%
Step 75900 | Loss: 0.5622 Acc: 87.74%
Step 76000 | Loss: 0.5711 Acc: 88.85%
Step 76100 | Loss: 0.6981 Acc: 82.73%
Step 76200 | Loss: 0.7230 Acc: 81.23%
Step 76300 | Loss: 0.5886 Acc: 87.72%
Step 76400 | Loss: 0.5816 Acc: 87.38%
Step 76500 | Loss: 0.5895 Acc: 88.24%
Step 76600 | Loss: 0.5564 Acc: 88.15%
Step 76700 | Loss: 0.5519 Acc: 89.07%
Step 76800 | Loss: 0.5762 Acc: 86.97%
Step 76900 | Loss: 0.6028 Acc: 87.07%
Step 77000 | Loss: 0.6141 Acc: 85.38%
Step 77100 | Loss: 0.5626 Acc: 88.06%
Step 77200 | Loss: 0.5386 Acc: 88.50%
Step 77300 | Loss: 0.5897 Acc: 87.54%
Step 77400 | Loss: 0.5708 Acc: 87.04%
Step 77500 | Loss: 0.4758 Acc: 90.79%
Step 77600 | Loss: 0.5136 Acc: 90.64%
Step 77700 | Loss: 0.7392 Acc: 81.34%
Step 77800 | Loss: 0.6783 Acc: 84.13%
Step 77900 | Loss: 0.8608 Acc: 75.89%
Step 78000 | Loss: 0.6206 Acc: 85.64%
Step 78100 | Loss: 0.6181 Acc: 85.55%
Step 78200 | Loss: 0.6605 Acc: 83.52%
Step 78300 | Loss: 0.5074 Acc: 90.29%
Step 78400 | Loss: 0.8039 Acc: 76.06%
Step 78500 | Loss: 0.5752 Acc: 87.35%
Step 78600 | Loss: 0.8114 Acc: 77.67%
Step 78700 | Loss: 0.5748 Acc: 87.31%
Step 78800 | Loss: 0.9492 Acc: 70.21%
Step 78900 | Loss: 0.5790 Acc: 86.76%
Step 79000 | Loss: 0.6284 Acc: 85.19%
Step 79100 | Loss: 0.5513 Acc: 88.00%
Step 79200 | Loss: 0.6696 Acc: 83.32%
Step 79300 | Loss: 0.7307 Acc: 81.34%
Step 79400 | Loss: 0.5055 Acc: 90.18%
Step 79500 | Loss: 0.5836 Acc: 87.37%
Step 79600 | Loss: 0.5655 Acc: 88.24%
Step 79700 | Loss: 0.5801 Acc: 87.59%
Step 79800 | Loss: 0.6238 Acc: 85.21%
Step 79900 | Loss: 0.5280 Acc: 88.77%

============================================================
Step 80000: Entering Phase 5: All (0.0+)
Training pool: 2997500 puzzles
============================================================

Step 80000 | Loss: 0.7085 Acc: 82.10% | 0.0: 389/500 | 1.x: 297/500 | 2.x: 240/500 | 3.x: 188/500 | 4.x+: 159/500 | Total: 1273/2500
Step 80100 | Loss: 0.6406 Acc: 83.88%
Step 80200 | Loss: 0.6351 Acc: 85.14%
Step 80300 | Loss: 0.4961 Acc: 90.52%
Step 80400 | Loss: 0.9339 Acc: 69.40%
Step 80500 | Loss: 0.5772 Acc: 87.67%
Step 80600 | Loss: 1.0865 Acc: 64.63%
Step 80700 | Loss: 0.6201 Acc: 85.15%
Step 80800 | Loss: 0.5635 Acc: 89.34%
Step 80900 | Loss: 0.5418 Acc: 88.05%
Step 81000 | Loss: 0.6256 Acc: 85.32%
Step 81100 | Loss: 0.5861 Acc: 87.50%
Step 81200 | Loss: 0.5989 Acc: 87.05%
Step 81300 | Loss: 0.6121 Acc: 86.33%
Step 81400 | Loss: 0.5678 Acc: 87.86%
Step 81500 | Loss: 0.5974 Acc: 86.36%
Step 81600 | Loss: 0.5569 Acc: 87.68%
Step 81700 | Loss: 0.6102 Acc: 87.41%
Step 81800 | Loss: 0.7970 Acc: 80.33%
Step 81900 | Loss: 0.7799 Acc: 77.88%
Step 82000 | Loss: 0.6321 Acc: 85.05%
Step 82100 | Loss: 0.4968 Acc: 90.86%
Step 82200 | Loss: 0.5373 Acc: 88.64%
Step 82300 | Loss: 0.6675 Acc: 83.65%
Step 82400 | Loss: 0.5761 Acc: 87.53%
Step 82500 | Loss: 0.5654 Acc: 87.52%
Step 82600 | Loss: 0.7260 Acc: 82.13%
Step 82700 | Loss: 0.9364 Acc: 73.17%
Step 82800 | Loss: 0.6101 Acc: 86.13%
Step 82900 | Loss: 0.6485 Acc: 84.20%
Step 83000 | Loss: 0.5516 Acc: 88.27%
Step 83100 | Loss: 1.5204 Acc: 75.58%
Step 83200 | Loss: 1.0699 Acc: 63.20%
Step 83300 | Loss: 0.6165 Acc: 85.27%
Step 83400 | Loss: 0.6242 Acc: 85.75%
Step 83500 | Loss: 0.6153 Acc: 86.36%
Step 83600 | Loss: 0.7088 Acc: 82.34%
Step 83700 | Loss: 0.5786 Acc: 87.70%
Step 83800 | Loss: 0.5238 Acc: 90.09%
Step 83900 | Loss: 0.5828 Acc: 86.35%
Step 84000 | Loss: 0.8687 Acc: 70.80%
Step 84100 | Loss: 0.6782 Acc: 83.02%
Step 84200 | Loss: 0.7904 Acc: 76.95%
Step 84300 | Loss: 0.5826 Acc: 86.86%
Step 84400 | Loss: 0.5913 Acc: 86.84%
Step 84500 | Loss: 0.6002 Acc: 87.03%
Step 84600 | Loss: 0.5493 Acc: 89.22%
Step 84700 | Loss: 0.6114 Acc: 85.40%
Step 84800 | Loss: 0.5685 Acc: 88.47%
Step 84900 | Loss: 0.6178 Acc: 86.14%
Step 85000 | Loss: 0.5655 Acc: 88.17% | 0.0: 467/500 | 1.x: 374/500 | 2.x: 320/500 | 3.x: 262/500 | 4.x+: 235/500 | Total: 1658/2500
Step 85100 | Loss: 0.5828 Acc: 86.55%
Step 85200 | Loss: 0.6864 Acc: 82.69%
Step 85300 | Loss: 0.6166 Acc: 86.20%
Step 85400 | Loss: 0.6080 Acc: 86.09%
Step 85500 | Loss: 0.6005 Acc: 85.77%
Step 85600 | Loss: 0.6219 Acc: 85.72%
Step 85700 | Loss: 0.6065 Acc: 85.57%
Step 85800 | Loss: 0.9622 Acc: 66.71%
Step 85900 | Loss: 0.5625 Acc: 88.56%
Step 86000 | Loss: 0.6126 Acc: 85.79%
Step 86100 | Loss: 1.0567 Acc: 62.90%
Step 86200 | Loss: 0.6286 Acc: 85.70%
Step 86300 | Loss: 0.5890 Acc: 86.34%
Step 86400 | Loss: 0.6317 Acc: 84.89%
Step 86500 | Loss: 0.5916 Acc: 87.90%
Step 86600 | Loss: 0.6952 Acc: 82.90%
Step 86700 | Loss: 0.5798 Acc: 86.28%
Step 86800 | Loss: 0.6617 Acc: 83.82%
Step 86900 | Loss: 0.5887 Acc: 87.63%
Step 87000 | Loss: 0.5897 Acc: 88.00%
Step 87100 | Loss: 0.5501 Acc: 87.59%
Step 87200 | Loss: 0.7373 Acc: 80.87%
Step 87300 | Loss: 0.5643 Acc: 87.78%
Step 87400 | Loss: 0.6470 Acc: 85.61%
Step 87500 | Loss: 0.5640 Acc: 88.06%
Step 87600 | Loss: 0.7318 Acc: 81.86%
Step 87700 | Loss: 0.6661 Acc: 83.40%
Step 87800 | Loss: 0.6383 Acc: 84.60%
Step 87900 | Loss: 0.7563 Acc: 81.11%
Step 88000 | Loss: 0.5905 Acc: 86.60%
Step 88100 | Loss: 0.6272 Acc: 85.64%
Step 88200 | Loss: 0.6009 Acc: 86.83%
Step 88300 | Loss: 0.6201 Acc: 85.91%
Step 88400 | Loss: 0.5783 Acc: 87.56%
Step 88500 | Loss: 0.5295 Acc: 88.65%
Step 88600 | Loss: 0.6129 Acc: 85.74%
Step 88700 | Loss: 0.7494 Acc: 79.68%
Step 88800 | Loss: 0.6119 Acc: 87.07%
Step 88900 | Loss: 0.5664 Acc: 88.36%
Step 89000 | Loss: 0.6341 Acc: 85.36%
Step 89100 | Loss: 0.5399 Acc: 88.06%
Step 89200 | Loss: 0.6392 Acc: 84.95%
Step 89300 | Loss: 0.5219 Acc: 88.88%
Step 89400 | Loss: 0.7090 Acc: 82.46%
Step 89500 | Loss: 0.8703 Acc: 71.49%
Step 89600 | Loss: 0.6083 Acc: 85.29%
Step 89700 | Loss: 0.5749 Acc: 87.38%
Step 89800 | Loss: 0.5357 Acc: 89.40%
Step 89900 | Loss: 0.6417 Acc: 84.57%
Step 90000 | Loss: 1.3123 Acc: 52.38% | 0.0: 0/500 | 1.x: 1/500 | 2.x: 0/500 | 3.x: 0/500 | 4.x+: 0/500 | Total: 1/2500
Step 90100 | Loss: 0.7714 Acc: 80.45%
Step 90200 | Loss: 0.6690 Acc: 83.56%
Step 90300 | Loss: 0.5209 Acc: 89.67%
Step 90400 | Loss: 0.7157 Acc: 81.83%
Step 90500 | Loss: 0.7245 Acc: 80.56%
Step 90600 | Loss: 0.6539 Acc: 84.82%
Step 90700 | Loss: 0.6918 Acc: 82.82%
Step 90800 | Loss: 0.8120 Acc: 79.07%
Step 90900 | Loss: 0.6368 Acc: 85.05%
Step 91000 | Loss: 0.8245 Acc: 78.25%
Step 91100 | Loss: 0.5605 Acc: 87.64%
Step 91200 | Loss: 0.5440 Acc: 88.70%
Step 91300 | Loss: 0.5707 Acc: 87.76%
Step 91400 | Loss: 0.7090 Acc: 82.04%
Step 91500 | Loss: 0.6072 Acc: 86.73%
Step 91600 | Loss: 0.5624 Acc: 87.08%
Step 91700 | Loss: 0.6025 Acc: 86.26%
Step 91800 | Loss: 0.6192 Acc: 87.23%
Step 91900 | Loss: 0.5460 Acc: 88.64%
Step 92000 | Loss: 0.6090 Acc: 86.34%
Step 92100 | Loss: 0.6477 Acc: 85.67%
Step 92200 | Loss: 0.7395 Acc: 81.23%
Step 92300 | Loss: 0.7042 Acc: 82.49%
Step 92400 | Loss: 0.5740 Acc: 88.47%
Step 92500 | Loss: 0.5741 Acc: 87.53%
Step 92600 | Loss: 0.6756 Acc: 82.83%
Step 92700 | Loss: 0.5692 Acc: 88.11%
Step 92800 | Loss: 0.5680 Acc: 89.26%
Step 92900 | Loss: 0.6857 Acc: 83.16%
Step 93000 | Loss: 0.5758 Acc: 87.67%
Step 93100 | Loss: 0.6649 Acc: 83.48%
Step 93200 | Loss: 0.5309 Acc: 89.48%
Step 93300 | Loss: 0.5757 Acc: 87.99%
Step 93400 | Loss: 0.5807 Acc: 87.73%
Step 93500 | Loss: 0.7282 Acc: 79.52%
Step 93600 | Loss: 0.5910 Acc: 86.62%
Step 93700 | Loss: 0.6092 Acc: 85.59%
Step 93800 | Loss: 0.5275 Acc: 89.88%
Step 93900 | Loss: 0.5397 Acc: 89.25%
Step 94000 | Loss: 0.5316 Acc: 89.55%
Step 94100 | Loss: 0.6036 Acc: 86.45%
Step 94200 | Loss: 0.6285 Acc: 85.89%
Step 94300 | Loss: 0.5682 Acc: 88.21%
Step 94400 | Loss: 1.1452 Acc: 57.39%
Step 94500 | Loss: 0.6525 Acc: 83.96%
Step 94600 | Loss: 0.5377 Acc: 89.89%
Step 94700 | Loss: 0.5613 Acc: 87.23%
Step 94800 | Loss: 0.5710 Acc: 87.28%
Step 94900 | Loss: 0.5745 Acc: 87.80%
Step 95000 | Loss: 0.6386 Acc: 84.80% | 0.0: 443/500 | 1.x: 365/500 | 2.x: 296/500 | 3.x: 248/500 | 4.x+: 189/500 | Total: 1541/2500
Step 95100 | Loss: 0.6388 Acc: 85.98%
Step 95200 | Loss: 0.5666 Acc: 87.74%
Step 95300 | Loss: 0.7746 Acc: 79.44%
Step 95400 | Loss: 0.5653 Acc: 87.99%
Step 95500 | Loss: 0.5715 Acc: 87.38%
Step 95600 | Loss: 0.6187 Acc: 85.10%
Step 95700 | Loss: 0.5663 Acc: 87.32%
Step 95800 | Loss: 0.5707 Acc: 87.12%
Step 95900 | Loss: 0.7189 Acc: 82.40%
Step 96000 | Loss: 0.7223 Acc: 82.03%
Step 96100 | Loss: 0.5782 Acc: 87.12%
Step 96200 | Loss: 0.6439 Acc: 85.74%
Step 96300 | Loss: 0.6163 Acc: 85.57%
Step 96400 | Loss: 0.6360 Acc: 85.44%
Step 96500 | Loss: 0.5767 Acc: 87.19%
Step 96600 | Loss: 0.6663 Acc: 84.23%
Step 96700 | Loss: 0.6170 Acc: 86.14%
Step 96800 | Loss: 0.5204 Acc: 89.81%
Step 96900 | Loss: 0.6408 Acc: 85.23%
Step 97000 | Loss: 0.5730 Acc: 88.59%
Step 97100 | Loss: 0.5354 Acc: 88.43%
Step 97200 | Loss: 0.6075 Acc: 86.58%
Step 97300 | Loss: 0.5973 Acc: 85.89%
Step 97400 | Loss: 0.9952 Acc: 63.80%
Step 97500 | Loss: 0.6245 Acc: 85.20%
Step 97600 | Loss: 0.6014 Acc: 86.09%
Step 97700 | Loss: 0.6040 Acc: 86.91%
Step 97800 | Loss: 0.7120 Acc: 83.02%
Step 97900 | Loss: 0.6128 Acc: 85.83%
Step 98000 | Loss: 0.6697 Acc: 84.05%
Step 98100 | Loss: 0.6497 Acc: 84.24%
Step 98200 | Loss: 0.5712 Acc: 88.06%
Step 98300 | Loss: 0.7487 Acc: 80.55%
Step 98400 | Loss: 0.5922 Acc: 86.75%
Step 98500 | Loss: 0.5397 Acc: 89.54%
Step 98600 | Loss: 0.5600 Acc: 88.32%
Step 98700 | Loss: 0.5958 Acc: 86.91%
Step 98800 | Loss: 0.5859 Acc: 86.06%
Step 98900 | Loss: 0.8813 Acc: 69.31%
Step 99000 | Loss: 0.6042 Acc: 86.15%
Step 99100 | Loss: 0.5988 Acc: 86.92%
Step 99200 | Loss: 0.8014 Acc: 76.51%
Step 99300 | Loss: 1.1156 Acc: 59.76%
Step 99400 | Loss: 0.5999 Acc: 85.70%
Step 99500 | Loss: 0.6949 Acc: 83.34%
Step 99600 | Loss: 0.5576 Acc: 87.86%
Step 99700 | Loss: 0.5783 Acc: 86.77%
Step 99800 | Loss: 0.5993 Acc: 86.64%
Step 99900 | Loss: 0.6616 Acc: 84.25%
Step 99999 | Loss: 0.6310 Acc: 84.87% | 0.0: 446/500 | 1.x: 365/500 | 2.x: 286/500 | 3.x: 252/500 | 4.x+: 210/500 | Total: 1559/2500

============================================================
FINAL RESULTS - Scale Iterations (32)
============================================================
Difficulty 0.0   : 446/500 solved ( 89.2%), cell acc: 96.8%
Difficulty 1.x   : 365/500 solved ( 73.0%), cell acc: 90.1%
Difficulty 2.x   : 286/500 solved ( 57.2%), cell acc: 83.2%
Difficulty 3.x   : 252/500 solved ( 50.4%), cell acc: 79.3%
Difficulty 4.x+  : 210/500 solved ( 42.0%), cell acc: 76.2%

Total: 1559/2500 solved
Model saved to model_scale_iter.pt
