
============================================================
Step 0: Entering Phase 1: Hard only (3.0+)
Training pool: 321326 puzzles
============================================================

Step     0 | Loss: 3.3366 Acc: 11.37% | 0.0: 0/500 | 1.x: 0/500 | 2.x: 0/500 | 3.x: 0/500 | 4.x+: 0/500 | Total: 0/2500
Step   100 | Loss: 2.2177 Acc: 10.72%
Step   200 | Loss: 2.2075 Acc: 11.34%
Step   300 | Loss: 1.7854 Acc: 25.82%
Step   400 | Loss: 1.2404 Acc: 47.64%
Step   500 | Loss: 1.1458 Acc: 52.09%
Step   600 | Loss: 1.1207 Acc: 53.58%
Step   700 | Loss: 1.0762 Acc: 55.37%
Step   800 | Loss: 1.0607 Acc: 55.86%
Step   900 | Loss: 1.0424 Acc: 57.48%
Step  1000 | Loss: 1.0291 Acc: 57.47%
Step  1100 | Loss: 1.0260 Acc: 57.02%
Step  1200 | Loss: 1.0130 Acc: 58.15%
Step  1300 | Loss: 1.0098 Acc: 58.19%
Step  1400 | Loss: 0.9737 Acc: 60.41%
Step  1500 | Loss: 0.9933 Acc: 59.46%
Step  1600 | Loss: 0.9852 Acc: 59.94%
Step  1700 | Loss: 0.9795 Acc: 60.12%
Step  1800 | Loss: 0.9706 Acc: 61.17%
Step  1900 | Loss: 0.9644 Acc: 61.14%
Step  2000 | Loss: 0.9656 Acc: 62.78%
Step  2100 | Loss: 0.9480 Acc: 61.77%
Step  2200 | Loss: 0.9458 Acc: 62.24%
Step  2300 | Loss: 0.9642 Acc: 60.74%
Step  2400 | Loss: 0.9404 Acc: 62.66%
Step  2500 | Loss: 0.9447 Acc: 61.65%
Step  2600 | Loss: 0.9395 Acc: 63.78%
Step  2700 | Loss: 0.9102 Acc: 64.21%
Step  2800 | Loss: 0.9397 Acc: 62.27%
Step  2900 | Loss: 0.9153 Acc: 63.36%
Step  3000 | Loss: 0.9103 Acc: 64.15%
Step  3100 | Loss: 0.9001 Acc: 65.91%
Step  3200 | Loss: 0.9056 Acc: 64.60%
Step  3300 | Loss: 0.9151 Acc: 64.13%
Step  3400 | Loss: 0.9018 Acc: 65.20%
Step  3500 | Loss: 0.9047 Acc: 64.61%
Step  3600 | Loss: 0.8905 Acc: 65.64%
Step  3700 | Loss: 0.8934 Acc: 66.20%
Step  3800 | Loss: 0.9042 Acc: 64.27%
Step  3900 | Loss: 0.9101 Acc: 63.64%
Step  4000 | Loss: 0.9045 Acc: 65.65%
Step  4100 | Loss: 0.8701 Acc: 67.02%
Step  4200 | Loss: 0.8899 Acc: 66.27%
Step  4300 | Loss: 0.8963 Acc: 65.42%
Step  4400 | Loss: 0.8706 Acc: 68.26%
Step  4500 | Loss: 0.8715 Acc: 65.79%
Step  4600 | Loss: 0.8562 Acc: 67.69%
Step  4700 | Loss: 0.8647 Acc: 67.50%
Step  4800 | Loss: 0.8706 Acc: 65.88%
Step  4900 | Loss: 0.8684 Acc: 68.22%
Step  5000 | Loss: 0.8533 Acc: 68.07% | 0.0: 183/500 | 1.x: 99/500 | 2.x: 46/500 | 3.x: 31/500 | 4.x+: 12/500 | Total: 371/2500
Step  5100 | Loss: 0.8753 Acc: 66.86%
Step  5200 | Loss: 0.8626 Acc: 67.29%
Step  5300 | Loss: 0.8720 Acc: 66.47%
Step  5400 | Loss: 0.8611 Acc: 68.34%
Step  5500 | Loss: 0.8491 Acc: 68.26%
Step  5600 | Loss: 0.8580 Acc: 69.48%
Step  5700 | Loss: 0.8522 Acc: 68.74%
Step  5800 | Loss: 0.8621 Acc: 68.00%
Step  5900 | Loss: 0.8541 Acc: 69.39%
Step  6000 | Loss: 0.8378 Acc: 70.08%
Step  6100 | Loss: 0.8594 Acc: 67.99%
Step  6200 | Loss: 0.8506 Acc: 68.22%
Step  6300 | Loss: 0.8489 Acc: 68.76%
Step  6400 | Loss: 0.8480 Acc: 68.97%
Step  6500 | Loss: 0.8471 Acc: 68.69%
Step  6600 | Loss: 0.8340 Acc: 69.42%
Step  6700 | Loss: 0.8209 Acc: 71.09%
Step  6800 | Loss: 0.8131 Acc: 71.59%
Step  6900 | Loss: 0.8336 Acc: 71.85%
Step  7000 | Loss: 0.8565 Acc: 69.18%
Step  7100 | Loss: 0.8351 Acc: 70.05%
Step  7200 | Loss: 0.8254 Acc: 71.34%
Step  7300 | Loss: 0.8406 Acc: 68.96%
Step  7400 | Loss: 0.8561 Acc: 68.04%
Step  7500 | Loss: 0.8191 Acc: 72.11%
Step  7600 | Loss: 0.8279 Acc: 70.95%
Step  7700 | Loss: 0.8254 Acc: 71.05%
Step  7800 | Loss: 0.8584 Acc: 68.32%
Step  7900 | Loss: 0.8463 Acc: 69.77%
Step  8000 | Loss: 0.8500 Acc: 70.27%
Step  8100 | Loss: 0.8461 Acc: 69.56%
Step  8200 | Loss: 0.8364 Acc: 71.87%
Step  8300 | Loss: 0.8144 Acc: 71.21%
Step  8400 | Loss: 0.8116 Acc: 71.67%
Step  8500 | Loss: 0.7920 Acc: 73.49%
Step  8600 | Loss: 0.8001 Acc: 72.79%
Step  8700 | Loss: 0.8067 Acc: 71.86%
Step  8800 | Loss: 0.8018 Acc: 72.15%
Step  8900 | Loss: 0.8144 Acc: 72.73%
Step  9000 | Loss: 0.7992 Acc: 72.31%
Step  9100 | Loss: 0.8267 Acc: 70.52%
Step  9200 | Loss: 0.8262 Acc: 71.38%
Step  9300 | Loss: 0.8117 Acc: 71.95%
Step  9400 | Loss: 0.8247 Acc: 71.35%
Step  9500 | Loss: 0.7892 Acc: 73.90%
Step  9600 | Loss: 0.7796 Acc: 74.17%
Step  9700 | Loss: 0.8037 Acc: 73.72%
Step  9800 | Loss: 0.7931 Acc: 73.70%
Step  9900 | Loss: 0.8154 Acc: 70.69%
Step 10000 | Loss: 0.7865 Acc: 74.48% | 0.0: 418/500 | 1.x: 301/500 | 2.x: 225/500 | 3.x: 174/500 | 4.x+: 133/500 | Total: 1251/2500
Step 10100 | Loss: 0.8054 Acc: 72.65%
Step 10200 | Loss: 0.8200 Acc: 71.00%
Step 10300 | Loss: 0.8101 Acc: 72.88%
Step 10400 | Loss: 0.7779 Acc: 75.50%
Step 10500 | Loss: 0.7818 Acc: 75.19%
Step 10600 | Loss: 0.7881 Acc: 74.83%
Step 10700 | Loss: 0.7956 Acc: 72.61%
Step 10800 | Loss: 0.8081 Acc: 72.94%
Step 10900 | Loss: 0.8124 Acc: 71.48%
Step 11000 | Loss: 0.8036 Acc: 72.97%
Step 11100 | Loss: 0.8084 Acc: 72.22%
Step 11200 | Loss: 0.8054 Acc: 72.92%
Step 11300 | Loss: 0.7762 Acc: 75.03%
Step 11400 | Loss: 0.7904 Acc: 74.31%
Step 11500 | Loss: 0.8481 Acc: 70.28%
Step 11600 | Loss: 0.7704 Acc: 76.76%
Step 11700 | Loss: 0.7710 Acc: 75.17%
Step 11800 | Loss: 0.7963 Acc: 74.24%
Step 11900 | Loss: 0.7839 Acc: 75.43%
Step 12000 | Loss: 0.7850 Acc: 74.25%
Step 12100 | Loss: 0.8021 Acc: 73.59%
Step 12200 | Loss: 0.7882 Acc: 74.38%
Step 12300 | Loss: 0.7761 Acc: 74.52%
Step 12400 | Loss: 0.7713 Acc: 77.18%
Step 12500 | Loss: 0.8053 Acc: 74.51%
Step 12600 | Loss: 0.8091 Acc: 72.45%
Step 12700 | Loss: 0.7670 Acc: 76.99%
Step 12800 | Loss: 0.7978 Acc: 73.60%
Step 12900 | Loss: 0.7658 Acc: 77.35%
Step 13000 | Loss: 0.7729 Acc: 75.16%
Step 13100 | Loss: 0.7773 Acc: 75.50%
Step 13200 | Loss: 0.7634 Acc: 76.50%
Step 13300 | Loss: 0.7929 Acc: 74.50%
Step 13400 | Loss: 0.7916 Acc: 74.24%
Step 13500 | Loss: 0.7600 Acc: 77.62%
Step 13600 | Loss: 0.7582 Acc: 76.01%
Step 13700 | Loss: 0.7950 Acc: 75.24%
Step 13800 | Loss: 0.7923 Acc: 73.84%
Step 13900 | Loss: 0.7545 Acc: 76.27%
Step 14000 | Loss: 0.7712 Acc: 76.72%
Step 14100 | Loss: 0.7781 Acc: 75.34%
Step 14200 | Loss: 0.7435 Acc: 78.68%
Step 14300 | Loss: 0.7888 Acc: 74.69%
Step 14400 | Loss: 0.7780 Acc: 75.83%
Step 14500 | Loss: 0.7645 Acc: 77.56%
Step 14600 | Loss: 0.7600 Acc: 76.67%
Step 14700 | Loss: 0.7599 Acc: 76.72%
Step 14800 | Loss: 0.7921 Acc: 74.44%
Step 14900 | Loss: 0.7682 Acc: 77.41%
Step 15000 | Loss: 0.7741 Acc: 76.37% | 0.0: 465/500 | 1.x: 368/500 | 2.x: 299/500 | 3.x: 241/500 | 4.x+: 182/500 | Total: 1555/2500
Step 15100 | Loss: 0.7623 Acc: 76.75%
Step 15200 | Loss: 0.7281 Acc: 79.95%
Step 15300 | Loss: 0.7752 Acc: 76.88%
Step 15400 | Loss: 0.7547 Acc: 77.57%
Step 15500 | Loss: 0.7321 Acc: 79.20%
Step 15600 | Loss: 0.7423 Acc: 78.67%
Step 15700 | Loss: 0.7509 Acc: 77.59%
Step 15800 | Loss: 0.7794 Acc: 75.67%
Step 15900 | Loss: 0.7541 Acc: 77.88%
Step 16000 | Loss: 0.7366 Acc: 78.27%
Step 16100 | Loss: 0.7559 Acc: 78.85%
Step 16200 | Loss: 0.7288 Acc: 79.30%
Step 16300 | Loss: 0.7454 Acc: 79.26%
Step 16400 | Loss: 0.7607 Acc: 77.84%
Step 16500 | Loss: 0.7397 Acc: 79.02%
Step 16600 | Loss: 0.7451 Acc: 78.53%
Step 16700 | Loss: 0.8421 Acc: 71.30%
Step 16800 | Loss: 0.7857 Acc: 76.09%
Step 16900 | Loss: 0.7764 Acc: 78.08%
Step 17000 | Loss: 0.7447 Acc: 76.85%
Step 17100 | Loss: 0.7515 Acc: 78.13%
Step 17200 | Loss: 0.7813 Acc: 77.24%
Step 17300 | Loss: 0.7322 Acc: 80.02%
Step 17400 | Loss: 0.7543 Acc: 77.81%
Step 17500 | Loss: 0.7613 Acc: 77.53%
Step 17600 | Loss: 0.7567 Acc: 77.11%
Step 17700 | Loss: 0.7169 Acc: 80.09%
Step 17800 | Loss: 0.7379 Acc: 79.26%
Step 17900 | Loss: 0.7059 Acc: 81.32%
Step 18000 | Loss: 0.7180 Acc: 80.86%
Step 18100 | Loss: 0.7279 Acc: 79.93%
Step 18200 | Loss: 0.7197 Acc: 79.57%
Step 18300 | Loss: 0.7558 Acc: 78.88%
Step 18400 | Loss: 0.7259 Acc: 79.96%
Step 18500 | Loss: 0.7623 Acc: 76.58%
Step 18600 | Loss: 0.7476 Acc: 78.66%
Step 18700 | Loss: 0.7209 Acc: 80.52%
Step 18800 | Loss: 0.7341 Acc: 79.99%
Step 18900 | Loss: 0.7632 Acc: 77.82%
Step 19000 | Loss: 0.7489 Acc: 78.54%
Step 19100 | Loss: 0.7303 Acc: 80.59%
Step 19200 | Loss: 0.7846 Acc: 77.18%
Step 19300 | Loss: 0.7819 Acc: 76.68%
Step 19400 | Loss: 0.7195 Acc: 80.29%
Step 19500 | Loss: 0.7563 Acc: 78.27%
Step 19600 | Loss: 0.7279 Acc: 79.42%
Step 19700 | Loss: 0.7922 Acc: 76.52%
Step 19800 | Loss: 0.7287 Acc: 79.81%
Step 19900 | Loss: 0.8021 Acc: 75.35%

============================================================
Step 20000: Entering Phase 2: Medium-Hard+ (2.0+)
Training pool: 892000 puzzles
============================================================

Step 20000 | Loss: 0.6790 Acc: 81.69% | 0.0: 485/500 | 1.x: 421/500 | 2.x: 351/500 | 3.x: 294/500 | 4.x+: 261/500 | Total: 1812/2500
Step 20100 | Loss: 0.6895 Acc: 81.60%
Step 20200 | Loss: 0.6986 Acc: 81.87%
Step 20300 | Loss: 0.6495 Acc: 84.28%
Step 20400 | Loss: 0.7256 Acc: 78.83%
Step 20500 | Loss: 0.7181 Acc: 79.26%
Step 20600 | Loss: 0.6899 Acc: 81.99%
Step 20700 | Loss: 0.7103 Acc: 80.94%
Step 20800 | Loss: 0.7248 Acc: 79.86%
Step 20900 | Loss: 0.6870 Acc: 82.15%
Step 21000 | Loss: 0.6550 Acc: 83.27%
Step 21100 | Loss: 0.7702 Acc: 77.44%
Step 21200 | Loss: 0.7181 Acc: 80.69%
Step 21300 | Loss: 0.6630 Acc: 82.89%
Step 21400 | Loss: 0.6400 Acc: 85.12%
Step 21500 | Loss: 0.6688 Acc: 83.27%
Step 21600 | Loss: 0.6829 Acc: 82.60%
Step 21700 | Loss: 0.7209 Acc: 80.34%
Step 21800 | Loss: 0.7262 Acc: 79.94%
Step 21900 | Loss: 0.7220 Acc: 80.54%
Step 22000 | Loss: 0.6894 Acc: 81.55%
Step 22100 | Loss: 0.6637 Acc: 82.48%
Step 22200 | Loss: 0.7694 Acc: 78.84%
Step 22300 | Loss: 0.6792 Acc: 82.10%
Step 22400 | Loss: 0.7035 Acc: 80.73%
Step 22500 | Loss: 0.6407 Acc: 84.74%
Step 22600 | Loss: 0.7047 Acc: 80.04%
Step 22700 | Loss: 0.6633 Acc: 83.31%
Step 22800 | Loss: 0.6666 Acc: 83.62%
Step 22900 | Loss: 0.6513 Acc: 83.58%
Step 23000 | Loss: 0.6598 Acc: 83.64%
Step 23100 | Loss: 0.7109 Acc: 80.28%
Step 23200 | Loss: 0.6632 Acc: 83.02%
Step 23300 | Loss: 0.6713 Acc: 82.87%
Step 23400 | Loss: 0.6730 Acc: 82.74%
Step 23500 | Loss: 0.7697 Acc: 77.73%
Step 23600 | Loss: 0.6857 Acc: 82.44%
Step 23700 | Loss: 0.6925 Acc: 82.15%
Step 23800 | Loss: 0.6507 Acc: 84.19%
Step 23900 | Loss: 0.6843 Acc: 81.61%
Step 24000 | Loss: 0.6862 Acc: 81.43%
Step 24100 | Loss: 0.6484 Acc: 83.78%
Step 24200 | Loss: 0.7482 Acc: 79.63%
Step 24300 | Loss: 0.6560 Acc: 83.78%
Step 24400 | Loss: 0.6614 Acc: 83.10%
Step 24500 | Loss: 0.6894 Acc: 81.17%
Step 24600 | Loss: 0.7009 Acc: 81.12%
Step 24700 | Loss: 0.6911 Acc: 81.91%
Step 24800 | Loss: 0.6381 Acc: 85.00%
Step 24900 | Loss: 0.6907 Acc: 81.72%
Step 25000 | Loss: 0.7407 Acc: 78.84% | 0.0: 483/500 | 1.x: 411/500 | 2.x: 359/500 | 3.x: 324/500 | 4.x+: 253/500 | Total: 1830/2500
Step 25100 | Loss: 0.6896 Acc: 81.63%
Step 25200 | Loss: 0.6803 Acc: 82.66%
Step 25300 | Loss: 0.6581 Acc: 83.14%
Step 25400 | Loss: 0.6557 Acc: 82.97%
Step 25500 | Loss: 0.6793 Acc: 82.18%
Step 25600 | Loss: 0.6689 Acc: 83.13%
Step 25700 | Loss: 0.6614 Acc: 83.72%
Step 25800 | Loss: 0.6991 Acc: 82.42%
Step 25900 | Loss: 0.6769 Acc: 83.08%
Step 26000 | Loss: 0.6442 Acc: 84.04%
Step 26100 | Loss: 0.6795 Acc: 82.02%
Step 26200 | Loss: 0.7032 Acc: 81.07%
Step 26300 | Loss: 0.6964 Acc: 81.64%
Step 26400 | Loss: 0.6958 Acc: 80.88%
Step 26500 | Loss: 0.6453 Acc: 84.64%
Step 26600 | Loss: 0.6755 Acc: 83.30%
Step 26700 | Loss: 0.6902 Acc: 82.16%
Step 26800 | Loss: 0.6692 Acc: 81.93%
Step 26900 | Loss: 0.6681 Acc: 82.43%
Step 27000 | Loss: 0.7048 Acc: 80.96%
Step 27100 | Loss: 0.6853 Acc: 81.88%
Step 27200 | Loss: 0.6784 Acc: 82.97%
Step 27300 | Loss: 0.6707 Acc: 82.47%
Step 27400 | Loss: 0.6816 Acc: 81.88%
Step 27500 | Loss: 0.6739 Acc: 82.71%
Step 27600 | Loss: 0.7897 Acc: 78.32%
Step 27700 | Loss: 0.6701 Acc: 82.74%
Step 27800 | Loss: 0.6845 Acc: 81.83%
Step 27900 | Loss: 0.6927 Acc: 82.34%
Step 28000 | Loss: 0.6889 Acc: 82.62%
Step 28100 | Loss: 0.6977 Acc: 81.94%
Step 28200 | Loss: 0.6478 Acc: 84.10%
Step 28300 | Loss: 0.6815 Acc: 81.90%
Step 28400 | Loss: 0.6781 Acc: 82.99%
Step 28500 | Loss: 0.6719 Acc: 83.39%
Step 28600 | Loss: 0.6889 Acc: 81.66%
Step 28700 | Loss: 0.6953 Acc: 80.81%
Step 28800 | Loss: 0.6634 Acc: 82.57%
Step 28900 | Loss: 0.6819 Acc: 81.83%
Step 29000 | Loss: 0.6640 Acc: 82.56%
Step 29100 | Loss: 0.6081 Acc: 86.54%
Step 29200 | Loss: 0.6649 Acc: 83.61%
Step 29300 | Loss: 0.6884 Acc: 82.17%
Step 29400 | Loss: 0.7101 Acc: 80.96%
Step 29500 | Loss: 0.6378 Acc: 84.33%
Step 29600 | Loss: 0.6939 Acc: 81.67%
Step 29700 | Loss: 0.6807 Acc: 82.21%
Step 29800 | Loss: 0.6906 Acc: 80.72%
Step 29900 | Loss: 0.6710 Acc: 82.81%
Step 30000 | Loss: 0.6624 Acc: 82.29% | 0.0: 484/500 | 1.x: 426/500 | 2.x: 363/500 | 3.x: 308/500 | 4.x+: 269/500 | Total: 1850/2500
Step 30100 | Loss: 0.6731 Acc: 82.74%
Step 30200 | Loss: 0.6398 Acc: 83.75%
Step 30300 | Loss: 0.6729 Acc: 82.54%
Step 30400 | Loss: 0.6599 Acc: 83.49%
Step 30500 | Loss: 0.6869 Acc: 82.74%
Step 30600 | Loss: 0.6164 Acc: 86.23%
Step 30700 | Loss: 0.6310 Acc: 85.65%
Step 30800 | Loss: 0.6219 Acc: 85.91%
Step 30900 | Loss: 0.6148 Acc: 84.72%
Step 31000 | Loss: 0.7244 Acc: 79.71%
Step 31100 | Loss: 0.6493 Acc: 83.55%
Step 31200 | Loss: 0.6889 Acc: 81.71%
Step 31300 | Loss: 0.6811 Acc: 81.55%
Step 31400 | Loss: 0.6575 Acc: 82.17%
Step 31500 | Loss: 0.6448 Acc: 83.49%
Step 31600 | Loss: 0.6782 Acc: 82.66%
Step 31700 | Loss: 0.6539 Acc: 83.96%
Step 31800 | Loss: 0.6568 Acc: 83.31%
Step 31900 | Loss: 0.6443 Acc: 84.69%
Step 32000 | Loss: 0.6490 Acc: 83.92%
Step 32100 | Loss: 0.6466 Acc: 82.94%
Step 32200 | Loss: 0.6642 Acc: 83.61%
Step 32300 | Loss: 0.6475 Acc: 83.96%
Step 32400 | Loss: 0.6296 Acc: 85.31%
Step 32500 | Loss: 0.6666 Acc: 82.14%
Step 32600 | Loss: 0.6935 Acc: 82.35%
Step 32700 | Loss: 0.6704 Acc: 82.74%
Step 32800 | Loss: 0.6432 Acc: 84.44%
Step 32900 | Loss: 0.6955 Acc: 81.32%
Step 33000 | Loss: 0.7190 Acc: 79.60%
Step 33100 | Loss: 0.7083 Acc: 81.17%
Step 33200 | Loss: 0.6282 Acc: 85.47%
Step 33300 | Loss: 0.6738 Acc: 82.96%
Step 33400 | Loss: 0.6763 Acc: 82.31%
Step 33500 | Loss: 0.6460 Acc: 83.82%
Step 33600 | Loss: 0.6447 Acc: 84.12%
Step 33700 | Loss: 0.6825 Acc: 81.82%
Step 33800 | Loss: 0.6911 Acc: 82.41%
Step 33900 | Loss: 0.6571 Acc: 82.74%
Step 34000 | Loss: 0.6725 Acc: 82.14%
Step 34100 | Loss: 0.6682 Acc: 82.52%
Step 34200 | Loss: 0.6962 Acc: 81.25%
Step 34300 | Loss: 0.6345 Acc: 85.64%
Step 34400 | Loss: 0.6482 Acc: 84.09%
Step 34500 | Loss: 0.6268 Acc: 84.88%
Step 34600 | Loss: 0.6646 Acc: 83.53%
Step 34700 | Loss: 0.6589 Acc: 84.18%
Step 34800 | Loss: 0.6493 Acc: 83.99%
Step 34900 | Loss: 0.6334 Acc: 84.40%
Step 35000 | Loss: 0.6970 Acc: 81.57% | 0.0: 494/500 | 1.x: 438/500 | 2.x: 365/500 | 3.x: 323/500 | 4.x+: 294/500 | Total: 1914/2500
Step 35100 | Loss: 0.6597 Acc: 82.65%
Step 35200 | Loss: 0.6196 Acc: 85.35%
Step 35300 | Loss: 0.5920 Acc: 86.31%
Step 35400 | Loss: 0.6844 Acc: 81.75%
Step 35500 | Loss: 0.6401 Acc: 83.85%
Step 35600 | Loss: 0.6332 Acc: 85.33%
Step 35700 | Loss: 0.6586 Acc: 83.51%
Step 35800 | Loss: 0.6478 Acc: 84.64%
Step 35900 | Loss: 0.6503 Acc: 83.66%
Step 36000 | Loss: 0.6520 Acc: 83.37%
Step 36100 | Loss: 0.6681 Acc: 83.04%
Step 36200 | Loss: 0.6393 Acc: 84.77%
Step 36300 | Loss: 0.6841 Acc: 82.05%
Step 36400 | Loss: 0.6629 Acc: 83.55%
Step 36500 | Loss: 0.6906 Acc: 81.97%
Step 36600 | Loss: 0.6399 Acc: 83.30%
Step 36700 | Loss: 0.6495 Acc: 83.57%
Step 36800 | Loss: 0.6229 Acc: 84.55%
Step 36900 | Loss: 0.6166 Acc: 85.36%
Step 37000 | Loss: 0.6636 Acc: 81.92%
Step 37100 | Loss: 0.6549 Acc: 82.75%
Step 37200 | Loss: 0.6815 Acc: 81.78%
Step 37300 | Loss: 0.6534 Acc: 82.86%
Step 37400 | Loss: 0.6250 Acc: 84.20%
Step 37500 | Loss: 0.6359 Acc: 83.84%
Step 37600 | Loss: 0.6738 Acc: 82.87%
Step 37700 | Loss: 0.6788 Acc: 82.12%
Step 37800 | Loss: 0.6608 Acc: 82.83%
Step 37900 | Loss: 0.6556 Acc: 83.25%
Step 38000 | Loss: 0.6671 Acc: 82.50%
Step 38100 | Loss: 0.6402 Acc: 84.42%
Step 38200 | Loss: 0.6157 Acc: 86.39%
Step 38300 | Loss: 0.6392 Acc: 84.34%
Step 38400 | Loss: 0.6645 Acc: 83.00%
Step 38500 | Loss: 0.6290 Acc: 84.94%
Step 38600 | Loss: 0.6847 Acc: 81.93%
Step 38700 | Loss: 0.6818 Acc: 82.58%
Step 38800 | Loss: 0.6553 Acc: 83.24%
Step 38900 | Loss: 0.6435 Acc: 83.60%
Step 39000 | Loss: 0.6126 Acc: 85.60%
Step 39100 | Loss: 0.6998 Acc: 81.17%
Step 39200 | Loss: 0.6465 Acc: 82.47%
Step 39300 | Loss: 0.6408 Acc: 83.41%
Step 39400 | Loss: 0.6728 Acc: 81.33%
Step 39500 | Loss: 0.6193 Acc: 85.60%
Step 39600 | Loss: 0.6614 Acc: 83.43%
Step 39700 | Loss: 0.6918 Acc: 81.26%
Step 39800 | Loss: 0.6366 Acc: 84.10%
Step 39900 | Loss: 0.6254 Acc: 85.05%

============================================================
Step 40000: Entering Phase 3: Medium+ (1.0+)
Training pool: 1703919 puzzles
============================================================

Step 40000 | Loss: 0.5723 Acc: 86.78% | 0.0: 482/500 | 1.x: 413/500 | 2.x: 364/500 | 3.x: 324/500 | 4.x+: 283/500 | Total: 1866/2500
Step 40100 | Loss: 0.6249 Acc: 84.54%
Step 40200 | Loss: 0.5131 Acc: 90.26%
Step 40300 | Loss: 0.5820 Acc: 87.17%
Step 40400 | Loss: 0.5684 Acc: 87.85%
Step 40500 | Loss: 0.5908 Acc: 87.27%
Step 40600 | Loss: 0.5812 Acc: 86.34%
Step 40700 | Loss: 0.5436 Acc: 87.90%
Step 40800 | Loss: 0.5208 Acc: 89.77%
Step 40900 | Loss: 0.5805 Acc: 86.39%
Step 41000 | Loss: 0.6185 Acc: 85.18%
Step 41100 | Loss: 0.5517 Acc: 87.98%
Step 41200 | Loss: 0.5770 Acc: 87.19%
Step 41300 | Loss: 0.5688 Acc: 86.45%
Step 41400 | Loss: 0.5815 Acc: 86.04%
Step 41500 | Loss: 0.6105 Acc: 86.05%
Step 41600 | Loss: 0.5629 Acc: 87.22%
Step 41700 | Loss: 0.5945 Acc: 85.69%
Step 41800 | Loss: 0.5816 Acc: 86.17%
Step 41900 | Loss: 0.6203 Acc: 84.75%
Step 42000 | Loss: 0.5606 Acc: 88.53%
Step 42100 | Loss: 0.5817 Acc: 87.37%
Step 42200 | Loss: 0.5698 Acc: 86.65%
Step 42300 | Loss: 0.5730 Acc: 86.96%
Step 42400 | Loss: 0.5891 Acc: 86.94%
Step 42500 | Loss: 0.5840 Acc: 85.95%
Step 42600 | Loss: 0.5648 Acc: 87.16%
Step 42700 | Loss: 0.5721 Acc: 87.24%
Step 42800 | Loss: 0.6404 Acc: 83.74%
Step 42900 | Loss: 0.5880 Acc: 86.06%
Step 43000 | Loss: 0.5659 Acc: 86.96%
Step 43100 | Loss: 0.5759 Acc: 87.75%
Step 43200 | Loss: 0.5953 Acc: 85.96%
Step 43300 | Loss: 0.5943 Acc: 86.04%
Step 43400 | Loss: 0.5761 Acc: 87.84%
Step 43500 | Loss: 0.5706 Acc: 87.24%
Step 43600 | Loss: 0.5810 Acc: 87.70%
Step 43700 | Loss: 0.5659 Acc: 87.62%
Step 43800 | Loss: 0.5606 Acc: 87.22%
Step 43900 | Loss: 0.5825 Acc: 86.72%
Step 44000 | Loss: 0.5785 Acc: 87.31%
Step 44100 | Loss: 0.5615 Acc: 88.35%
Step 44200 | Loss: 0.5845 Acc: 86.02%
Step 44300 | Loss: 0.6125 Acc: 84.64%
Step 44400 | Loss: 0.5507 Acc: 88.35%
Step 44500 | Loss: 0.5693 Acc: 86.99%
Step 44600 | Loss: 0.5377 Acc: 88.88%
Step 44700 | Loss: 0.5308 Acc: 89.19%
Step 44800 | Loss: 0.5867 Acc: 85.40%
Step 44900 | Loss: 0.5550 Acc: 87.48%
Step 45000 | Loss: 0.5414 Acc: 88.48% | 0.0: 493/500 | 1.x: 434/500 | 2.x: 385/500 | 3.x: 341/500 | 4.x+: 309/500 | Total: 1962/2500
Step 45100 | Loss: 0.6132 Acc: 84.46%
Step 45200 | Loss: 0.5405 Acc: 89.02%
Step 45300 | Loss: 0.5732 Acc: 87.08%
Step 45400 | Loss: 0.5610 Acc: 88.33%
Step 45500 | Loss: 0.5680 Acc: 87.18%
Step 45600 | Loss: 0.5252 Acc: 90.32%
Step 45700 | Loss: 0.5215 Acc: 90.24%
Step 45800 | Loss: 0.6017 Acc: 86.30%
Step 45900 | Loss: 0.5210 Acc: 89.94%
Step 46000 | Loss: 0.5299 Acc: 90.50%
Step 46100 | Loss: 0.5981 Acc: 86.06%
Step 46200 | Loss: 0.5063 Acc: 90.83%
Step 46300 | Loss: 0.6154 Acc: 84.61%
Step 46400 | Loss: 0.6038 Acc: 85.58%
Step 46500 | Loss: 0.5697 Acc: 86.88%
Step 46600 | Loss: 0.5576 Acc: 87.22%
Step 46700 | Loss: 0.6008 Acc: 86.26%
Step 46800 | Loss: 0.5717 Acc: 86.24%
Step 46900 | Loss: 0.5401 Acc: 88.24%
Step 47000 | Loss: 0.6693 Acc: 83.06%
Step 47100 | Loss: 0.5399 Acc: 89.72%
Step 47200 | Loss: 0.5442 Acc: 88.40%
Step 47300 | Loss: 0.5825 Acc: 86.45%
Step 47400 | Loss: 0.6322 Acc: 85.00%
Step 47500 | Loss: 0.5059 Acc: 90.08%
Step 47600 | Loss: 0.5629 Acc: 86.86%
Step 47700 | Loss: 0.5775 Acc: 86.66%
Step 47800 | Loss: 0.5421 Acc: 88.01%
Step 47900 | Loss: 0.6037 Acc: 86.79%
Step 48000 | Loss: 0.5765 Acc: 86.48%
Step 48100 | Loss: 0.5481 Acc: 88.55%
Step 48200 | Loss: 0.5686 Acc: 87.17%
Step 48300 | Loss: 0.5671 Acc: 87.26%
Step 48400 | Loss: 0.5416 Acc: 88.05%
Step 48500 | Loss: 0.5356 Acc: 88.39%
Step 48600 | Loss: 0.5614 Acc: 88.22%
Step 48700 | Loss: 0.5224 Acc: 89.30%
Step 48800 | Loss: 0.5158 Acc: 89.78%
Step 48900 | Loss: 0.5612 Acc: 87.92%
Step 49000 | Loss: 0.5901 Acc: 85.54%
Step 49100 | Loss: 0.5164 Acc: 88.33%
Step 49200 | Loss: 0.5899 Acc: 86.45%
Step 49300 | Loss: 0.5322 Acc: 89.08%
Step 49400 | Loss: 0.5643 Acc: 87.30%
Step 49500 | Loss: 0.5416 Acc: 88.48%
Step 49600 | Loss: 0.5477 Acc: 88.53%
Step 49700 | Loss: 0.5551 Acc: 87.93%
Step 49800 | Loss: 0.5866 Acc: 86.86%
Step 49900 | Loss: 0.5285 Acc: 89.09%
Step 50000 | Loss: 0.5470 Acc: 88.33% | 0.0: 493/500 | 1.x: 429/500 | 2.x: 393/500 | 3.x: 334/500 | 4.x+: 290/500 | Total: 1939/2500
Step 50100 | Loss: 0.5312 Acc: 89.14%
Step 50200 | Loss: 0.5674 Acc: 87.43%
Step 50300 | Loss: 0.5917 Acc: 86.41%
Step 50400 | Loss: 0.5566 Acc: 87.38%
Step 50500 | Loss: 0.5123 Acc: 89.11%
Step 50600 | Loss: 0.5462 Acc: 87.85%
Step 50700 | Loss: 0.5689 Acc: 87.25%
Step 50800 | Loss: 0.5621 Acc: 87.35%
Step 50900 | Loss: 0.5284 Acc: 88.74%
Step 51000 | Loss: 0.5599 Acc: 87.69%
Step 51100 | Loss: 0.5840 Acc: 86.23%
Step 51200 | Loss: 0.5203 Acc: 90.11%
Step 51300 | Loss: 0.5533 Acc: 88.84%
Step 51400 | Loss: 0.5429 Acc: 88.42%
Step 51500 | Loss: 0.5139 Acc: 88.87%
Step 51600 | Loss: 0.5964 Acc: 86.22%
Step 51700 | Loss: 0.5457 Acc: 87.94%
Step 51800 | Loss: 0.4973 Acc: 89.74%
Step 51900 | Loss: 0.5364 Acc: 88.17%
Step 52000 | Loss: 0.5894 Acc: 85.39%
Step 52100 | Loss: 0.5800 Acc: 86.16%
Step 52200 | Loss: 0.5613 Acc: 86.69%
Step 52300 | Loss: 0.5320 Acc: 87.93%
Step 52400 | Loss: 0.5068 Acc: 90.41%
Step 52500 | Loss: 0.5360 Acc: 87.82%
Step 52600 | Loss: 0.5450 Acc: 88.13%
Step 52700 | Loss: 0.5336 Acc: 88.80%
Step 52800 | Loss: 0.5312 Acc: 88.20%
Step 52900 | Loss: 0.5790 Acc: 87.90%
Step 53000 | Loss: 0.5429 Acc: 88.33%
Step 53100 | Loss: 0.5331 Acc: 88.34%
Step 53200 | Loss: 0.5694 Acc: 86.38%
Step 53300 | Loss: 0.5256 Acc: 88.39%
Step 53400 | Loss: 0.5234 Acc: 89.04%
Step 53500 | Loss: 0.5827 Acc: 86.08%
Step 53600 | Loss: 0.5185 Acc: 89.85%
Step 53700 | Loss: 0.5874 Acc: 86.80%
Step 53800 | Loss: 0.5574 Acc: 88.51%
Step 53900 | Loss: 0.5663 Acc: 86.55%
Step 54000 | Loss: 0.5554 Acc: 87.50%
Step 54100 | Loss: 0.5380 Acc: 88.28%
Step 54200 | Loss: 0.5734 Acc: 86.86%
Step 54300 | Loss: 0.5890 Acc: 85.61%
Step 54400 | Loss: 0.5588 Acc: 86.54%
Step 54500 | Loss: 0.5351 Acc: 88.41%
Step 54600 | Loss: 0.5364 Acc: 88.45%
Step 54700 | Loss: 0.5241 Acc: 88.31%
Step 54800 | Loss: 0.5659 Acc: 86.45%
Step 54900 | Loss: 0.5121 Acc: 88.84%
Step 55000 | Loss: 0.5362 Acc: 87.72% | 0.0: 496/500 | 1.x: 436/500 | 2.x: 379/500 | 3.x: 335/500 | 4.x+: 296/500 | Total: 1942/2500
Step 55100 | Loss: 0.5524 Acc: 88.17%
Step 55200 | Loss: 0.5589 Acc: 87.96%
Step 55300 | Loss: 0.5301 Acc: 88.50%
Step 55400 | Loss: 0.5551 Acc: 88.01%
Step 55500 | Loss: 0.5546 Acc: 86.71%
Step 55600 | Loss: 0.5678 Acc: 87.50%
Step 55700 | Loss: 0.5445 Acc: 87.47%
Step 55800 | Loss: 0.5140 Acc: 89.76%
Step 55900 | Loss: 0.5681 Acc: 87.53%
Step 56000 | Loss: 0.5464 Acc: 88.10%
Step 56100 | Loss: 0.5146 Acc: 90.28%
Step 56200 | Loss: 0.5573 Acc: 86.88%
Step 56300 | Loss: 0.5259 Acc: 89.48%
Step 56400 | Loss: 0.5150 Acc: 89.70%
Step 56500 | Loss: 0.5153 Acc: 89.25%
Step 56600 | Loss: 0.5536 Acc: 87.61%
Step 56700 | Loss: 0.5711 Acc: 85.90%
Step 56800 | Loss: 0.5343 Acc: 88.02%
Step 56900 | Loss: 0.5406 Acc: 88.71%
Step 57000 | Loss: 0.5225 Acc: 89.83%
Step 57100 | Loss: 0.5375 Acc: 87.77%
Step 57200 | Loss: 0.5391 Acc: 89.07%
Step 57300 | Loss: 0.5199 Acc: 89.00%
Step 57400 | Loss: 0.5216 Acc: 89.66%
Step 57500 | Loss: 0.4852 Acc: 90.14%
Step 57600 | Loss: 0.5093 Acc: 90.06%
Step 57700 | Loss: 0.5176 Acc: 89.17%
Step 57800 | Loss: 0.5037 Acc: 90.51%
Step 57900 | Loss: 0.5280 Acc: 89.19%
Step 58000 | Loss: 0.4992 Acc: 91.01%
Step 58100 | Loss: 0.5366 Acc: 88.15%
Step 58200 | Loss: 0.5218 Acc: 88.67%
Step 58300 | Loss: 0.5307 Acc: 89.29%
Step 58400 | Loss: 0.5350 Acc: 88.76%
Step 58500 | Loss: 0.5551 Acc: 88.00%
Step 58600 | Loss: 0.5307 Acc: 88.41%
Step 58700 | Loss: 0.5177 Acc: 89.77%
Step 58800 | Loss: 0.5104 Acc: 89.55%
Step 58900 | Loss: 0.5606 Acc: 86.11%
Step 59000 | Loss: 0.5560 Acc: 87.90%
Step 59100 | Loss: 0.5114 Acc: 89.45%
Step 59200 | Loss: 0.5802 Acc: 85.74%
Step 59300 | Loss: 0.4982 Acc: 91.28%
Step 59400 | Loss: 0.5810 Acc: 85.90%
Step 59500 | Loss: 0.4971 Acc: 89.38%
Step 59600 | Loss: 0.5496 Acc: 88.06%
Step 59700 | Loss: 0.4871 Acc: 90.24%
Step 59800 | Loss: 0.5961 Acc: 86.67%
Step 59900 | Loss: 0.5863 Acc: 85.61%

============================================================
Step 60000: Entering Phase 4: All (0.0+)
Training pool: 2997500 puzzles
============================================================

Step 60000 | Loss: 0.4473 Acc: 91.73% | 0.0: 497/500 | 1.x: 446/500 | 2.x: 373/500 | 3.x: 353/500 | 4.x+: 327/500 | Total: 1996/2500
Step 60100 | Loss: 0.4402 Acc: 91.82%
Step 60200 | Loss: 0.4418 Acc: 91.94%
Step 60300 | Loss: 0.4465 Acc: 93.06%
Step 60400 | Loss: 0.4754 Acc: 92.52%
Step 60500 | Loss: 0.4414 Acc: 91.45%
Step 60600 | Loss: 0.3967 Acc: 93.40%
Step 60700 | Loss: 0.4686 Acc: 91.22%
Step 60800 | Loss: 0.4290 Acc: 93.11%
Step 60900 | Loss: 0.5299 Acc: 89.44%
Step 61000 | Loss: 0.4307 Acc: 93.18%
Step 61100 | Loss: 0.4117 Acc: 93.06%
Step 61200 | Loss: 0.4628 Acc: 91.07%
Step 61300 | Loss: 0.4487 Acc: 92.11%
Step 61400 | Loss: 0.4242 Acc: 92.77%
Step 61500 | Loss: 0.4198 Acc: 93.88%
Step 61600 | Loss: 0.4328 Acc: 92.34%
Step 61700 | Loss: 0.4432 Acc: 92.26%
Step 61800 | Loss: 0.4877 Acc: 90.41%
Step 61900 | Loss: 0.4279 Acc: 92.64%
Step 62000 | Loss: 0.4648 Acc: 90.20%
Step 62100 | Loss: 0.4037 Acc: 94.02%
Step 62200 | Loss: 0.4244 Acc: 92.16%
Step 62300 | Loss: 0.4267 Acc: 92.67%
Step 62400 | Loss: 0.4405 Acc: 92.68%
Step 62500 | Loss: 0.4550 Acc: 90.61%
Step 62600 | Loss: 0.4332 Acc: 92.06%
Step 62700 | Loss: 0.4197 Acc: 92.37%
Step 62800 | Loss: 0.4478 Acc: 92.68%
Step 62900 | Loss: 0.5137 Acc: 90.45%
Step 63000 | Loss: 0.4281 Acc: 92.57%
Step 63100 | Loss: 0.4005 Acc: 93.63%
Step 63200 | Loss: 0.4370 Acc: 92.07%
Step 63300 | Loss: 0.4132 Acc: 93.27%
Step 63400 | Loss: 0.4866 Acc: 90.91%
Step 63500 | Loss: 0.4301 Acc: 92.67%
Step 63600 | Loss: 0.4449 Acc: 93.65%
Step 63700 | Loss: 0.3865 Acc: 94.55%
Step 63800 | Loss: 0.4542 Acc: 92.65%
Step 63900 | Loss: 0.5008 Acc: 89.22%
Step 64000 | Loss: 0.4507 Acc: 91.87%
Step 64100 | Loss: 0.4400 Acc: 92.32%
Step 64200 | Loss: 0.4071 Acc: 93.52%
Step 64300 | Loss: 0.4444 Acc: 91.60%
Step 64400 | Loss: 0.4346 Acc: 92.37%
Step 64500 | Loss: 0.4188 Acc: 92.86%
Step 64600 | Loss: 0.4230 Acc: 93.06%
Step 64700 | Loss: 0.4524 Acc: 92.40%
Step 64800 | Loss: 0.4434 Acc: 91.86%
Step 64900 | Loss: 0.4254 Acc: 92.73%
Step 65000 | Loss: 0.4945 Acc: 89.67% | 0.0: 484/500 | 1.x: 427/500 | 2.x: 376/500 | 3.x: 329/500 | 4.x+: 279/500 | Total: 1895/2500
Step 65100 | Loss: 0.4212 Acc: 92.38%
Step 65200 | Loss: 0.4852 Acc: 92.30%
Step 65300 | Loss: 0.4483 Acc: 92.72%
Step 65400 | Loss: 0.4681 Acc: 91.68%
Step 65500 | Loss: 0.4428 Acc: 92.02%
Step 65600 | Loss: 0.4072 Acc: 94.30%
Step 65700 | Loss: 0.4199 Acc: 92.83%
Step 65800 | Loss: 0.4263 Acc: 92.27%
Step 65900 | Loss: 0.4104 Acc: 93.40%
Step 66000 | Loss: 0.4262 Acc: 92.80%
Step 66100 | Loss: 0.4683 Acc: 91.12%
Step 66200 | Loss: 0.4372 Acc: 91.77%
Step 66300 | Loss: 0.4256 Acc: 92.99%
Step 66400 | Loss: 0.4382 Acc: 93.42%
Step 66500 | Loss: 0.4379 Acc: 91.95%
Step 66600 | Loss: 0.4129 Acc: 93.28%
Step 66700 | Loss: 0.4625 Acc: 91.18%
Step 66800 | Loss: 0.3980 Acc: 93.71%
Step 66900 | Loss: 0.4073 Acc: 92.89%
Step 67000 | Loss: 0.4281 Acc: 92.39%
Step 67100 | Loss: 0.4728 Acc: 91.29%
Step 67200 | Loss: 0.4645 Acc: 92.28%
Step 67300 | Loss: 0.4450 Acc: 91.86%
Step 67400 | Loss: 0.4352 Acc: 92.48%
Step 67500 | Loss: 0.4261 Acc: 92.83%
Step 67600 | Loss: 0.4475 Acc: 91.88%
Step 67700 | Loss: 0.4718 Acc: 90.50%
Step 67800 | Loss: 0.4567 Acc: 91.92%
Step 67900 | Loss: 0.5050 Acc: 89.63%
Step 68000 | Loss: 0.4817 Acc: 90.29%
Step 68100 | Loss: 0.4544 Acc: 91.34%
Step 68200 | Loss: 0.4007 Acc: 93.71%
Step 68300 | Loss: 0.4157 Acc: 93.50%
Step 68400 | Loss: 0.3962 Acc: 93.48%
Step 68500 | Loss: 0.4623 Acc: 92.28%
Step 68600 | Loss: 0.4188 Acc: 93.59%
Step 68700 | Loss: 0.4530 Acc: 90.98%
Step 68800 | Loss: 0.4126 Acc: 92.87%
Step 68900 | Loss: 0.4169 Acc: 92.75%
Step 69000 | Loss: 0.4126 Acc: 93.12%
Step 69100 | Loss: 0.4456 Acc: 91.01%
Step 69200 | Loss: 0.3873 Acc: 94.60%
Step 69300 | Loss: 0.4302 Acc: 92.63%
Step 69400 | Loss: 0.4824 Acc: 90.89%
Step 69500 | Loss: 0.5163 Acc: 88.59%
Step 69600 | Loss: 0.4656 Acc: 91.82%
Step 69700 | Loss: 0.4069 Acc: 92.78%
Step 69800 | Loss: 0.4794 Acc: 90.58%
Step 69900 | Loss: 0.4342 Acc: 92.06%
Step 70000 | Loss: 0.3799 Acc: 94.35% | 0.0: 494/500 | 1.x: 439/500 | 2.x: 402/500 | 3.x: 336/500 | 4.x+: 311/500 | Total: 1982/2500
Step 70100 | Loss: 0.4298 Acc: 93.02%
Step 70200 | Loss: 0.3855 Acc: 94.65%
Step 70300 | Loss: 0.4737 Acc: 91.58%
Step 70400 | Loss: 0.4301 Acc: 92.62%
Step 70500 | Loss: 0.4385 Acc: 91.81%
Step 70600 | Loss: 0.4454 Acc: 92.60%
Step 70700 | Loss: 0.4238 Acc: 93.64%
Step 70800 | Loss: 0.5128 Acc: 90.07%
Step 70900 | Loss: 0.4247 Acc: 93.83%
Step 71000 | Loss: 0.4226 Acc: 92.55%
Step 71100 | Loss: 0.4707 Acc: 90.98%
Step 71200 | Loss: 0.4657 Acc: 91.05%
Step 71300 | Loss: 0.4556 Acc: 91.61%
Step 71400 | Loss: 0.4828 Acc: 90.40%
Step 71500 | Loss: 0.4131 Acc: 93.12%
Step 71600 | Loss: 0.3998 Acc: 94.16%
Step 71700 | Loss: 0.4110 Acc: 92.70%
Step 71800 | Loss: 0.4939 Acc: 90.17%
Step 71900 | Loss: 0.4397 Acc: 91.91%
Step 72000 | Loss: 0.4490 Acc: 91.32%
Step 72100 | Loss: 0.4461 Acc: 91.73%
Step 72200 | Loss: 0.4561 Acc: 91.25%
Step 72300 | Loss: 0.4405 Acc: 91.99%
Step 72400 | Loss: 0.4711 Acc: 90.42%
Step 72500 | Loss: 0.4113 Acc: 92.51%
Step 72600 | Loss: 0.4269 Acc: 92.64%
Step 72700 | Loss: 0.4468 Acc: 91.51%
Step 72800 | Loss: 0.4514 Acc: 91.45%
Step 72900 | Loss: 0.4220 Acc: 92.25%
Step 73000 | Loss: 0.4306 Acc: 93.25%
Step 73100 | Loss: 0.5019 Acc: 89.02%
Step 73200 | Loss: 0.5545 Acc: 87.96%
Step 73300 | Loss: 0.3901 Acc: 94.81%
Step 73400 | Loss: 0.4877 Acc: 90.38%
Step 73500 | Loss: 0.4552 Acc: 90.69%
Step 73600 | Loss: 0.4529 Acc: 91.89%
Step 73700 | Loss: 0.4412 Acc: 92.51%
Step 73800 | Loss: 0.4269 Acc: 92.98%
Step 73900 | Loss: 0.4455 Acc: 92.19%
Step 74000 | Loss: 0.4071 Acc: 93.64%
Step 74100 | Loss: 0.4052 Acc: 92.49%
Step 74200 | Loss: 0.4500 Acc: 91.81%
Step 74300 | Loss: 0.3944 Acc: 93.64%
Step 74400 | Loss: 0.4395 Acc: 91.37%
Step 74500 | Loss: 0.4804 Acc: 91.01%
Step 74600 | Loss: 0.4170 Acc: 93.20%
Step 74700 | Loss: 0.4547 Acc: 90.85%
Step 74800 | Loss: 0.4344 Acc: 92.21%
Step 74900 | Loss: 0.4342 Acc: 92.29%
Step 75000 | Loss: 0.4635 Acc: 91.45% | 0.0: 493/500 | 1.x: 432/500 | 2.x: 374/500 | 3.x: 338/500 | 4.x+: 301/500 | Total: 1938/2500
Step 75100 | Loss: 0.4295 Acc: 93.05%
Step 75200 | Loss: 0.4708 Acc: 90.16%
Step 75300 | Loss: 0.4057 Acc: 93.66%
Step 75400 | Loss: 0.4373 Acc: 92.58%
Step 75500 | Loss: 0.5455 Acc: 88.58%
Step 75600 | Loss: 0.3805 Acc: 95.10%
Step 75700 | Loss: 0.4167 Acc: 92.81%
Step 75800 | Loss: 0.4289 Acc: 92.61%
Step 75900 | Loss: 0.4736 Acc: 90.90%
Step 76000 | Loss: 0.4483 Acc: 92.43%
Step 76100 | Loss: 0.3925 Acc: 93.48%
Step 76200 | Loss: 0.4383 Acc: 91.83%
Step 76300 | Loss: 0.3984 Acc: 94.19%
Step 76400 | Loss: 0.4200 Acc: 92.79%
Step 76500 | Loss: 0.3867 Acc: 93.68%
Step 76600 | Loss: 0.4650 Acc: 90.33%
Step 76700 | Loss: 0.4767 Acc: 91.35%
Step 76800 | Loss: 0.4342 Acc: 91.70%
Step 76900 | Loss: 0.4210 Acc: 93.34%
Step 77000 | Loss: 0.4275 Acc: 93.06%
Step 77100 | Loss: 0.4124 Acc: 93.17%
Step 77200 | Loss: 0.4462 Acc: 92.51%
Step 77300 | Loss: 0.4161 Acc: 92.99%
Step 77400 | Loss: 0.4494 Acc: 92.26%
Step 77500 | Loss: 0.4135 Acc: 93.55%
Step 77600 | Loss: 0.4577 Acc: 91.44%
Step 77700 | Loss: 0.4469 Acc: 91.71%
Step 77800 | Loss: 0.4327 Acc: 92.55%
Step 77900 | Loss: 0.4141 Acc: 92.38%
Step 78000 | Loss: 0.4593 Acc: 91.34%
Step 78100 | Loss: 0.4185 Acc: 93.12%
Step 78200 | Loss: 0.4021 Acc: 92.96%
Step 78300 | Loss: 0.4452 Acc: 91.94%
Step 78400 | Loss: 0.4193 Acc: 92.52%
Step 78500 | Loss: 0.4676 Acc: 91.85%
Step 78600 | Loss: 0.4611 Acc: 92.91%
Step 78700 | Loss: 0.4122 Acc: 93.73%
Step 78800 | Loss: 0.4093 Acc: 93.82%
Step 78900 | Loss: 0.4003 Acc: 92.71%
Step 79000 | Loss: 0.4495 Acc: 92.46%
Step 79100 | Loss: 0.4785 Acc: 89.90%
Step 79200 | Loss: 0.4655 Acc: 91.00%
Step 79300 | Loss: 0.3905 Acc: 93.68%
Step 79400 | Loss: 0.4315 Acc: 92.43%
Step 79500 | Loss: 0.4616 Acc: 92.06%
Step 79600 | Loss: 0.4184 Acc: 92.71%
Step 79700 | Loss: 0.4155 Acc: 92.08%
Step 79800 | Loss: 0.4032 Acc: 93.57%
Step 79900 | Loss: 0.4972 Acc: 91.04%

============================================================
Step 80000: Entering Phase 5: All (0.0+)
Training pool: 2997500 puzzles
============================================================

Step 80000 | Loss: 0.4442 Acc: 91.06% | 0.0: 497/500 | 1.x: 425/500 | 2.x: 388/500 | 3.x: 350/500 | 4.x+: 302/500 | Total: 1962/2500
Step 80100 | Loss: 0.4979 Acc: 91.61%
Step 80200 | Loss: 0.4532 Acc: 92.29%
Step 80300 | Loss: 0.4280 Acc: 92.62%
Step 80400 | Loss: 0.3870 Acc: 93.52%
Step 80500 | Loss: 0.4338 Acc: 93.04%
Step 80600 | Loss: 0.4389 Acc: 92.81%
Step 80700 | Loss: 0.4265 Acc: 93.27%
Step 80800 | Loss: 0.4666 Acc: 90.99%
Step 80900 | Loss: 0.3612 Acc: 95.14%
Step 81000 | Loss: 0.4712 Acc: 91.89%
Step 81100 | Loss: 0.4233 Acc: 92.93%
Step 81200 | Loss: 0.4171 Acc: 92.72%
Step 81300 | Loss: 0.5375 Acc: 88.33%
Step 81400 | Loss: 0.4031 Acc: 93.69%
Step 81500 | Loss: 0.4904 Acc: 90.83%
Step 81600 | Loss: 0.4400 Acc: 91.52%
Step 81700 | Loss: 0.4083 Acc: 92.97%
Step 81800 | Loss: 0.5134 Acc: 89.68%
Step 81900 | Loss: 0.4809 Acc: 89.87%
Step 82000 | Loss: 0.4871 Acc: 90.04%
Step 82100 | Loss: 0.4494 Acc: 91.36%
Step 82200 | Loss: 0.4945 Acc: 91.23%
Step 82300 | Loss: 0.4047 Acc: 93.16%
Step 82400 | Loss: 0.3902 Acc: 94.32%
Step 82500 | Loss: 0.4292 Acc: 92.57%
Step 82600 | Loss: 0.4309 Acc: 92.50%
Step 82700 | Loss: 0.4307 Acc: 92.03%
Step 82800 | Loss: 0.4822 Acc: 90.04%
Step 82900 | Loss: 0.4481 Acc: 91.40%
Step 83000 | Loss: 0.4351 Acc: 92.91%
Step 83100 | Loss: 0.4557 Acc: 92.22%
Step 83200 | Loss: 0.4595 Acc: 91.95%
Step 83300 | Loss: 0.4012 Acc: 93.89%
Step 83400 | Loss: 0.4186 Acc: 92.83%
Step 83500 | Loss: 0.4275 Acc: 92.02%
Step 83600 | Loss: 0.4487 Acc: 92.79%
Step 83700 | Loss: 0.4008 Acc: 93.82%
Step 83800 | Loss: 0.4104 Acc: 93.44%
Step 83900 | Loss: 0.3926 Acc: 93.85%
Step 84000 | Loss: 0.4124 Acc: 93.19%
Step 84100 | Loss: 0.4582 Acc: 91.00%
Step 84200 | Loss: 0.4519 Acc: 92.21%
Step 84300 | Loss: 0.5239 Acc: 88.39%
Step 84400 | Loss: 0.4362 Acc: 93.69%
Step 84500 | Loss: 0.4192 Acc: 92.44%
Step 84600 | Loss: 0.4411 Acc: 91.24%
Step 84700 | Loss: 0.4502 Acc: 90.65%
Step 84800 | Loss: 0.3727 Acc: 93.84%
Step 84900 | Loss: 0.4381 Acc: 92.55%
Step 85000 | Loss: 0.4356 Acc: 92.10% | 0.0: 496/500 | 1.x: 440/500 | 2.x: 381/500 | 3.x: 336/500 | 4.x+: 303/500 | Total: 1956/2500
Step 85100 | Loss: 0.4321 Acc: 93.13%
Step 85200 | Loss: 0.4090 Acc: 93.16%
Step 85300 | Loss: 0.3768 Acc: 94.71%
Step 85400 | Loss: 0.3879 Acc: 94.93%
Step 85500 | Loss: 0.4609 Acc: 90.80%
Step 85600 | Loss: 0.4182 Acc: 93.39%
Step 85700 | Loss: 0.3843 Acc: 94.01%
Step 85800 | Loss: 0.4186 Acc: 92.90%
Step 85900 | Loss: 0.4668 Acc: 91.22%
Step 86000 | Loss: 0.4095 Acc: 93.01%
Step 86100 | Loss: 0.4146 Acc: 93.45%
Step 86200 | Loss: 0.4913 Acc: 90.29%
Step 86300 | Loss: 0.4475 Acc: 92.03%
Step 86400 | Loss: 0.3975 Acc: 93.97%
Step 86500 | Loss: 0.4014 Acc: 93.86%
Step 86600 | Loss: 0.3717 Acc: 94.47%
Step 86700 | Loss: 0.4259 Acc: 92.39%
Step 86800 | Loss: 0.4486 Acc: 91.72%
Step 86900 | Loss: 0.4307 Acc: 92.58%
Step 87000 | Loss: 0.4683 Acc: 91.11%
Step 87100 | Loss: 0.4967 Acc: 89.99%
Step 87200 | Loss: 0.4626 Acc: 92.19%
Step 87300 | Loss: 0.4145 Acc: 93.88%
Step 87400 | Loss: 0.4248 Acc: 93.09%
Step 87500 | Loss: 0.4459 Acc: 91.56%
Step 87600 | Loss: 0.4118 Acc: 93.37%
Step 87700 | Loss: 0.4085 Acc: 93.53%
Step 87800 | Loss: 0.4493 Acc: 91.81%
Step 87900 | Loss: 0.4250 Acc: 92.34%
Step 88000 | Loss: 0.4564 Acc: 90.67%
Step 88100 | Loss: 0.4269 Acc: 92.29%
Step 88200 | Loss: 0.4855 Acc: 90.89%
Step 88300 | Loss: 0.3944 Acc: 94.07%
Step 88400 | Loss: 0.4776 Acc: 91.03%
Step 88500 | Loss: 0.4442 Acc: 91.61%
Step 88600 | Loss: 0.4398 Acc: 92.23%
Step 88700 | Loss: 0.4933 Acc: 89.78%
Step 88800 | Loss: 0.4767 Acc: 91.46%
Step 88900 | Loss: 0.4013 Acc: 93.35%
Step 89000 | Loss: 0.4065 Acc: 93.94%
Step 89100 | Loss: 0.4462 Acc: 91.58%
Step 89200 | Loss: 0.4131 Acc: 93.14%
Step 89300 | Loss: 0.4550 Acc: 91.07%
Step 89400 | Loss: 0.5054 Acc: 89.84%
Step 89500 | Loss: 0.4643 Acc: 90.56%
Step 89600 | Loss: 0.4608 Acc: 91.22%
Step 89700 | Loss: 0.4275 Acc: 93.09%
Step 89800 | Loss: 0.4797 Acc: 91.22%
Step 89900 | Loss: 0.4389 Acc: 92.83%
Step 90000 | Loss: 0.4340 Acc: 93.16% | 0.0: 495/500 | 1.x: 444/500 | 2.x: 372/500 | 3.x: 337/500 | 4.x+: 308/500 | Total: 1956/2500
Step 90100 | Loss: 0.4244 Acc: 93.59%
Step 90200 | Loss: 0.3969 Acc: 93.08%
Step 90300 | Loss: 0.4124 Acc: 92.89%
Step 90400 | Loss: 0.4149 Acc: 93.00%
Step 90500 | Loss: 0.4068 Acc: 94.25%
Step 90600 | Loss: 0.4069 Acc: 93.41%
Step 90700 | Loss: 0.4154 Acc: 93.68%
Step 90800 | Loss: 0.4466 Acc: 93.03%
Step 90900 | Loss: 0.5810 Acc: 88.01%
Step 91000 | Loss: 0.4241 Acc: 92.99%
Step 91100 | Loss: 0.4330 Acc: 91.97%
Step 91200 | Loss: 0.4245 Acc: 92.63%
Step 91300 | Loss: 0.4992 Acc: 89.99%
Step 91400 | Loss: 0.4029 Acc: 93.21%
Step 91500 | Loss: 0.4225 Acc: 92.97%
Step 91600 | Loss: 0.4251 Acc: 92.12%
Step 91700 | Loss: 0.4398 Acc: 92.18%
Step 91800 | Loss: 0.4513 Acc: 91.60%
Step 91900 | Loss: 0.3780 Acc: 94.39%
Step 92000 | Loss: 0.4012 Acc: 93.50%
Step 92100 | Loss: 0.4795 Acc: 90.44%
Step 92200 | Loss: 0.4383 Acc: 92.22%
Step 92300 | Loss: 0.4525 Acc: 92.89%
Step 92400 | Loss: 0.4571 Acc: 91.14%
Step 92500 | Loss: 0.4471 Acc: 91.73%
Step 92600 | Loss: 0.4439 Acc: 92.59%
Step 92700 | Loss: 0.4796 Acc: 90.61%
Step 92800 | Loss: 0.4498 Acc: 92.77%
Step 92900 | Loss: 0.4428 Acc: 92.45%
Step 93000 | Loss: 0.4214 Acc: 92.80%
Step 93100 | Loss: 0.4325 Acc: 92.32%
Step 93200 | Loss: 0.4464 Acc: 91.87%
Step 93300 | Loss: 0.4436 Acc: 92.59%
Step 93400 | Loss: 0.4494 Acc: 91.99%
Step 93500 | Loss: 0.3894 Acc: 94.20%
Step 93600 | Loss: 0.4661 Acc: 92.38%
Step 93700 | Loss: 0.4363 Acc: 91.47%
Step 93800 | Loss: 0.3969 Acc: 94.26%
Step 93900 | Loss: 0.4203 Acc: 92.85%
Step 94000 | Loss: 0.3991 Acc: 93.40%
Step 94100 | Loss: 0.3742 Acc: 94.77%
Step 94200 | Loss: 0.4250 Acc: 92.35%
Step 94300 | Loss: 0.4239 Acc: 93.26%
Step 94400 | Loss: 0.4337 Acc: 92.80%
Step 94500 | Loss: 0.6014 Acc: 88.00%
Step 94600 | Loss: 0.4310 Acc: 91.42%
Step 94700 | Loss: 0.4743 Acc: 91.47%
Step 94800 | Loss: 0.5035 Acc: 90.63%
Step 94900 | Loss: 0.4052 Acc: 93.17%
Step 95000 | Loss: 0.4648 Acc: 90.90% | 0.0: 496/500 | 1.x: 433/500 | 2.x: 370/500 | 3.x: 348/500 | 4.x+: 284/500 | Total: 1931/2500
Step 95100 | Loss: 0.4072 Acc: 93.11%
Step 95200 | Loss: 0.4284 Acc: 92.67%
Step 95300 | Loss: 0.4161 Acc: 93.66%
Step 95400 | Loss: 0.4175 Acc: 93.35%
Step 95500 | Loss: 0.4354 Acc: 92.29%
Step 95600 | Loss: 0.4177 Acc: 93.13%
Step 95700 | Loss: 0.4562 Acc: 91.12%
Step 95800 | Loss: 0.4712 Acc: 91.38%
Step 95900 | Loss: 0.5613 Acc: 88.59%
Step 96000 | Loss: 0.4367 Acc: 93.15%
Step 96100 | Loss: 0.5042 Acc: 89.36%
Step 96200 | Loss: 0.3748 Acc: 94.46%
Step 96300 | Loss: 0.4514 Acc: 91.52%
Step 96400 | Loss: 0.4196 Acc: 92.94%
Step 96500 | Loss: 0.4091 Acc: 92.91%
Step 96600 | Loss: 0.4273 Acc: 92.59%
Step 96700 | Loss: 0.5097 Acc: 88.76%
Step 96800 | Loss: 0.4470 Acc: 92.55%
Step 96900 | Loss: 0.4468 Acc: 91.33%
Step 97000 | Loss: 0.4108 Acc: 92.85%
Step 97100 | Loss: 0.3704 Acc: 95.97%
Step 97200 | Loss: 0.4185 Acc: 92.51%
Step 97300 | Loss: 0.3894 Acc: 94.23%
Step 97400 | Loss: 0.4555 Acc: 91.19%
Step 97500 | Loss: 0.4089 Acc: 93.60%
Step 97600 | Loss: 0.4014 Acc: 94.14%
Step 97700 | Loss: 0.4182 Acc: 92.60%
Step 97800 | Loss: 0.3763 Acc: 95.40%
Step 97900 | Loss: 0.4476 Acc: 92.71%
Step 98000 | Loss: 0.4011 Acc: 92.96%
Step 98100 | Loss: 0.4584 Acc: 91.27%
Step 98200 | Loss: 0.4025 Acc: 93.29%
Step 98300 | Loss: 0.4298 Acc: 93.62%
Step 98400 | Loss: 0.4703 Acc: 90.44%
Step 98500 | Loss: 0.4088 Acc: 93.22%
Step 98600 | Loss: 0.4339 Acc: 92.39%
Step 98700 | Loss: 0.4112 Acc: 93.56%
Step 98800 | Loss: 0.4547 Acc: 92.79%
Step 98900 | Loss: 0.3938 Acc: 94.23%
Step 99000 | Loss: 0.4167 Acc: 92.59%
Step 99100 | Loss: 0.4850 Acc: 91.89%
Step 99200 | Loss: 0.4844 Acc: 90.44%
Step 99300 | Loss: 0.4147 Acc: 93.52%
Step 99400 | Loss: 0.4528 Acc: 91.76%
Step 99500 | Loss: 0.5061 Acc: 89.70%
Step 99600 | Loss: 0.4810 Acc: 90.61%
Step 99700 | Loss: 0.4217 Acc: 92.39%
Step 99800 | Loss: 0.4171 Acc: 92.91%
Step 99900 | Loss: 0.4812 Acc: 90.93%
Step 99999 | Loss: 0.4436 Acc: 92.77% | 0.0: 493/500 | 1.x: 434/500 | 2.x: 367/500 | 3.x: 309/500 | 4.x+: 285/500 | Total: 1888/2500

============================================================
FINAL RESULTS - Scale Model (d=192, L=6)
============================================================
Difficulty 0.0   : 493/500 solved ( 98.6%), cell acc: 99.5%
Difficulty 1.x   : 434/500 solved ( 86.8%), cell acc: 95.0%
Difficulty 2.x   : 367/500 solved ( 73.4%), cell acc: 90.0%
Difficulty 3.x   : 309/500 solved ( 61.8%), cell acc: 84.8%
Difficulty 4.x+  : 285/500 solved ( 57.0%), cell acc: 82.1%

Total: 1888/2500 solved
Model saved to model_scale_model.pt
