
============================================================
Step 0: Entering Phase 1: Hard only (rating 21+)
Training pool: 281294 puzzles
============================================================

Step     0 | Loss: 17.3257 Acc: 11.19% | 0: 0/5000 | 1-2: 0/5000 | 3-10: 0/5000 | 11-50: 0/5000 | 51+: 0/5000 | Total: 0/25000 (0.0%)
Step   100 | Loss: 2.5713 Acc: 10.93%
Step   200 | Loss: 2.3492 Acc: 10.91%
Step   300 | Loss: 2.2901 Acc: 11.16%
Step   400 | Loss: 2.2463 Acc: 11.28%
Step   500 | Loss: 2.1775 Acc: 15.23%
Step   600 | Loss: 1.6717 Acc: 29.78%
Step   700 | Loss: 1.3879 Acc: 37.92%
Step   800 | Loss: 1.3139 Acc: 40.99%
Step   900 | Loss: 1.2811 Acc: 42.40%
Step  1000 | Loss: 1.2517 Acc: 44.07%
Step  1100 | Loss: 1.2361 Acc: 44.48%
Step  1200 | Loss: 1.2292 Acc: 44.84%
Step  1300 | Loss: 1.2186 Acc: 45.44%
Step  1400 | Loss: 1.2147 Acc: 45.53%
Step  1500 | Loss: 1.2053 Acc: 45.99%
Step  1600 | Loss: 1.1980 Acc: 46.52%
Step  1700 | Loss: 1.1967 Acc: 46.66%
Step  1800 | Loss: 1.1889 Acc: 46.81%
Step  1900 | Loss: 1.1915 Acc: 46.55%
Step  2000 | Loss: 1.1853 Acc: 46.77%
Step  2100 | Loss: 1.1803 Acc: 46.91%
Step  2200 | Loss: 1.1744 Acc: 47.52%
Step  2300 | Loss: 1.1850 Acc: 46.74%
Step  2400 | Loss: 1.1771 Acc: 47.37%
Step  2500 | Loss: 1.1685 Acc: 48.40%
Step  2600 | Loss: 1.1594 Acc: 48.73%
Step  2700 | Loss: 1.1487 Acc: 49.40%
Step  2800 | Loss: 1.1461 Acc: 49.62%
Step  2900 | Loss: 1.1359 Acc: 50.00%
Step  3000 | Loss: 1.1395 Acc: 49.82%
Step  3100 | Loss: 1.1256 Acc: 51.39%
Step  3200 | Loss: 1.1177 Acc: 51.96%
Step  3300 | Loss: 1.1041 Acc: 52.92%
Step  3400 | Loss: 1.1120 Acc: 52.14%
Step  3500 | Loss: 1.0914 Acc: 54.26%
Step  3600 | Loss: 1.0858 Acc: 54.33%
Step  3700 | Loss: 1.0704 Acc: 55.91%
Step  3800 | Loss: 1.0630 Acc: 56.53%
Step  3900 | Loss: 1.0469 Acc: 57.97%
Step  4000 | Loss: 1.0483 Acc: 57.67%
Step  4100 | Loss: 1.0318 Acc: 59.20%
Step  4200 | Loss: 1.0050 Acc: 61.67%
Step  4300 | Loss: 1.0094 Acc: 60.41%
Step  4400 | Loss: 0.9951 Acc: 61.43%
Step  4500 | Loss: 0.9839 Acc: 62.50%
Step  4600 | Loss: 0.9841 Acc: 62.35%
Step  4700 | Loss: 0.9800 Acc: 62.89%
Step  4800 | Loss: 0.9759 Acc: 63.48%
Step  4900 | Loss: 0.9653 Acc: 63.04%
Step  5000 | Loss: 0.9584 Acc: 64.18% | 0: 1335/5000 | 1-2: 151/5000 | 3-10: 357/5000 | 11-50: 546/5000 | 51+: 708/5000 | Total: 3097/25000 (12.4%)
Step  5100 | Loss: 0.9439 Acc: 65.79%
Step  5200 | Loss: 0.9479 Acc: 65.78%
Step  5300 | Loss: 0.9341 Acc: 66.96%
Step  5400 | Loss: 0.9363 Acc: 65.93%
Step  5500 | Loss: 0.9334 Acc: 66.88%
Step  5600 | Loss: 0.9225 Acc: 66.80%
Step  5700 | Loss: 0.9137 Acc: 67.59%
Step  5800 | Loss: 0.8885 Acc: 69.30%
Step  5900 | Loss: 0.9162 Acc: 68.31%
Step  6000 | Loss: 0.9020 Acc: 68.96%
Step  6100 | Loss: 0.8952 Acc: 69.48%
Step  6200 | Loss: 0.9072 Acc: 69.42%
Step  6300 | Loss: 0.9107 Acc: 68.91%
Step  6400 | Loss: 0.8848 Acc: 70.11%
Step  6500 | Loss: 0.9006 Acc: 69.73%
Step  6600 | Loss: 0.8631 Acc: 70.76%
Step  6700 | Loss: 0.8473 Acc: 72.18%
Step  6800 | Loss: 0.8772 Acc: 70.68%
Step  6900 | Loss: 0.8527 Acc: 72.26%
Step  7000 | Loss: 0.8501 Acc: 71.53%
Step  7100 | Loss: 0.8635 Acc: 72.39%
Step  7200 | Loss: 0.8551 Acc: 71.86%
Step  7300 | Loss: 0.8573 Acc: 72.09%
Step  7400 | Loss: 0.8573 Acc: 72.28%
Step  7500 | Loss: 0.8564 Acc: 72.15%
Step  7600 | Loss: 0.8437 Acc: 72.87%
Step  7700 | Loss: 0.8401 Acc: 73.42%
Step  7800 | Loss: 0.8236 Acc: 74.40%
Step  7900 | Loss: 0.8369 Acc: 72.63%
Step  8000 | Loss: 0.8099 Acc: 75.26%
Step  8100 | Loss: 0.8097 Acc: 75.28%
Step  8200 | Loss: 0.8172 Acc: 73.84%
Step  8300 | Loss: 0.8019 Acc: 74.97%
Step  8400 | Loss: 0.8317 Acc: 74.12%
Step  8500 | Loss: 0.8088 Acc: 75.42%
Step  8600 | Loss: 0.8274 Acc: 73.58%
Step  8700 | Loss: 0.7841 Acc: 76.22%
Step  8800 | Loss: 0.7733 Acc: 77.28%
Step  8900 | Loss: 0.8019 Acc: 74.98%
Step  9000 | Loss: 0.7904 Acc: 76.60%
Step  9100 | Loss: 0.8041 Acc: 75.71%
Step  9200 | Loss: 0.7866 Acc: 76.60%
Step  9300 | Loss: 0.8111 Acc: 75.06%
Step  9400 | Loss: 0.8102 Acc: 75.40%
Step  9500 | Loss: 0.7687 Acc: 77.33%
Step  9600 | Loss: 0.7613 Acc: 78.64%
Step  9700 | Loss: 0.7928 Acc: 76.42%
Step  9800 | Loss: 0.7853 Acc: 76.39%
Step  9900 | Loss: 0.7956 Acc: 77.61%
Step 10000 | Loss: 0.7294 Acc: 80.52% | 0: 4215/5000 | 1-2: 2614/5000 | 3-10: 1618/5000 | 11-50: 2081/5000 | 51+: 2630/5000 | Total: 13158/25000 (52.6%)
Step 10100 | Loss: 0.7511 Acc: 78.65%
Step 10200 | Loss: 0.7779 Acc: 78.06%
Step 10300 | Loss: 0.7603 Acc: 78.93%
Step 10400 | Loss: 0.7627 Acc: 78.73%
Step 10500 | Loss: 0.7673 Acc: 78.17%
Step 10600 | Loss: 0.7747 Acc: 77.79%
Step 10700 | Loss: 0.7616 Acc: 78.69%
Step 10800 | Loss: 0.7834 Acc: 77.87%
Step 10900 | Loss: 0.7368 Acc: 79.27%
Step 11000 | Loss: 0.7866 Acc: 77.01%
Step 11100 | Loss: 0.7503 Acc: 79.61%
Step 11200 | Loss: 0.7713 Acc: 77.94%
Step 11300 | Loss: 0.7524 Acc: 78.57%
Step 11400 | Loss: 0.7861 Acc: 76.68%
Step 11500 | Loss: 0.7668 Acc: 78.35%
Step 11600 | Loss: 0.7742 Acc: 77.73%
Step 11700 | Loss: 0.7561 Acc: 78.74%
Step 11800 | Loss: 0.7696 Acc: 78.08%
Step 11900 | Loss: 0.7504 Acc: 79.26%
Step 12000 | Loss: 0.7525 Acc: 79.12%
Step 12100 | Loss: 0.7214 Acc: 80.30%
Step 12200 | Loss: 0.7484 Acc: 79.20%
Step 12300 | Loss: 0.7543 Acc: 79.15%
Step 12400 | Loss: 0.7415 Acc: 79.38%
Step 12500 | Loss: 0.7506 Acc: 79.39%
Step 12600 | Loss: 0.7361 Acc: 78.68%
Step 12700 | Loss: 0.7446 Acc: 79.74%
Step 12800 | Loss: 0.7292 Acc: 80.24%
Step 12900 | Loss: 0.6942 Acc: 83.42%
Step 13000 | Loss: 0.7695 Acc: 78.15%
Step 13100 | Loss: 0.7231 Acc: 81.36%
Step 13200 | Loss: 0.7385 Acc: 80.33%
Step 13300 | Loss: 0.7440 Acc: 80.29%
Step 13400 | Loss: 0.7226 Acc: 80.91%
Step 13500 | Loss: 0.7571 Acc: 78.42%
Step 13600 | Loss: 0.7349 Acc: 80.82%
Step 13700 | Loss: 0.7432 Acc: 79.85%
Step 13800 | Loss: 0.7544 Acc: 78.74%
Step 13900 | Loss: 0.7239 Acc: 81.03%

============================================================
Step 14000: Entering Phase 2: Medium+ (rating 6+)
Training pool: 1641360 puzzles
============================================================

Step 14000 | Loss: 0.8205 Acc: 73.97%
Step 14100 | Loss: 0.8053 Acc: 72.47%
Step 14200 | Loss: 0.8089 Acc: 73.03%
Step 14300 | Loss: 0.8160 Acc: 72.64%
Step 14400 | Loss: 0.7875 Acc: 74.05%
Step 14500 | Loss: 0.7962 Acc: 74.97%
Step 14600 | Loss: 0.7829 Acc: 74.44%
Step 14700 | Loss: 0.7973 Acc: 73.80%
Step 14800 | Loss: 0.8223 Acc: 72.24%
Step 14900 | Loss: 0.8190 Acc: 72.42%
Step 15000 | Loss: 0.8114 Acc: 72.78% | 0: 4545/5000 | 1-2: 3110/5000 | 3-10: 2116/5000 | 11-50: 2457/5000 | 51+: 2895/5000 | Total: 15123/25000 (60.5%)
Step 15100 | Loss: 0.7891 Acc: 73.69%
Step 15200 | Loss: 0.8165 Acc: 72.52%
Step 15300 | Loss: 0.7787 Acc: 75.26%
Step 15400 | Loss: 0.7610 Acc: 75.96%
Step 15500 | Loss: 0.7665 Acc: 74.51%
Step 15600 | Loss: 0.8052 Acc: 73.42%
Step 15700 | Loss: 0.7977 Acc: 74.23%
Step 15800 | Loss: 0.7893 Acc: 74.12%
Step 15900 | Loss: 0.7788 Acc: 74.65%
Step 16000 | Loss: 0.7749 Acc: 74.17%
Step 16100 | Loss: 0.7941 Acc: 73.47%
Step 16200 | Loss: 0.8126 Acc: 73.29%
Step 16300 | Loss: 0.7911 Acc: 73.96%
Step 16400 | Loss: 0.7443 Acc: 76.29%
Step 16500 | Loss: 0.7770 Acc: 74.99%
Step 16600 | Loss: 0.7357 Acc: 77.88%
Step 16700 | Loss: 0.7834 Acc: 74.40%
Step 16800 | Loss: 0.7779 Acc: 75.55%
Step 16900 | Loss: 0.8293 Acc: 71.64%
Step 17000 | Loss: 0.8308 Acc: 71.74%
Step 17100 | Loss: 0.7719 Acc: 74.92%
Step 17200 | Loss: 0.7964 Acc: 74.32%
Step 17300 | Loss: 0.7963 Acc: 73.78%
Step 17400 | Loss: 0.7866 Acc: 75.05%
Step 17500 | Loss: 0.7845 Acc: 73.86%
Step 17600 | Loss: 0.7717 Acc: 75.28%
Step 17700 | Loss: 0.7873 Acc: 74.00%
Step 17800 | Loss: 0.7839 Acc: 73.80%
Step 17900 | Loss: 0.7567 Acc: 76.32%
Step 18000 | Loss: 0.7809 Acc: 74.36%
Step 18100 | Loss: 0.7735 Acc: 75.18%
Step 18200 | Loss: 0.7646 Acc: 75.76%
Step 18300 | Loss: 0.8051 Acc: 73.10%
Step 18400 | Loss: 0.7717 Acc: 75.40%
Step 18500 | Loss: 0.7656 Acc: 75.41%
Step 18600 | Loss: 0.7648 Acc: 75.77%
Step 18700 | Loss: 0.7635 Acc: 75.52%
Step 18800 | Loss: 0.7497 Acc: 76.44%
Step 18900 | Loss: 0.7558 Acc: 76.42%
Step 19000 | Loss: 0.7818 Acc: 74.47%
Step 19100 | Loss: 0.7414 Acc: 76.22%
Step 19200 | Loss: 0.7738 Acc: 74.44%
Step 19300 | Loss: 0.7603 Acc: 75.85%
Step 19400 | Loss: 0.7716 Acc: 75.40%
Step 19500 | Loss: 0.7529 Acc: 76.19%
Step 19600 | Loss: 0.7782 Acc: 74.47%
Step 19700 | Loss: 0.8067 Acc: 73.24%
Step 19800 | Loss: 0.7829 Acc: 74.26%
Step 19900 | Loss: 0.7846 Acc: 74.24%
Step 20000 | Loss: 0.7809 Acc: 74.59% | 0: 4546/5000 | 1-2: 3168/5000 | 3-10: 2250/5000 | 11-50: 2591/5000 | 51+: 3018/5000 | Total: 15573/25000 (62.3%)
Step 20100 | Loss: 0.7587 Acc: 76.21%
Step 20200 | Loss: 0.7694 Acc: 74.88%
Step 20300 | Loss: 0.7908 Acc: 73.97%
Step 20400 | Loss: 0.7915 Acc: 74.11%
Step 20500 | Loss: 0.7951 Acc: 73.62%
Step 20600 | Loss: 0.7868 Acc: 74.18%
Step 20700 | Loss: 0.8026 Acc: 73.19%
Step 20800 | Loss: 0.7791 Acc: 74.80%
Step 20900 | Loss: 0.7750 Acc: 74.70%
Step 21000 | Loss: 0.8113 Acc: 73.29%
Step 21100 | Loss: 0.7660 Acc: 76.23%
Step 21200 | Loss: 0.7769 Acc: 74.06%
Step 21300 | Loss: 0.7356 Acc: 77.11%
Step 21400 | Loss: 0.7393 Acc: 77.24%
Step 21500 | Loss: 0.7389 Acc: 77.41%
Step 21600 | Loss: 0.7907 Acc: 73.16%
Step 21700 | Loss: 0.7587 Acc: 76.27%
Step 21800 | Loss: 0.7608 Acc: 76.34%
Step 21900 | Loss: 0.7555 Acc: 75.99%
Step 22000 | Loss: 0.7536 Acc: 75.79%
Step 22100 | Loss: 0.7536 Acc: 77.03%
Step 22200 | Loss: 0.7512 Acc: 75.57%
Step 22300 | Loss: 0.7734 Acc: 74.22%
Step 22400 | Loss: 0.7420 Acc: 75.67%
Step 22500 | Loss: 0.7591 Acc: 74.93%
Step 22600 | Loss: 0.7842 Acc: 73.42%
Step 22700 | Loss: 0.7660 Acc: 75.01%
Step 22800 | Loss: 0.7284 Acc: 77.19%
Step 22900 | Loss: 0.7517 Acc: 75.35%
Step 23000 | Loss: 0.7672 Acc: 74.87%
Step 23100 | Loss: 0.7601 Acc: 75.90%
Step 23200 | Loss: 0.7397 Acc: 76.51%
Step 23300 | Loss: 0.7487 Acc: 75.66%
Step 23400 | Loss: 0.7565 Acc: 75.66%
Step 23500 | Loss: 0.7481 Acc: 76.71%
Step 23600 | Loss: 0.7762 Acc: 74.28%
Step 23700 | Loss: 0.7382 Acc: 77.11%
Step 23800 | Loss: 0.7861 Acc: 74.65%
Step 23900 | Loss: 0.7696 Acc: 74.43%
Step 24000 | Loss: 0.7304 Acc: 77.14%
Step 24100 | Loss: 0.7469 Acc: 76.14%
Step 24200 | Loss: 0.7725 Acc: 74.76%
Step 24300 | Loss: 0.7622 Acc: 76.24%
Step 24400 | Loss: 0.7255 Acc: 77.57%
Step 24500 | Loss: 0.7759 Acc: 74.55%
Step 24600 | Loss: 0.7624 Acc: 74.96%
Step 24700 | Loss: 0.7291 Acc: 77.06%
Step 24800 | Loss: 0.7611 Acc: 75.18%
Step 24900 | Loss: 0.7596 Acc: 75.03%
Step 25000 | Loss: 0.7949 Acc: 73.87% | 0: 4612/5000 | 1-2: 3281/5000 | 3-10: 2302/5000 | 11-50: 2629/5000 | 51+: 3081/5000 | Total: 15905/25000 (63.6%)
Step 25100 | Loss: 0.7433 Acc: 76.91%
Step 25200 | Loss: 0.7700 Acc: 74.73%
Step 25300 | Loss: 0.7598 Acc: 75.39%
Step 25400 | Loss: 0.7436 Acc: 77.03%
Step 25500 | Loss: 0.7408 Acc: 76.93%
Step 25600 | Loss: 0.7878 Acc: 73.39%
Step 25700 | Loss: 0.7201 Acc: 77.14%
Step 25800 | Loss: 0.7405 Acc: 76.72%
Step 25900 | Loss: 0.8017 Acc: 72.93%
Step 26000 | Loss: 0.7613 Acc: 75.88%
Step 26100 | Loss: 0.7511 Acc: 75.89%
Step 26200 | Loss: 0.7783 Acc: 75.54%
Step 26300 | Loss: 0.7420 Acc: 76.02%
Step 26400 | Loss: 0.7603 Acc: 75.79%
Step 26500 | Loss: 0.7582 Acc: 75.91%
Step 26600 | Loss: 0.7363 Acc: 76.61%
Step 26700 | Loss: 0.7782 Acc: 74.03%
Step 26800 | Loss: 0.7644 Acc: 75.55%
Step 26900 | Loss: 0.7509 Acc: 75.32%
Step 27000 | Loss: 0.7348 Acc: 75.82%
Step 27100 | Loss: 0.7637 Acc: 75.64%
Step 27200 | Loss: 0.7725 Acc: 74.09%
Step 27300 | Loss: 0.7554 Acc: 75.50%
Step 27400 | Loss: 0.7629 Acc: 75.52%
Step 27500 | Loss: 0.7842 Acc: 74.04%
Step 27600 | Loss: 0.7588 Acc: 76.27%
Step 27700 | Loss: 0.7620 Acc: 74.79%
Step 27800 | Loss: 0.7196 Acc: 77.56%
Step 27900 | Loss: 0.7254 Acc: 78.15%

============================================================
Step 28000: Entering Phase 3: Easy+ (rating 1+)
Training pool: 2312068 puzzles
============================================================

Step 28000 | Loss: 0.7598 Acc: 75.10%
Step 28100 | Loss: 0.7587 Acc: 75.64%
Step 28200 | Loss: 0.7796 Acc: 73.75%
Step 28300 | Loss: 0.7390 Acc: 76.56%
Step 28400 | Loss: 0.7458 Acc: 75.30%
Step 28500 | Loss: 0.7364 Acc: 77.10%
Step 28600 | Loss: 0.7496 Acc: 76.04%
Step 28700 | Loss: 0.7540 Acc: 75.57%
Step 28800 | Loss: 0.7194 Acc: 78.42%
Step 28900 | Loss: 0.7687 Acc: 74.82%
Step 29000 | Loss: 0.7080 Acc: 78.55%
Step 29100 | Loss: 0.7464 Acc: 76.60%
Step 29200 | Loss: 0.7526 Acc: 76.03%
Step 29300 | Loss: 0.7214 Acc: 77.64%
Step 29400 | Loss: 0.7247 Acc: 77.85%
Step 29500 | Loss: 0.7784 Acc: 74.81%
Step 29600 | Loss: 0.7639 Acc: 75.65%
Step 29700 | Loss: 0.7624 Acc: 75.62%
Step 29800 | Loss: 0.7357 Acc: 76.83%
Step 29900 | Loss: 0.7660 Acc: 74.87%
Step 30000 | Loss: 0.7431 Acc: 76.51% | 0: 4783/5000 | 1-2: 3680/5000 | 3-10: 2459/5000 | 11-50: 2707/5000 | 51+: 3070/5000 | Total: 16699/25000 (66.8%)
Step 30100 | Loss: 0.7191 Acc: 77.52%
Step 30200 | Loss: 0.7560 Acc: 74.40%
Step 30300 | Loss: 0.7480 Acc: 76.78%
Step 30400 | Loss: 0.7756 Acc: 74.52%
Step 30500 | Loss: 0.7494 Acc: 75.78%
Step 30600 | Loss: 0.7657 Acc: 74.85%
Step 30700 | Loss: 0.7555 Acc: 76.03%
Step 30800 | Loss: 0.7459 Acc: 76.33%
Step 30900 | Loss: 0.7157 Acc: 78.15%
Step 31000 | Loss: 0.7495 Acc: 75.89%
Step 31100 | Loss: 0.7257 Acc: 77.17%
Step 31200 | Loss: 0.7531 Acc: 75.18%
Step 31300 | Loss: 0.7336 Acc: 77.10%
Step 31400 | Loss: 0.7588 Acc: 76.02%
Step 31500 | Loss: 0.7147 Acc: 78.80%
Step 31600 | Loss: 0.7407 Acc: 75.90%
Step 31700 | Loss: 0.7450 Acc: 75.78%
Step 31800 | Loss: 0.7347 Acc: 77.11%
Step 31900 | Loss: 0.7479 Acc: 76.20%
Step 32000 | Loss: 0.7593 Acc: 75.94%
Step 32100 | Loss: 0.7542 Acc: 76.22%
Step 32200 | Loss: 0.7468 Acc: 76.47%
Step 32300 | Loss: 0.7302 Acc: 76.97%
Step 32400 | Loss: 0.7287 Acc: 77.40%
Step 32500 | Loss: 0.7490 Acc: 76.36%
Step 32600 | Loss: 0.7516 Acc: 75.07%
Step 32700 | Loss: 0.7619 Acc: 76.63%
Step 32800 | Loss: 0.7327 Acc: 77.49%
Step 32900 | Loss: 0.7563 Acc: 76.07%
Step 33000 | Loss: 0.7561 Acc: 74.90%
Step 33100 | Loss: 0.7309 Acc: 77.15%
Step 33200 | Loss: 0.7676 Acc: 74.73%
Step 33300 | Loss: 0.7466 Acc: 76.82%
Step 33400 | Loss: 0.7670 Acc: 74.44%
Step 33500 | Loss: 0.7279 Acc: 78.10%
Step 33600 | Loss: 0.7763 Acc: 75.30%
Step 33700 | Loss: 0.7223 Acc: 77.23%
Step 33800 | Loss: 0.7443 Acc: 76.18%
Step 33900 | Loss: 0.7515 Acc: 75.45%
Step 34000 | Loss: 0.7532 Acc: 75.71%
Step 34100 | Loss: 0.7588 Acc: 75.99%
Step 34200 | Loss: 0.7296 Acc: 77.59%
Step 34300 | Loss: 0.7361 Acc: 76.91%
Step 34400 | Loss: 0.7711 Acc: 75.31%
Step 34500 | Loss: 0.7857 Acc: 73.47%
Step 34600 | Loss: 0.7227 Acc: 77.64%
Step 34700 | Loss: 0.7260 Acc: 77.82%
Step 34800 | Loss: 0.7407 Acc: 76.26%
Step 34900 | Loss: 0.7181 Acc: 77.60%
Step 35000 | Loss: 0.6859 Acc: 80.05% | 0: 4855/5000 | 1-2: 3810/5000 | 3-10: 2511/5000 | 11-50: 2723/5000 | 51+: 3132/5000 | Total: 17031/25000 (68.1%)
Step 35100 | Loss: 0.7414 Acc: 77.56%
Step 35200 | Loss: 0.7786 Acc: 74.37%
Step 35300 | Loss: 0.7186 Acc: 76.90%
Step 35400 | Loss: 0.7389 Acc: 76.88%
Step 35500 | Loss: 0.7429 Acc: 76.69%
Step 35600 | Loss: 0.7340 Acc: 76.69%
Step 35700 | Loss: 0.7473 Acc: 75.42%
Step 35800 | Loss: 0.7174 Acc: 78.49%
Step 35900 | Loss: 0.7239 Acc: 77.79%
Step 36000 | Loss: 0.7554 Acc: 76.52%
Step 36100 | Loss: 0.7523 Acc: 75.42%
Step 36200 | Loss: 0.7549 Acc: 76.25%
Step 36300 | Loss: 0.7523 Acc: 76.27%
Step 36400 | Loss: 0.6845 Acc: 80.49%
Step 36500 | Loss: 0.7068 Acc: 78.37%
Step 36600 | Loss: 0.7415 Acc: 76.34%
Step 36700 | Loss: 0.7407 Acc: 77.18%
Step 36800 | Loss: 0.7394 Acc: 77.15%
Step 36900 | Loss: 0.6894 Acc: 78.74%
Step 37000 | Loss: 0.7535 Acc: 76.18%
Step 37100 | Loss: 0.7604 Acc: 75.51%
Step 37200 | Loss: 0.7411 Acc: 76.32%
Step 37300 | Loss: 0.7514 Acc: 76.18%
Step 37400 | Loss: 0.7481 Acc: 76.38%
Step 37500 | Loss: 0.7713 Acc: 75.14%
Step 37600 | Loss: 0.7442 Acc: 76.76%
Step 37700 | Loss: 0.7418 Acc: 76.31%
Step 37800 | Loss: 0.7603 Acc: 74.97%
Step 37900 | Loss: 0.7354 Acc: 77.65%
Step 38000 | Loss: 0.7430 Acc: 76.53%
Step 38100 | Loss: 0.7424 Acc: 77.48%
Step 38200 | Loss: 0.7191 Acc: 77.82%
Step 38300 | Loss: 0.7494 Acc: 77.26%
Step 38400 | Loss: 0.7305 Acc: 77.13%
Step 38500 | Loss: 0.7577 Acc: 75.41%
Step 38600 | Loss: 0.7253 Acc: 77.61%
Step 38700 | Loss: 0.7463 Acc: 76.63%
Step 38800 | Loss: 0.7250 Acc: 77.89%
Step 38900 | Loss: 0.7280 Acc: 77.44%
Step 39000 | Loss: 0.7491 Acc: 76.90%
Step 39100 | Loss: 0.7760 Acc: 73.92%
Step 39200 | Loss: 0.7632 Acc: 75.23%
Step 39300 | Loss: 0.7449 Acc: 75.59%
Step 39400 | Loss: 0.7331 Acc: 77.07%
Step 39500 | Loss: 0.7414 Acc: 77.25%
Step 39600 | Loss: 0.7357 Acc: 76.68%
Step 39700 | Loss: 0.7638 Acc: 74.97%
Step 39800 | Loss: 0.7230 Acc: 77.81%
Step 39900 | Loss: 0.7176 Acc: 78.15%
Step 40000 | Loss: 0.7559 Acc: 75.23% | 0: 4881/5000 | 1-2: 3868/5000 | 3-10: 2562/5000 | 11-50: 2773/5000 | 51+: 3191/5000 | Total: 17275/25000 (69.1%)
Step 40100 | Loss: 0.7189 Acc: 77.79%
Step 40200 | Loss: 0.7448 Acc: 76.71%
Step 40300 | Loss: 0.7268 Acc: 77.89%
Step 40400 | Loss: 0.7414 Acc: 76.19%
Step 40500 | Loss: 0.7326 Acc: 77.59%
Step 40600 | Loss: 0.7138 Acc: 77.95%
Step 40700 | Loss: 0.7488 Acc: 76.71%
Step 40800 | Loss: 0.7237 Acc: 77.54%
Step 40900 | Loss: 0.7216 Acc: 78.03%
Step 41000 | Loss: 0.7610 Acc: 75.68%
Step 41100 | Loss: 0.7231 Acc: 77.44%
Step 41200 | Loss: 0.7219 Acc: 78.02%
Step 41300 | Loss: 0.7240 Acc: 76.90%
Step 41400 | Loss: 0.7188 Acc: 76.90%
Step 41500 | Loss: 0.7212 Acc: 77.53%
Step 41600 | Loss: 0.7179 Acc: 77.93%
Step 41700 | Loss: 0.7536 Acc: 75.38%
Step 41800 | Loss: 0.7397 Acc: 76.37%
Step 41900 | Loss: 0.7115 Acc: 77.94%

============================================================
Step 42000: Entering Phase 4: All (rating 0+)
Training pool: 2700000 puzzles
============================================================

Step 42000 | Loss: 0.7197 Acc: 78.66%
Step 42100 | Loss: 0.6724 Acc: 81.25%
Step 42200 | Loss: 0.6663 Acc: 81.13%
Step 42300 | Loss: 0.6691 Acc: 80.51%
Step 42400 | Loss: 0.6571 Acc: 81.90%
Step 42500 | Loss: 0.6552 Acc: 80.99%
Step 42600 | Loss: 0.6420 Acc: 81.34%
Step 42700 | Loss: 0.6806 Acc: 79.27%
Step 42800 | Loss: 0.6808 Acc: 79.23%
Step 42900 | Loss: 0.6860 Acc: 78.70%
Step 43000 | Loss: 0.6684 Acc: 80.16%
Step 43100 | Loss: 0.6945 Acc: 79.05%
Step 43200 | Loss: 0.7018 Acc: 78.24%
Step 43300 | Loss: 0.6630 Acc: 80.19%
Step 43400 | Loss: 0.6886 Acc: 78.93%
Step 43500 | Loss: 0.6892 Acc: 78.95%
Step 43600 | Loss: 0.6453 Acc: 81.92%
Step 43700 | Loss: 0.6798 Acc: 79.91%
Step 43800 | Loss: 0.6632 Acc: 80.95%
Step 43900 | Loss: 0.6852 Acc: 78.48%
Step 44000 | Loss: 0.6595 Acc: 81.17%
Step 44100 | Loss: 0.6633 Acc: 81.31%
Step 44200 | Loss: 0.6673 Acc: 79.54%
Step 44300 | Loss: 0.6913 Acc: 78.52%
Step 44400 | Loss: 0.6728 Acc: 80.21%
Step 44500 | Loss: 0.6874 Acc: 79.38%
Step 44600 | Loss: 0.6819 Acc: 79.01%
Step 44700 | Loss: 0.6615 Acc: 81.26%
Step 44800 | Loss: 0.6388 Acc: 81.56%
Step 44900 | Loss: 0.6320 Acc: 82.27%
Step 45000 | Loss: 0.6938 Acc: 79.06% | 0: 4890/5000 | 1-2: 3817/5000 | 3-10: 2532/5000 | 11-50: 2742/5000 | 51+: 3100/5000 | Total: 17081/25000 (68.3%)
Step 45100 | Loss: 0.6387 Acc: 81.81%
Step 45200 | Loss: 0.6861 Acc: 78.73%
Step 45300 | Loss: 0.6459 Acc: 82.54%
Step 45400 | Loss: 0.6569 Acc: 80.41%
Step 45500 | Loss: 0.6591 Acc: 80.62%
Step 45600 | Loss: 0.6540 Acc: 82.07%
Step 45700 | Loss: 0.6866 Acc: 78.65%
Step 45800 | Loss: 0.6800 Acc: 79.37%
Step 45900 | Loss: 0.6999 Acc: 78.33%
Step 46000 | Loss: 0.6489 Acc: 82.07%
Step 46100 | Loss: 0.6476 Acc: 81.39%
Step 46200 | Loss: 0.6695 Acc: 80.16%
Step 46300 | Loss: 0.6792 Acc: 79.82%
Step 46400 | Loss: 0.6311 Acc: 82.18%
Step 46500 | Loss: 0.6555 Acc: 80.20%
Step 46600 | Loss: 0.6695 Acc: 79.72%
Step 46700 | Loss: 0.6613 Acc: 81.08%
Step 46800 | Loss: 0.6501 Acc: 81.35%
Step 46900 | Loss: 0.6463 Acc: 81.46%
Step 47000 | Loss: 0.6613 Acc: 80.29%
Step 47100 | Loss: 0.6849 Acc: 79.74%
Step 47200 | Loss: 0.6781 Acc: 79.89%
Step 47300 | Loss: 0.6410 Acc: 82.49%
Step 47400 | Loss: 0.6848 Acc: 79.09%
Step 47500 | Loss: 0.7009 Acc: 78.33%
Step 47600 | Loss: 0.6472 Acc: 80.85%
Step 47700 | Loss: 0.6434 Acc: 81.75%
Step 47800 | Loss: 0.6896 Acc: 78.68%
Step 47900 | Loss: 0.6656 Acc: 79.61%
Step 48000 | Loss: 0.6400 Acc: 81.41%
Step 48100 | Loss: 0.6769 Acc: 79.71%
Step 48200 | Loss: 0.6387 Acc: 82.49%
Step 48300 | Loss: 0.6673 Acc: 80.28%
Step 48400 | Loss: 0.6905 Acc: 78.94%
Step 48500 | Loss: 0.6643 Acc: 80.67%
Step 48600 | Loss: 0.6336 Acc: 81.56%
Step 48700 | Loss: 0.6766 Acc: 80.34%
Step 48800 | Loss: 0.6907 Acc: 78.67%
Step 48900 | Loss: 0.6875 Acc: 79.36%
Step 49000 | Loss: 0.6712 Acc: 79.70%
Step 49100 | Loss: 0.6665 Acc: 80.20%
Step 49200 | Loss: 0.6521 Acc: 81.13%
Step 49300 | Loss: 0.6820 Acc: 79.45%
Step 49400 | Loss: 0.6531 Acc: 80.85%
Step 49500 | Loss: 0.6363 Acc: 82.10%
Step 49600 | Loss: 0.6661 Acc: 80.38%
Step 49700 | Loss: 0.6902 Acc: 79.43%
Step 49800 | Loss: 0.6110 Acc: 83.25%
Step 49900 | Loss: 0.6884 Acc: 79.28%
Step 50000 | Loss: 0.6344 Acc: 81.87% | 0: 4916/5000 | 1-2: 3978/5000 | 3-10: 2690/5000 | 11-50: 2858/5000 | 51+: 3248/5000 | Total: 17690/25000 (70.8%)
Step 50100 | Loss: 0.6649 Acc: 80.51%
Step 50200 | Loss: 0.6648 Acc: 79.30%
Step 50300 | Loss: 0.6563 Acc: 81.03%
Step 50400 | Loss: 0.6757 Acc: 79.72%
Step 50500 | Loss: 0.6911 Acc: 79.63%
Step 50600 | Loss: 0.6235 Acc: 82.82%
Step 50700 | Loss: 0.6231 Acc: 83.65%
Step 50800 | Loss: 0.6700 Acc: 79.97%
Step 50900 | Loss: 0.6902 Acc: 78.66%
Step 51000 | Loss: 0.6669 Acc: 80.26%
Step 51100 | Loss: 0.6709 Acc: 79.82%
Step 51200 | Loss: 0.6635 Acc: 80.74%
Step 51300 | Loss: 0.6861 Acc: 79.37%
Step 51400 | Loss: 0.6197 Acc: 83.28%
Step 51500 | Loss: 0.6456 Acc: 82.02%
Step 51600 | Loss: 0.6540 Acc: 81.50%
Step 51700 | Loss: 0.6539 Acc: 81.25%
Step 51800 | Loss: 0.6333 Acc: 82.92%
Step 51900 | Loss: 0.6764 Acc: 79.03%
Step 52000 | Loss: 0.6920 Acc: 79.00%
Step 52100 | Loss: 0.6616 Acc: 80.98%
Step 52200 | Loss: 0.6638 Acc: 80.81%
Step 52300 | Loss: 0.6663 Acc: 80.82%
Step 52400 | Loss: 0.6694 Acc: 79.96%
Step 52500 | Loss: 0.6693 Acc: 79.40%
Step 52600 | Loss: 0.6618 Acc: 80.22%
Step 52700 | Loss: 0.6682 Acc: 79.32%
Step 52800 | Loss: 0.6625 Acc: 80.60%
Step 52900 | Loss: 0.6481 Acc: 81.69%
Step 53000 | Loss: 0.6348 Acc: 82.13%
Step 53100 | Loss: 0.6580 Acc: 80.16%
Step 53200 | Loss: 0.6503 Acc: 81.60%
Step 53300 | Loss: 0.6566 Acc: 81.23%
Step 53400 | Loss: 0.6659 Acc: 80.06%
Step 53500 | Loss: 0.6375 Acc: 81.87%
Step 53600 | Loss: 0.6651 Acc: 79.56%
Step 53700 | Loss: 0.6779 Acc: 78.91%
Step 53800 | Loss: 0.6666 Acc: 79.86%
Step 53900 | Loss: 0.6584 Acc: 81.42%
Step 54000 | Loss: 0.6898 Acc: 78.85%
Step 54100 | Loss: 0.6608 Acc: 79.82%
Step 54200 | Loss: 0.6759 Acc: 80.85%
Step 54300 | Loss: 0.6331 Acc: 81.50%
Step 54400 | Loss: 0.6490 Acc: 80.98%
Step 54500 | Loss: 0.6617 Acc: 79.97%
Step 54600 | Loss: 0.6539 Acc: 81.14%
Step 54700 | Loss: 0.6532 Acc: 79.68%
Step 54800 | Loss: 0.6672 Acc: 80.36%
Step 54900 | Loss: 0.6666 Acc: 80.20%
Step 55000 | Loss: 0.6706 Acc: 80.61% | 0: 4916/5000 | 1-2: 3950/5000 | 3-10: 2608/5000 | 11-50: 2769/5000 | 51+: 3179/5000 | Total: 17422/25000 (69.7%)
Step 55100 | Loss: 0.6468 Acc: 80.98%
Step 55200 | Loss: 0.6666 Acc: 80.08%
Step 55300 | Loss: 0.6555 Acc: 80.90%
Step 55400 | Loss: 0.6335 Acc: 81.23%
Step 55500 | Loss: 0.6756 Acc: 80.23%
Step 55600 | Loss: 0.7259 Acc: 76.98%
Step 55700 | Loss: 0.6815 Acc: 78.95%
Step 55800 | Loss: 0.6638 Acc: 80.65%
Step 55900 | Loss: 0.7093 Acc: 78.68%
Step 56000 | Loss: 0.6760 Acc: 80.33%
Step 56100 | Loss: 0.6720 Acc: 80.01%
Step 56200 | Loss: 0.6757 Acc: 80.54%
Step 56300 | Loss: 0.6302 Acc: 82.56%
Step 56400 | Loss: 0.6710 Acc: 80.16%
Step 56500 | Loss: 0.6361 Acc: 82.19%
Step 56600 | Loss: 0.6967 Acc: 78.04%
Step 56700 | Loss: 0.6515 Acc: 81.00%
Step 56800 | Loss: 0.6876 Acc: 79.12%
Step 56900 | Loss: 0.6513 Acc: 81.09%
Step 57000 | Loss: 0.6731 Acc: 79.99%
Step 57100 | Loss: 0.6593 Acc: 79.84%
Step 57200 | Loss: 0.6583 Acc: 80.87%
Step 57300 | Loss: 0.6767 Acc: 79.26%
Step 57400 | Loss: 0.6557 Acc: 82.35%
Step 57500 | Loss: 0.6484 Acc: 80.91%
Step 57600 | Loss: 0.6634 Acc: 80.65%
Step 57700 | Loss: 0.6642 Acc: 80.72%
Step 57800 | Loss: 0.6898 Acc: 79.24%
Step 57900 | Loss: 0.6659 Acc: 79.85%
Step 58000 | Loss: 0.6331 Acc: 81.92%
Step 58100 | Loss: 0.6750 Acc: 79.58%
Step 58200 | Loss: 0.6485 Acc: 81.34%
Step 58300 | Loss: 0.6613 Acc: 81.07%
Step 58400 | Loss: 0.6353 Acc: 82.50%
Step 58500 | Loss: 0.6110 Acc: 83.25%
Step 58600 | Loss: 0.6724 Acc: 80.52%
Step 58700 | Loss: 0.6269 Acc: 82.77%
Step 58800 | Loss: 0.6744 Acc: 80.35%
Step 58900 | Loss: 0.6515 Acc: 80.77%
Step 59000 | Loss: 0.6580 Acc: 80.49%
Step 59100 | Loss: 0.6413 Acc: 81.36%
Step 59200 | Loss: 0.6538 Acc: 80.65%
Step 59300 | Loss: 0.6478 Acc: 81.84%
Step 59400 | Loss: 0.6333 Acc: 82.92%
Step 59500 | Loss: 0.6704 Acc: 80.20%
Step 59600 | Loss: 0.6589 Acc: 80.49%
Step 59700 | Loss: 0.6980 Acc: 78.49%
Step 59800 | Loss: 0.6567 Acc: 80.24%
Step 59900 | Loss: 0.6554 Acc: 81.87%
Step 60000 | Loss: 0.7055 Acc: 79.31% | 0: 4939/5000 | 1-2: 4072/5000 | 3-10: 2647/5000 | 11-50: 2843/5000 | 51+: 3276/5000 | Total: 17777/25000 (71.1%)
Step 60100 | Loss: 0.6643 Acc: 81.41%
Step 60200 | Loss: 0.6700 Acc: 79.70%
Step 60300 | Loss: 0.6642 Acc: 80.03%
Step 60400 | Loss: 0.6936 Acc: 79.53%
Step 60500 | Loss: 0.6604 Acc: 80.82%
Step 60600 | Loss: 0.6804 Acc: 79.40%
Step 60700 | Loss: 0.6904 Acc: 80.10%
Step 60800 | Loss: 0.6413 Acc: 81.98%
Step 60900 | Loss: 0.6585 Acc: 80.28%
Step 61000 | Loss: 0.6530 Acc: 81.17%
Step 61100 | Loss: 0.6794 Acc: 79.83%
Step 61200 | Loss: 0.6528 Acc: 81.25%
Step 61300 | Loss: 0.6622 Acc: 80.11%
Step 61400 | Loss: 0.6681 Acc: 79.94%
Step 61500 | Loss: 0.6471 Acc: 82.22%
Step 61600 | Loss: 0.6211 Acc: 83.81%
Step 61700 | Loss: 0.6960 Acc: 79.34%
Step 61800 | Loss: 0.6690 Acc: 79.70%
Step 61900 | Loss: 0.6730 Acc: 80.72%
Step 62000 | Loss: 0.6599 Acc: 80.02%
Step 62100 | Loss: 0.6411 Acc: 81.84%
Step 62200 | Loss: 0.6689 Acc: 79.35%
Step 62300 | Loss: 0.6481 Acc: 81.30%
Step 62400 | Loss: 0.6404 Acc: 81.12%
Step 62500 | Loss: 0.6551 Acc: 80.11%
Step 62600 | Loss: 0.7065 Acc: 77.70%
Step 62700 | Loss: 0.6577 Acc: 80.63%
Step 62800 | Loss: 0.6660 Acc: 80.71%
Step 62900 | Loss: 0.6388 Acc: 81.88%
Step 63000 | Loss: 0.6277 Acc: 82.90%
Step 63100 | Loss: 0.6976 Acc: 79.23%
Step 63200 | Loss: 0.6825 Acc: 78.34%
Step 63300 | Loss: 0.6391 Acc: 81.28%
Step 63400 | Loss: 0.6445 Acc: 81.52%
Step 63500 | Loss: 0.6323 Acc: 81.76%
Step 63600 | Loss: 0.6547 Acc: 80.64%
Step 63700 | Loss: 0.6659 Acc: 80.32%
Step 63800 | Loss: 0.6146 Acc: 83.28%
Step 63900 | Loss: 0.6651 Acc: 80.50%
Step 64000 | Loss: 0.6769 Acc: 78.43%
Step 64100 | Loss: 0.6808 Acc: 79.87%
Step 64200 | Loss: 0.6547 Acc: 81.06%
Step 64300 | Loss: 0.6326 Acc: 81.55%
Step 64400 | Loss: 0.6528 Acc: 81.20%
Step 64500 | Loss: 0.6711 Acc: 79.64%
Step 64600 | Loss: 0.6846 Acc: 79.20%
Step 64700 | Loss: 0.6249 Acc: 82.29%
Step 64800 | Loss: 0.6336 Acc: 82.40%
Step 64900 | Loss: 0.6449 Acc: 81.74%
Step 65000 | Loss: 0.6282 Acc: 83.11% | 0: 4926/5000 | 1-2: 4095/5000 | 3-10: 2669/5000 | 11-50: 2825/5000 | 51+: 3270/5000 | Total: 17785/25000 (71.1%)
Step 65100 | Loss: 0.6507 Acc: 80.49%
Step 65200 | Loss: 0.6557 Acc: 81.01%
Step 65300 | Loss: 0.6202 Acc: 82.90%
Step 65400 | Loss: 0.6502 Acc: 80.80%
Step 65500 | Loss: 0.6409 Acc: 81.79%
Step 65600 | Loss: 0.6506 Acc: 80.69%
Step 65700 | Loss: 0.6540 Acc: 81.34%
Step 65800 | Loss: 0.6250 Acc: 82.01%
Step 65900 | Loss: 0.5903 Acc: 84.82%
Step 66000 | Loss: 0.6489 Acc: 80.62%
Step 66100 | Loss: 0.6484 Acc: 81.24%
Step 66200 | Loss: 0.6542 Acc: 80.52%
Step 66300 | Loss: 0.6728 Acc: 80.28%
Step 66400 | Loss: 0.6457 Acc: 81.28%
Step 66500 | Loss: 0.6849 Acc: 79.45%
Step 66600 | Loss: 0.6611 Acc: 79.99%
Step 66700 | Loss: 0.6322 Acc: 81.53%
Step 66800 | Loss: 0.6594 Acc: 81.08%
Step 66900 | Loss: 0.6420 Acc: 81.28%
Step 67000 | Loss: 0.6624 Acc: 80.58%
Step 67100 | Loss: 0.6372 Acc: 81.24%
Step 67200 | Loss: 0.6473 Acc: 81.18%
Step 67300 | Loss: 0.6211 Acc: 83.16%
Step 67400 | Loss: 0.6434 Acc: 82.75%
Step 67500 | Loss: 0.6581 Acc: 80.56%
Step 67600 | Loss: 0.6401 Acc: 81.67%
Step 67700 | Loss: 0.6341 Acc: 81.39%
Step 67800 | Loss: 0.6841 Acc: 80.35%
Step 67900 | Loss: 0.6508 Acc: 80.53%
Step 68000 | Loss: 0.6781 Acc: 79.37%
Step 68100 | Loss: 0.6767 Acc: 80.23%
Step 68200 | Loss: 0.6346 Acc: 82.11%
Step 68300 | Loss: 0.6442 Acc: 81.08%
Step 68400 | Loss: 0.6545 Acc: 81.45%
Step 68500 | Loss: 0.6473 Acc: 80.61%
Step 68600 | Loss: 0.6446 Acc: 81.19%
Step 68700 | Loss: 0.6393 Acc: 82.23%
Step 68800 | Loss: 0.6581 Acc: 80.86%
Step 68900 | Loss: 0.6594 Acc: 80.84%
Step 69000 | Loss: 0.6455 Acc: 81.79%
Step 69100 | Loss: 0.6818 Acc: 79.37%
Step 69200 | Loss: 0.6520 Acc: 80.31%
Step 69300 | Loss: 0.6876 Acc: 79.30%
Step 69400 | Loss: 0.6352 Acc: 81.44%
Step 69500 | Loss: 0.6420 Acc: 82.03%
Step 69600 | Loss: 0.6666 Acc: 79.67%
Step 69700 | Loss: 0.6094 Acc: 83.95%
Step 69800 | Loss: 0.6993 Acc: 78.84%
Step 69900 | Loss: 0.6683 Acc: 80.51%
Step 69999 | Loss: 0.6530 Acc: 81.07% | 0: 4936/5000 | 1-2: 4083/5000 | 3-10: 2689/5000 | 11-50: 2871/5000 | 51+: 3278/5000 | Total: 17857/25000 (71.4%)

============================================================
FINAL RESULTS - Baseline: 2.7M sudoku-extreme, 70K steps
============================================================
Rating 0     :  4936/ 5000 solved ( 98.7%)
Rating 1-2   :  4083/ 5000 solved ( 81.7%)
Rating 3-10  :  2689/ 5000 solved ( 53.8%)
Rating 11-50 :  2871/ 5000 solved ( 57.4%)
Rating 51+   :  3278/ 5000 solved ( 65.6%)

Total: 17857/25000 (71.4%)
Previous (400K, 100K steps): 63.4%
TRM comparison: 87.4%
Model saved to model_extreme_baseline.pt
