
============================================================
Step 0: Entering Phase 1: Hard only (3.0+)
Training pool: 321326 puzzles
============================================================

Step     0 | Loss: 2.8746 Acc: 11.46% | 0.0: 0/500 | 1.x: 0/500 | 2.x: 0/500 | 3.x: 0/500 | 4.x+: 0/500 | Total: 0/2500
Step   100 | Loss: 2.2090 Acc: 10.81%
Step   200 | Loss: 2.1973 Acc: 12.02%
Step   300 | Loss: 1.9028 Acc: 20.26%
Step   400 | Loss: 1.4627 Acc: 34.73%
Step   500 | Loss: 1.2190 Acc: 50.00%
Step   600 | Loss: 1.1694 Acc: 52.56%
Step   700 | Loss: 1.1242 Acc: 55.44%
Step   800 | Loss: 1.1059 Acc: 55.52%
Step   900 | Loss: 1.0904 Acc: 55.74%
Step  1000 | Loss: 1.0716 Acc: 56.88%
Step  1100 | Loss: 1.0548 Acc: 57.90%
Step  1200 | Loss: 1.0463 Acc: 58.83%
Step  1300 | Loss: 1.0361 Acc: 58.62%
Step  1400 | Loss: 1.0189 Acc: 59.53%
Step  1500 | Loss: 1.0218 Acc: 58.85%
Step  1600 | Loss: 1.0084 Acc: 59.22%
Step  1700 | Loss: 1.0024 Acc: 60.92%
Step  1800 | Loss: 1.0173 Acc: 59.11%
Step  1900 | Loss: 0.9875 Acc: 60.69%
Step  2000 | Loss: 0.9904 Acc: 60.88%
Step  2100 | Loss: 0.9725 Acc: 61.59%
Step  2200 | Loss: 0.9672 Acc: 62.44%
Step  2300 | Loss: 0.9648 Acc: 61.54%
Step  2400 | Loss: 0.9529 Acc: 62.31%
Step  2500 | Loss: 0.9572 Acc: 62.00%
Step  2600 | Loss: 0.9553 Acc: 63.04%
Step  2700 | Loss: 0.9491 Acc: 63.23%
Step  2800 | Loss: 0.9510 Acc: 63.27%
Step  2900 | Loss: 0.9355 Acc: 63.62%
Step  3000 | Loss: 0.9322 Acc: 63.59%
Step  3100 | Loss: 0.9570 Acc: 62.74%
Step  3200 | Loss: 0.9318 Acc: 63.86%
Step  3300 | Loss: 0.9352 Acc: 63.18%
Step  3400 | Loss: 0.9370 Acc: 62.86%
Step  3500 | Loss: 0.9199 Acc: 65.55%
Step  3600 | Loss: 0.9285 Acc: 63.97%
Step  3700 | Loss: 0.9186 Acc: 64.83%
Step  3800 | Loss: 0.9389 Acc: 63.51%
Step  3900 | Loss: 0.9080 Acc: 65.33%
Step  4000 | Loss: 0.9102 Acc: 64.93%
Step  4100 | Loss: 0.9067 Acc: 66.17%
Step  4200 | Loss: 0.9094 Acc: 65.58%
Step  4300 | Loss: 0.9105 Acc: 64.55%
Step  4400 | Loss: 0.9103 Acc: 65.19%
Step  4500 | Loss: 0.8960 Acc: 65.49%
Step  4600 | Loss: 0.8977 Acc: 65.30%
Step  4700 | Loss: 0.9070 Acc: 65.46%
Step  4800 | Loss: 0.9027 Acc: 65.57%
Step  4900 | Loss: 0.8954 Acc: 66.23%
Step  5000 | Loss: 0.8810 Acc: 67.56% | 0.0: 134/500 | 1.x: 53/500 | 2.x: 19/500 | 3.x: 11/500 | 4.x+: 5/500 | Total: 222/2500
Step  5100 | Loss: 0.8879 Acc: 67.08%
Step  5200 | Loss: 0.8721 Acc: 68.25%
Step  5300 | Loss: 0.8697 Acc: 68.10%
Step  5400 | Loss: 0.8648 Acc: 68.58%
Step  5500 | Loss: 0.8827 Acc: 67.94%
Step  5600 | Loss: 0.8621 Acc: 67.97%
Step  5700 | Loss: 0.8643 Acc: 68.23%
Step  5800 | Loss: 0.8484 Acc: 68.50%
Step  5900 | Loss: 0.8581 Acc: 69.81%
Step  6000 | Loss: 0.8385 Acc: 70.44%
Step  6100 | Loss: 0.8465 Acc: 69.15%
Step  6200 | Loss: 0.8328 Acc: 71.51%
Step  6300 | Loss: 0.8569 Acc: 69.84%
Step  6400 | Loss: 0.8204 Acc: 72.64%
Step  6500 | Loss: 0.8372 Acc: 70.15%
Step  6600 | Loss: 0.8339 Acc: 72.07%
Step  6700 | Loss: 0.8429 Acc: 70.82%
Step  6800 | Loss: 0.8447 Acc: 70.74%
Step  6900 | Loss: 0.8295 Acc: 71.26%
Step  7000 | Loss: 0.8314 Acc: 71.22%
Step  7100 | Loss: 0.8230 Acc: 72.93%
Step  7200 | Loss: 0.8392 Acc: 71.65%
Step  7300 | Loss: 0.8229 Acc: 71.94%
Step  7400 | Loss: 0.8448 Acc: 71.40%
Step  7500 | Loss: 0.7980 Acc: 74.13%
Step  7600 | Loss: 0.8148 Acc: 72.98%
Step  7700 | Loss: 0.8157 Acc: 72.77%
Step  7800 | Loss: 0.8101 Acc: 72.84%
Step  7900 | Loss: 0.8275 Acc: 72.95%
Step  8000 | Loss: 0.8140 Acc: 71.95%
Step  8100 | Loss: 0.8214 Acc: 71.59%
Step  8200 | Loss: 0.8223 Acc: 72.67%
Step  8300 | Loss: 0.8378 Acc: 71.80%
Step  8400 | Loss: 0.8059 Acc: 73.96%
Step  8500 | Loss: 0.8029 Acc: 73.67%
Step  8600 | Loss: 0.8152 Acc: 73.36%
Step  8700 | Loss: 0.7783 Acc: 75.02%
Step  8800 | Loss: 0.8069 Acc: 73.34%
Step  8900 | Loss: 0.8061 Acc: 72.67%
Step  9000 | Loss: 0.7762 Acc: 76.07%
Step  9100 | Loss: 0.7948 Acc: 74.04%
Step  9200 | Loss: 0.8092 Acc: 73.18%
Step  9300 | Loss: 0.8110 Acc: 73.93%
Step  9400 | Loss: 0.7797 Acc: 75.94%
Step  9500 | Loss: 0.7832 Acc: 75.54%
Step  9600 | Loss: 0.7850 Acc: 75.56%
Step  9700 | Loss: 0.7721 Acc: 76.92%
Step  9800 | Loss: 0.7840 Acc: 75.20%
Step  9900 | Loss: 0.8048 Acc: 73.48%
Step 10000 | Loss: 0.7902 Acc: 74.70% | 0.0: 436/500 | 1.x: 315/500 | 2.x: 247/500 | 3.x: 172/500 | 4.x+: 121/500 | Total: 1291/2500
Step 10100 | Loss: 0.7773 Acc: 75.57%
Step 10200 | Loss: 0.7865 Acc: 75.58%
Step 10300 | Loss: 0.7783 Acc: 76.02%
Step 10400 | Loss: 0.7820 Acc: 74.70%
Step 10500 | Loss: 0.8193 Acc: 73.59%
Step 10600 | Loss: 0.7905 Acc: 75.19%
Step 10700 | Loss: 0.7964 Acc: 75.53%
Step 10800 | Loss: 0.7967 Acc: 73.11%
Step 10900 | Loss: 0.7722 Acc: 75.75%
Step 11000 | Loss: 0.7721 Acc: 75.43%
Step 11100 | Loss: 0.7939 Acc: 74.86%
Step 11200 | Loss: 0.8041 Acc: 74.75%
Step 11300 | Loss: 0.7772 Acc: 76.50%
Step 11400 | Loss: 0.7913 Acc: 73.96%
Step 11500 | Loss: 0.7747 Acc: 75.68%
Step 11600 | Loss: 0.7833 Acc: 75.81%
Step 11700 | Loss: 0.7733 Acc: 76.93%
Step 11800 | Loss: 0.7684 Acc: 76.00%
Step 11900 | Loss: 0.7715 Acc: 77.11%
Step 12000 | Loss: 0.7768 Acc: 76.40%
Step 12100 | Loss: 0.7754 Acc: 76.16%
Step 12200 | Loss: 0.7653 Acc: 76.79%
Step 12300 | Loss: 0.7787 Acc: 76.28%
Step 12400 | Loss: 0.7805 Acc: 76.96%
Step 12500 | Loss: 0.7711 Acc: 76.09%
Step 12600 | Loss: 0.7693 Acc: 76.58%
Step 12700 | Loss: 0.7717 Acc: 76.16%
Step 12800 | Loss: 0.7549 Acc: 77.61%
Step 12900 | Loss: 0.7589 Acc: 76.91%
Step 13000 | Loss: 0.7794 Acc: 76.04%
Step 13100 | Loss: 0.7843 Acc: 76.49%
Step 13200 | Loss: 0.7434 Acc: 78.22%
Step 13300 | Loss: 0.7656 Acc: 77.60%
Step 13400 | Loss: 0.7589 Acc: 76.27%
Step 13500 | Loss: 0.7734 Acc: 76.42%
Step 13600 | Loss: 0.7554 Acc: 77.17%
Step 13700 | Loss: 0.7717 Acc: 76.87%
Step 13800 | Loss: 0.7635 Acc: 77.20%
Step 13900 | Loss: 0.7537 Acc: 78.14%
Step 14000 | Loss: 0.7667 Acc: 76.57%
Step 14100 | Loss: 0.7616 Acc: 77.30%
Step 14200 | Loss: 0.7372 Acc: 79.61%
Step 14300 | Loss: 0.7774 Acc: 75.17%
Step 14400 | Loss: 0.7736 Acc: 76.56%
Step 14500 | Loss: 0.7416 Acc: 78.17%
Step 14600 | Loss: 0.7540 Acc: 77.25%
Step 14700 | Loss: 0.7623 Acc: 77.30%
Step 14800 | Loss: 0.7629 Acc: 78.14%
Step 14900 | Loss: 0.7505 Acc: 78.52%
Step 15000 | Loss: 0.7616 Acc: 77.46% | 0.0: 459/500 | 1.x: 357/500 | 2.x: 294/500 | 3.x: 236/500 | 4.x+: 215/500 | Total: 1561/2500
Step 15100 | Loss: 0.7576 Acc: 77.34%
Step 15200 | Loss: 0.7539 Acc: 77.56%
Step 15300 | Loss: 0.7644 Acc: 77.97%
Step 15400 | Loss: 0.7507 Acc: 79.14%
Step 15500 | Loss: 0.7370 Acc: 78.63%
Step 15600 | Loss: 0.7460 Acc: 78.61%
Step 15700 | Loss: 0.7485 Acc: 79.19%
Step 15800 | Loss: 0.7568 Acc: 78.10%
Step 15900 | Loss: 0.7639 Acc: 77.81%
Step 16000 | Loss: 0.7408 Acc: 79.16%
Step 16100 | Loss: 0.7532 Acc: 77.36%
Step 16200 | Loss: 0.7504 Acc: 77.71%
Step 16300 | Loss: 0.7511 Acc: 78.03%
Step 16400 | Loss: 0.7567 Acc: 78.76%
Step 16500 | Loss: 0.7317 Acc: 79.77%
Step 16600 | Loss: 0.7522 Acc: 78.66%
Step 16700 | Loss: 0.7442 Acc: 79.36%
Step 16800 | Loss: 0.7367 Acc: 78.69%
Step 16900 | Loss: 0.7481 Acc: 79.01%
Step 17000 | Loss: 0.7504 Acc: 78.30%
Step 17100 | Loss: 0.7462 Acc: 78.70%
Step 17200 | Loss: 0.7402 Acc: 78.37%
Step 17300 | Loss: 0.7550 Acc: 77.71%
Step 17400 | Loss: 0.7339 Acc: 79.42%
Step 17500 | Loss: 0.7403 Acc: 79.27%
Step 17600 | Loss: 0.7310 Acc: 80.20%
Step 17700 | Loss: 0.7416 Acc: 79.12%
Step 17800 | Loss: 0.7180 Acc: 80.18%
Step 17900 | Loss: 0.7305 Acc: 78.79%
Step 18000 | Loss: 0.7396 Acc: 78.90%
Step 18100 | Loss: 0.7164 Acc: 81.00%
Step 18200 | Loss: 0.7445 Acc: 78.45%
Step 18300 | Loss: 0.7249 Acc: 80.93%
Step 18400 | Loss: 0.7373 Acc: 79.01%
Step 18500 | Loss: 0.7422 Acc: 78.73%
Step 18600 | Loss: 0.7477 Acc: 78.94%
Step 18700 | Loss: 0.7384 Acc: 79.41%
Step 18800 | Loss: 0.7331 Acc: 79.64%
Step 18900 | Loss: 0.7267 Acc: 80.52%
Step 19000 | Loss: 0.7186 Acc: 80.37%
Step 19100 | Loss: 0.7377 Acc: 79.26%
Step 19200 | Loss: 0.7430 Acc: 79.67%
Step 19300 | Loss: 0.7293 Acc: 79.82%
Step 19400 | Loss: 0.7229 Acc: 80.39%
Step 19500 | Loss: 0.7386 Acc: 79.38%
Step 19600 | Loss: 0.7302 Acc: 79.66%
Step 19700 | Loss: 0.7182 Acc: 80.55%
Step 19800 | Loss: 0.7258 Acc: 79.52%
Step 19900 | Loss: 0.7244 Acc: 79.92%

============================================================
Step 20000: Entering Phase 2: Medium-Hard+ (2.0+)
Training pool: 892000 puzzles
============================================================

Step 20000 | Loss: 0.6929 Acc: 82.03% | 0.0: 472/500 | 1.x: 394/500 | 2.x: 330/500 | 3.x: 281/500 | 4.x+: 241/500 | Total: 1718/2500
Step 20100 | Loss: 0.6717 Acc: 83.21%
Step 20200 | Loss: 0.7004 Acc: 81.98%
Step 20300 | Loss: 0.6826 Acc: 82.16%
Step 20400 | Loss: 0.6701 Acc: 83.60%
Step 20500 | Loss: 0.6778 Acc: 82.46%
Step 20600 | Loss: 0.6570 Acc: 84.40%
Step 20700 | Loss: 0.6808 Acc: 82.49%
Step 20800 | Loss: 0.6772 Acc: 82.20%
Step 20900 | Loss: 0.6947 Acc: 82.18%
Step 21000 | Loss: 0.6807 Acc: 82.52%
Step 21100 | Loss: 0.6591 Acc: 83.80%
Step 21200 | Loss: 0.6674 Acc: 83.04%
Step 21300 | Loss: 0.6780 Acc: 82.62%
Step 21400 | Loss: 0.6782 Acc: 81.94%
Step 21500 | Loss: 0.6519 Acc: 84.17%
Step 21600 | Loss: 0.6790 Acc: 82.58%
Step 21700 | Loss: 0.6997 Acc: 81.39%
Step 21800 | Loss: 0.6802 Acc: 82.75%
Step 21900 | Loss: 0.6792 Acc: 82.95%
Step 22000 | Loss: 0.6802 Acc: 82.17%
Step 22100 | Loss: 0.6716 Acc: 83.07%
Step 22200 | Loss: 0.6784 Acc: 81.96%
Step 22300 | Loss: 0.6689 Acc: 83.04%
Step 22400 | Loss: 0.6733 Acc: 82.56%
Step 22500 | Loss: 0.6926 Acc: 81.69%
Step 22600 | Loss: 0.6935 Acc: 81.23%
Step 22700 | Loss: 0.6336 Acc: 84.90%
Step 22800 | Loss: 0.6598 Acc: 83.06%
Step 22900 | Loss: 0.6395 Acc: 84.35%
Step 23000 | Loss: 0.6572 Acc: 84.03%
Step 23100 | Loss: 0.6683 Acc: 83.13%
Step 23200 | Loss: 0.6610 Acc: 83.20%
Step 23300 | Loss: 0.6920 Acc: 81.50%
Step 23400 | Loss: 0.6674 Acc: 82.80%
Step 23500 | Loss: 0.6555 Acc: 84.11%
Step 23600 | Loss: 0.6703 Acc: 82.54%
Step 23700 | Loss: 0.6580 Acc: 83.73%
Step 23800 | Loss: 0.6739 Acc: 83.35%
Step 23900 | Loss: 0.6480 Acc: 83.91%
Step 24000 | Loss: 0.6715 Acc: 83.10%
Step 24100 | Loss: 0.6654 Acc: 83.20%
Step 24200 | Loss: 0.6595 Acc: 83.13%
Step 24300 | Loss: 0.6523 Acc: 84.75%
Step 24400 | Loss: 0.6913 Acc: 81.54%
Step 24500 | Loss: 0.6631 Acc: 83.50%
Step 24600 | Loss: 0.6497 Acc: 84.39%
Step 24700 | Loss: 0.6641 Acc: 83.22%
Step 24800 | Loss: 0.6365 Acc: 85.63%
Step 24900 | Loss: 0.6433 Acc: 84.76%
Step 25000 | Loss: 0.6498 Acc: 83.87% | 0.0: 489/500 | 1.x: 430/500 | 2.x: 364/500 | 3.x: 321/500 | 4.x+: 276/500 | Total: 1880/2500
Step 25100 | Loss: 0.6652 Acc: 83.75%
Step 25200 | Loss: 0.6387 Acc: 84.66%
Step 25300 | Loss: 0.6672 Acc: 82.70%
Step 25400 | Loss: 0.6588 Acc: 83.23%
Step 25500 | Loss: 0.6723 Acc: 82.88%
Step 25600 | Loss: 0.6554 Acc: 83.65%
Step 25700 | Loss: 0.6627 Acc: 83.36%
Step 25800 | Loss: 0.6509 Acc: 83.27%
Step 25900 | Loss: 0.6679 Acc: 83.36%
Step 26000 | Loss: 0.6569 Acc: 83.17%
Step 26100 | Loss: 0.6421 Acc: 84.26%
Step 26200 | Loss: 0.6541 Acc: 83.81%
Step 26300 | Loss: 0.6640 Acc: 82.62%
Step 26400 | Loss: 0.6458 Acc: 84.23%
Step 26500 | Loss: 0.6658 Acc: 83.50%
Step 26600 | Loss: 0.6756 Acc: 82.74%
Step 26700 | Loss: 0.6340 Acc: 84.96%
Step 26800 | Loss: 0.6416 Acc: 84.36%
Step 26900 | Loss: 0.6606 Acc: 83.25%
Step 27000 | Loss: 0.6561 Acc: 83.33%
Step 27100 | Loss: 0.6321 Acc: 85.14%
Step 27200 | Loss: 0.6750 Acc: 82.52%
Step 27300 | Loss: 0.6413 Acc: 84.36%
Step 27400 | Loss: 0.6756 Acc: 82.75%
Step 27500 | Loss: 0.6412 Acc: 84.36%
Step 27600 | Loss: 0.6427 Acc: 84.70%
Step 27700 | Loss: 0.6440 Acc: 84.32%
Step 27800 | Loss: 0.6454 Acc: 84.08%
Step 27900 | Loss: 0.6487 Acc: 83.95%
Step 28000 | Loss: 0.6511 Acc: 83.62%
Step 28100 | Loss: 0.6636 Acc: 83.35%
Step 28200 | Loss: 0.6618 Acc: 82.78%
Step 28300 | Loss: 0.6063 Acc: 86.21%
Step 28400 | Loss: 0.6393 Acc: 83.95%
Step 28500 | Loss: 0.6504 Acc: 84.18%
Step 28600 | Loss: 0.6296 Acc: 85.16%
Step 28700 | Loss: 0.6525 Acc: 83.75%
Step 28800 | Loss: 0.6554 Acc: 83.00%
Step 28900 | Loss: 0.6319 Acc: 85.00%
Step 29000 | Loss: 0.6656 Acc: 82.28%
Step 29100 | Loss: 0.6300 Acc: 85.23%
Step 29200 | Loss: 0.6348 Acc: 84.74%
Step 29300 | Loss: 0.6372 Acc: 83.79%
Step 29400 | Loss: 0.6505 Acc: 84.36%
Step 29500 | Loss: 0.6351 Acc: 84.49%
Step 29600 | Loss: 0.6329 Acc: 84.14%
Step 29700 | Loss: 0.6482 Acc: 83.32%
Step 29800 | Loss: 0.6498 Acc: 84.11%
Step 29900 | Loss: 0.6371 Acc: 84.64%
Step 30000 | Loss: 0.6407 Acc: 84.14% | 0.0: 486/500 | 1.x: 409/500 | 2.x: 359/500 | 3.x: 312/500 | 4.x+: 267/500 | Total: 1833/2500
Step 30100 | Loss: 0.6262 Acc: 84.49%
Step 30200 | Loss: 0.6383 Acc: 84.17%
Step 30300 | Loss: 0.6484 Acc: 83.54%
Step 30400 | Loss: 0.6431 Acc: 84.79%
Step 30500 | Loss: 0.6592 Acc: 83.33%
Step 30600 | Loss: 0.6406 Acc: 84.20%
Step 30700 | Loss: 0.6489 Acc: 84.02%
Step 30800 | Loss: 0.6535 Acc: 83.27%
Step 30900 | Loss: 0.6186 Acc: 84.70%
Step 31000 | Loss: 0.6144 Acc: 86.02%
Step 31100 | Loss: 0.6106 Acc: 86.26%
Step 31200 | Loss: 0.6532 Acc: 84.27%
Step 31300 | Loss: 0.6346 Acc: 84.23%
Step 31400 | Loss: 0.6381 Acc: 84.50%
Step 31500 | Loss: 0.6378 Acc: 84.09%
Step 31600 | Loss: 0.6448 Acc: 83.98%
Step 31700 | Loss: 0.6326 Acc: 84.06%
Step 31800 | Loss: 0.6246 Acc: 85.31%
Step 31900 | Loss: 0.6453 Acc: 84.60%
Step 32000 | Loss: 0.6455 Acc: 83.77%
Step 32100 | Loss: 0.6433 Acc: 84.88%
Step 32200 | Loss: 0.6645 Acc: 82.17%
Step 32300 | Loss: 0.6334 Acc: 84.97%
Step 32400 | Loss: 0.5938 Acc: 87.27%
Step 32500 | Loss: 0.6513 Acc: 83.00%
Step 32600 | Loss: 0.6451 Acc: 84.46%
Step 32700 | Loss: 0.6271 Acc: 84.70%
Step 32800 | Loss: 0.6299 Acc: 84.60%
Step 32900 | Loss: 0.6219 Acc: 85.27%
Step 33000 | Loss: 0.6381 Acc: 84.17%
Step 33100 | Loss: 0.6108 Acc: 86.26%
Step 33200 | Loss: 0.6284 Acc: 85.13%
Step 33300 | Loss: 0.6014 Acc: 86.89%
Step 33400 | Loss: 0.6505 Acc: 83.89%
Step 33500 | Loss: 0.6071 Acc: 86.28%
Step 33600 | Loss: 0.6217 Acc: 84.64%
Step 33700 | Loss: 0.6299 Acc: 84.99%
Step 33800 | Loss: 0.6175 Acc: 85.75%
Step 33900 | Loss: 0.6193 Acc: 84.50%
Step 34000 | Loss: 0.6222 Acc: 85.59%
Step 34100 | Loss: 0.6346 Acc: 84.36%
Step 34200 | Loss: 0.6380 Acc: 84.86%
Step 34300 | Loss: 0.6242 Acc: 85.08%
Step 34400 | Loss: 0.6308 Acc: 84.69%
Step 34500 | Loss: 0.6328 Acc: 84.56%
Step 34600 | Loss: 0.6398 Acc: 83.90%
Step 34700 | Loss: 0.6226 Acc: 85.11%
Step 34800 | Loss: 0.6142 Acc: 86.66%
Step 34900 | Loss: 0.6499 Acc: 83.82%
Step 35000 | Loss: 0.6030 Acc: 86.55% | 0.0: 491/500 | 1.x: 415/500 | 2.x: 373/500 | 3.x: 324/500 | 4.x+: 288/500 | Total: 1891/2500
Step 35100 | Loss: 0.6242 Acc: 84.69%
Step 35200 | Loss: 0.6271 Acc: 85.11%
Step 35300 | Loss: 0.5921 Acc: 87.04%
Step 35400 | Loss: 0.6051 Acc: 86.45%
Step 35500 | Loss: 0.6175 Acc: 85.02%
Step 35600 | Loss: 0.5964 Acc: 87.09%
Step 35700 | Loss: 0.6327 Acc: 84.78%
Step 35800 | Loss: 0.6088 Acc: 86.03%
Step 35900 | Loss: 0.6030 Acc: 86.13%
Step 36000 | Loss: 0.6291 Acc: 85.02%
Step 36100 | Loss: 0.6172 Acc: 84.74%
Step 36200 | Loss: 0.6096 Acc: 85.93%
Step 36300 | Loss: 0.6204 Acc: 85.54%
Step 36400 | Loss: 0.6276 Acc: 85.21%
Step 36500 | Loss: 0.6223 Acc: 84.85%
Step 36600 | Loss: 0.6340 Acc: 84.74%
Step 36700 | Loss: 0.6150 Acc: 85.81%
Step 36800 | Loss: 0.6087 Acc: 85.33%
Step 36900 | Loss: 0.6249 Acc: 85.29%
Step 37000 | Loss: 0.6101 Acc: 85.56%
Step 37100 | Loss: 0.6159 Acc: 84.96%
Step 37200 | Loss: 0.6230 Acc: 85.09%
Step 37300 | Loss: 0.6169 Acc: 85.25%
Step 37400 | Loss: 0.6125 Acc: 85.29%
Step 37500 | Loss: 0.6094 Acc: 85.74%
Step 37600 | Loss: 0.6448 Acc: 84.37%
Step 37700 | Loss: 0.6021 Acc: 86.44%
Step 37800 | Loss: 0.6310 Acc: 84.11%
Step 37900 | Loss: 0.6319 Acc: 83.88%
Step 38000 | Loss: 0.6284 Acc: 84.97%
Step 38100 | Loss: 0.5990 Acc: 86.42%
Step 38200 | Loss: 0.6348 Acc: 84.43%
Step 38300 | Loss: 0.6314 Acc: 84.26%
Step 38400 | Loss: 0.5924 Acc: 87.08%
Step 38500 | Loss: 0.6354 Acc: 84.66%
Step 38600 | Loss: 0.6246 Acc: 83.96%
Step 38700 | Loss: 0.6099 Acc: 85.65%
Step 38800 | Loss: 0.5991 Acc: 86.70%
Step 38900 | Loss: 0.5997 Acc: 86.02%
Step 39000 | Loss: 0.5867 Acc: 88.09%
Step 39100 | Loss: 0.6111 Acc: 85.85%
Step 39200 | Loss: 0.6224 Acc: 85.03%
Step 39300 | Loss: 0.6336 Acc: 84.61%
Step 39400 | Loss: 0.6073 Acc: 86.24%
Step 39500 | Loss: 0.6086 Acc: 86.37%
Step 39600 | Loss: 0.5911 Acc: 87.48%
Step 39700 | Loss: 0.6019 Acc: 85.73%
Step 39800 | Loss: 0.6308 Acc: 84.40%
Step 39900 | Loss: 0.6177 Acc: 84.96%

============================================================
Step 40000: Entering Phase 3: Medium+ (1.0+)
Training pool: 1703919 puzzles
============================================================

Step 40000 | Loss: 0.5716 Acc: 88.15% | 0.0: 494/500 | 1.x: 430/500 | 2.x: 387/500 | 3.x: 343/500 | 4.x+: 280/500 | Total: 1934/2500
Step 40100 | Loss: 0.5228 Acc: 90.94%
Step 40200 | Loss: 0.5714 Acc: 86.89%
Step 40300 | Loss: 0.5633 Acc: 87.69%
Step 40400 | Loss: 0.5347 Acc: 89.65%
Step 40500 | Loss: 0.5090 Acc: 90.77%
Step 40600 | Loss: 0.5457 Acc: 88.82%
Step 40700 | Loss: 0.5536 Acc: 88.41%
Step 40800 | Loss: 0.5342 Acc: 89.16%
Step 40900 | Loss: 0.5358 Acc: 89.03%
Step 41000 | Loss: 0.5668 Acc: 87.63%
Step 41100 | Loss: 0.5598 Acc: 88.50%
Step 41200 | Loss: 0.5417 Acc: 88.77%
Step 41300 | Loss: 0.5421 Acc: 89.43%
Step 41400 | Loss: 0.5391 Acc: 89.15%
Step 41500 | Loss: 0.5482 Acc: 88.67%
Step 41600 | Loss: 0.5462 Acc: 88.11%
Step 41700 | Loss: 0.5607 Acc: 88.01%
Step 41800 | Loss: 0.5282 Acc: 89.10%
Step 41900 | Loss: 0.5605 Acc: 88.53%
Step 42000 | Loss: 0.5508 Acc: 88.93%
Step 42100 | Loss: 0.5338 Acc: 89.39%
Step 42200 | Loss: 0.5579 Acc: 88.35%
Step 42300 | Loss: 0.5549 Acc: 88.66%
Step 42400 | Loss: 0.5429 Acc: 89.16%
Step 42500 | Loss: 0.5386 Acc: 89.16%
Step 42600 | Loss: 0.5726 Acc: 88.22%
Step 42700 | Loss: 0.5202 Acc: 90.04%
Step 42800 | Loss: 0.5351 Acc: 89.67%
Step 42900 | Loss: 0.5382 Acc: 88.97%
Step 43000 | Loss: 0.5478 Acc: 88.85%
Step 43100 | Loss: 0.5306 Acc: 88.80%
Step 43200 | Loss: 0.5324 Acc: 88.96%
Step 43300 | Loss: 0.5549 Acc: 88.36%
Step 43400 | Loss: 0.5458 Acc: 88.95%
Step 43500 | Loss: 0.5482 Acc: 89.27%
Step 43600 | Loss: 0.5264 Acc: 89.75%
Step 43700 | Loss: 0.5429 Acc: 88.69%
Step 43800 | Loss: 0.5395 Acc: 88.76%
Step 43900 | Loss: 0.5498 Acc: 88.11%
Step 44000 | Loss: 0.5501 Acc: 89.08%
Step 44100 | Loss: 0.5148 Acc: 90.52%
Step 44200 | Loss: 0.5347 Acc: 89.54%
Step 44300 | Loss: 0.5678 Acc: 87.28%
Step 44400 | Loss: 0.5190 Acc: 89.78%
Step 44500 | Loss: 0.5368 Acc: 89.32%
Step 44600 | Loss: 0.5411 Acc: 89.27%
Step 44700 | Loss: 0.5373 Acc: 89.52%
Step 44800 | Loss: 0.5457 Acc: 89.29%
Step 44900 | Loss: 0.5642 Acc: 87.59%
Step 45000 | Loss: 0.5415 Acc: 88.80% | 0.0: 498/500 | 1.x: 438/500 | 2.x: 373/500 | 3.x: 334/500 | 4.x+: 283/500 | Total: 1926/2500
Step 45100 | Loss: 0.5301 Acc: 89.48%
Step 45200 | Loss: 0.5572 Acc: 87.99%
Step 45300 | Loss: 0.5655 Acc: 87.89%
Step 45400 | Loss: 0.5425 Acc: 88.23%
Step 45500 | Loss: 0.5504 Acc: 88.00%
Step 45600 | Loss: 0.5926 Acc: 86.42%
Step 45700 | Loss: 0.5456 Acc: 89.08%
Step 45800 | Loss: 0.5171 Acc: 90.48%
Step 45900 | Loss: 0.5356 Acc: 88.88%
Step 46000 | Loss: 0.5029 Acc: 91.17%
Step 46100 | Loss: 0.5363 Acc: 89.60%
Step 46200 | Loss: 0.5688 Acc: 87.72%
Step 46300 | Loss: 0.5162 Acc: 91.25%
Step 46400 | Loss: 0.5391 Acc: 88.99%
Step 46500 | Loss: 0.5468 Acc: 87.79%
Step 46600 | Loss: 0.5405 Acc: 88.75%
Step 46700 | Loss: 0.5547 Acc: 88.28%
Step 46800 | Loss: 0.5675 Acc: 87.39%
Step 46900 | Loss: 0.5658 Acc: 87.72%
Step 47000 | Loss: 0.5416 Acc: 88.47%
Step 47100 | Loss: 0.5476 Acc: 88.79%
Step 47200 | Loss: 0.5515 Acc: 88.86%
Step 47300 | Loss: 0.5745 Acc: 87.28%
Step 47400 | Loss: 0.5574 Acc: 88.31%
Step 47500 | Loss: 0.5457 Acc: 88.57%
Step 47600 | Loss: 0.5324 Acc: 89.09%
Step 47700 | Loss: 0.5444 Acc: 89.02%
Step 47800 | Loss: 0.5390 Acc: 88.66%
Step 47900 | Loss: 0.5288 Acc: 89.38%
Step 48000 | Loss: 0.5308 Acc: 89.20%
Step 48100 | Loss: 0.5729 Acc: 87.57%
Step 48200 | Loss: 0.5060 Acc: 90.15%
Step 48300 | Loss: 0.5343 Acc: 89.08%
Step 48400 | Loss: 0.5700 Acc: 87.91%
Step 48500 | Loss: 0.5279 Acc: 89.85%
Step 48600 | Loss: 0.5295 Acc: 89.05%
Step 48700 | Loss: 0.5411 Acc: 89.24%
Step 48800 | Loss: 0.5274 Acc: 89.22%
Step 48900 | Loss: 0.5437 Acc: 89.71%
Step 49000 | Loss: 0.5641 Acc: 87.81%
Step 49100 | Loss: 0.5357 Acc: 89.89%
Step 49200 | Loss: 0.5339 Acc: 89.74%
Step 49300 | Loss: 0.5456 Acc: 88.27%
Step 49400 | Loss: 0.5275 Acc: 90.39%
Step 49500 | Loss: 0.5663 Acc: 87.92%
Step 49600 | Loss: 0.5409 Acc: 88.80%
Step 49700 | Loss: 0.5452 Acc: 88.84%
Step 49800 | Loss: 0.5336 Acc: 89.25%
Step 49900 | Loss: 0.5264 Acc: 89.33%
Step 50000 | Loss: 0.5043 Acc: 91.17% | 0.0: 494/500 | 1.x: 438/500 | 2.x: 388/500 | 3.x: 334/500 | 4.x+: 305/500 | Total: 1959/2500
Step 50100 | Loss: 0.5401 Acc: 89.16%
Step 50200 | Loss: 0.5345 Acc: 88.61%
Step 50300 | Loss: 0.5305 Acc: 90.00%
Step 50400 | Loss: 0.5442 Acc: 88.51%
Step 50500 | Loss: 0.5313 Acc: 90.05%
Step 50600 | Loss: 0.5341 Acc: 89.05%
Step 50700 | Loss: 0.5447 Acc: 88.45%
Step 50800 | Loss: 0.5328 Acc: 89.17%
Step 50900 | Loss: 0.5180 Acc: 89.61%
Step 51000 | Loss: 0.5257 Acc: 89.05%
Step 51100 | Loss: 0.5338 Acc: 88.83%
Step 51200 | Loss: 0.5286 Acc: 89.54%
Step 51300 | Loss: 0.5474 Acc: 88.74%
Step 51400 | Loss: 0.5154 Acc: 90.06%
Step 51500 | Loss: 0.5229 Acc: 89.82%
Step 51600 | Loss: 0.5373 Acc: 90.30%
Step 51700 | Loss: 0.5611 Acc: 87.45%
Step 51800 | Loss: 0.5298 Acc: 90.07%
Step 51900 | Loss: 0.5328 Acc: 89.63%
Step 52000 | Loss: 0.5315 Acc: 90.08%
Step 52100 | Loss: 0.5245 Acc: 90.40%
Step 52200 | Loss: 0.5497 Acc: 88.70%
Step 52300 | Loss: 0.5555 Acc: 88.50%
Step 52400 | Loss: 0.5192 Acc: 89.46%
Step 52500 | Loss: 0.5192 Acc: 89.92%
Step 52600 | Loss: 0.5472 Acc: 88.29%
Step 52700 | Loss: 0.5447 Acc: 89.03%
Step 52800 | Loss: 0.5619 Acc: 88.26%
Step 52900 | Loss: 0.5761 Acc: 87.17%
Step 53000 | Loss: 0.5336 Acc: 88.99%
Step 53100 | Loss: 0.5393 Acc: 89.09%
Step 53200 | Loss: 0.5275 Acc: 89.62%
Step 53300 | Loss: 0.5229 Acc: 89.92%
Step 53400 | Loss: 0.5546 Acc: 88.24%
Step 53500 | Loss: 0.5198 Acc: 90.04%
Step 53600 | Loss: 0.5274 Acc: 89.02%
Step 53700 | Loss: 0.5274 Acc: 90.04%
Step 53800 | Loss: 0.5169 Acc: 89.74%
Step 53900 | Loss: 0.5483 Acc: 89.03%
Step 54000 | Loss: 0.5403 Acc: 88.92%
Step 54100 | Loss: 0.5323 Acc: 89.21%
Step 54200 | Loss: 0.5350 Acc: 89.79%
Step 54300 | Loss: 0.5380 Acc: 89.00%
Step 54400 | Loss: 0.5508 Acc: 88.17%
Step 54500 | Loss: 0.5244 Acc: 89.36%
Step 54600 | Loss: 0.5477 Acc: 88.22%
Step 54700 | Loss: 0.5223 Acc: 90.32%
Step 54800 | Loss: 0.5681 Acc: 87.55%
Step 54900 | Loss: 0.5481 Acc: 89.52%
Step 55000 | Loss: 0.5380 Acc: 88.67% | 0.0: 492/500 | 1.x: 431/500 | 2.x: 396/500 | 3.x: 335/500 | 4.x+: 308/500 | Total: 1962/2500
Step 55100 | Loss: 0.5283 Acc: 89.14%
Step 55200 | Loss: 0.5291 Acc: 89.53%
Step 55300 | Loss: 0.5294 Acc: 89.74%
Step 55400 | Loss: 0.5496 Acc: 88.12%
Step 55500 | Loss: 0.5791 Acc: 86.96%
Step 55600 | Loss: 0.5222 Acc: 89.12%
Step 55700 | Loss: 0.5178 Acc: 89.66%
Step 55800 | Loss: 0.5431 Acc: 88.72%
Step 55900 | Loss: 0.5426 Acc: 89.08%
Step 56000 | Loss: 0.5374 Acc: 88.31%
Step 56100 | Loss: 0.5505 Acc: 89.05%
Step 56200 | Loss: 0.5285 Acc: 88.41%
Step 56300 | Loss: 0.5604 Acc: 88.10%
Step 56400 | Loss: 0.5216 Acc: 89.00%
Step 56500 | Loss: 0.5037 Acc: 91.51%
Step 56600 | Loss: 0.5482 Acc: 88.85%
Step 56700 | Loss: 0.5441 Acc: 89.28%
Step 56800 | Loss: 0.5192 Acc: 90.18%
Step 56900 | Loss: 0.5380 Acc: 89.15%
Step 57000 | Loss: 0.5156 Acc: 90.51%
Step 57100 | Loss: 0.5470 Acc: 88.21%
Step 57200 | Loss: 0.5416 Acc: 89.48%
Step 57300 | Loss: 0.5220 Acc: 90.14%
Step 57400 | Loss: 0.5377 Acc: 89.20%
Step 57500 | Loss: 0.5432 Acc: 88.56%
Step 57600 | Loss: 0.5386 Acc: 89.15%
Step 57700 | Loss: 0.5429 Acc: 89.34%
Step 57800 | Loss: 0.5511 Acc: 87.95%
Step 57900 | Loss: 0.5279 Acc: 89.44%
Step 58000 | Loss: 0.5703 Acc: 87.06%
Step 58100 | Loss: 0.5127 Acc: 90.85%
Step 58200 | Loss: 0.5348 Acc: 88.86%
Step 58300 | Loss: 0.5658 Acc: 87.91%
Step 58400 | Loss: 0.5208 Acc: 89.51%
Step 58500 | Loss: 0.5363 Acc: 89.50%
Step 58600 | Loss: 0.5409 Acc: 88.54%
Step 58700 | Loss: 0.5365 Acc: 88.79%
Step 58800 | Loss: 0.5170 Acc: 89.80%
Step 58900 | Loss: 0.5306 Acc: 89.30%
Step 59000 | Loss: 0.5321 Acc: 89.79%
Step 59100 | Loss: 0.5241 Acc: 89.47%
Step 59200 | Loss: 0.5335 Acc: 89.09%
Step 59300 | Loss: 0.5438 Acc: 88.22%
Step 59400 | Loss: 0.5304 Acc: 89.55%
Step 59500 | Loss: 0.5402 Acc: 89.00%
Step 59600 | Loss: 0.5196 Acc: 89.45%
Step 59700 | Loss: 0.5636 Acc: 88.21%
Step 59800 | Loss: 0.5521 Acc: 89.19%
Step 59900 | Loss: 0.5499 Acc: 88.12%

============================================================
Step 60000: Entering Phase 4: All (0.0+)
Training pool: 2997500 puzzles
============================================================

Step 60000 | Loss: 0.4637 Acc: 92.72% | 0.0: 494/500 | 1.x: 442/500 | 2.x: 384/500 | 3.x: 347/500 | 4.x+: 306/500 | Total: 1973/2500
Step 60100 | Loss: 0.4241 Acc: 94.47%
Step 60200 | Loss: 0.4193 Acc: 94.36%
Step 60300 | Loss: 0.4254 Acc: 94.25%
Step 60400 | Loss: 0.4353 Acc: 92.62%
Step 60500 | Loss: 0.4179 Acc: 94.02%
Step 60600 | Loss: 0.4329 Acc: 93.44%
Step 60700 | Loss: 0.4389 Acc: 93.09%
Step 60800 | Loss: 0.4229 Acc: 94.30%
Step 60900 | Loss: 0.4290 Acc: 93.27%
Step 61000 | Loss: 0.4300 Acc: 93.30%
Step 61100 | Loss: 0.4303 Acc: 92.96%
Step 61200 | Loss: 0.4529 Acc: 92.80%
Step 61300 | Loss: 0.4467 Acc: 93.09%
Step 61400 | Loss: 0.4477 Acc: 92.65%
Step 61500 | Loss: 0.4301 Acc: 93.26%
Step 61600 | Loss: 0.4462 Acc: 92.55%
Step 61700 | Loss: 0.4232 Acc: 93.86%
Step 61800 | Loss: 0.4375 Acc: 93.42%
Step 61900 | Loss: 0.4421 Acc: 92.30%
Step 62000 | Loss: 0.4914 Acc: 91.39%
Step 62100 | Loss: 0.4536 Acc: 92.35%
Step 62200 | Loss: 0.4300 Acc: 93.70%
Step 62300 | Loss: 0.4281 Acc: 93.26%
Step 62400 | Loss: 0.4348 Acc: 94.08%
Step 62500 | Loss: 0.4157 Acc: 93.80%
Step 62600 | Loss: 0.4589 Acc: 91.36%
Step 62700 | Loss: 0.4379 Acc: 93.39%
Step 62800 | Loss: 0.4353 Acc: 92.93%
Step 62900 | Loss: 0.4240 Acc: 94.33%
Step 63000 | Loss: 0.4236 Acc: 93.58%
Step 63100 | Loss: 0.4114 Acc: 93.88%
Step 63200 | Loss: 0.4118 Acc: 94.99%
Step 63300 | Loss: 0.4303 Acc: 93.89%
Step 63400 | Loss: 0.4401 Acc: 92.72%
Step 63500 | Loss: 0.4337 Acc: 92.99%
Step 63600 | Loss: 0.4569 Acc: 92.15%
Step 63700 | Loss: 0.4596 Acc: 92.25%
Step 63800 | Loss: 0.4363 Acc: 93.16%
Step 63900 | Loss: 0.4329 Acc: 93.57%
Step 64000 | Loss: 0.4411 Acc: 93.03%
Step 64100 | Loss: 0.4118 Acc: 94.65%
Step 64200 | Loss: 0.4527 Acc: 92.10%
Step 64300 | Loss: 0.4250 Acc: 94.16%
Step 64400 | Loss: 0.4285 Acc: 92.90%
Step 64500 | Loss: 0.4315 Acc: 93.77%
Step 64600 | Loss: 0.4675 Acc: 91.79%
Step 64700 | Loss: 0.4436 Acc: 93.40%
Step 64800 | Loss: 0.4491 Acc: 92.77%
Step 64900 | Loss: 0.4459 Acc: 92.36%
Step 65000 | Loss: 0.4469 Acc: 92.60% | 0.0: 499/500 | 1.x: 429/500 | 2.x: 385/500 | 3.x: 354/500 | 4.x+: 285/500 | Total: 1952/2500
Step 65100 | Loss: 0.4285 Acc: 94.28%
Step 65200 | Loss: 0.4375 Acc: 92.60%
Step 65300 | Loss: 0.4378 Acc: 93.56%
Step 65400 | Loss: 0.4604 Acc: 91.75%
Step 65500 | Loss: 0.4008 Acc: 94.91%
Step 65600 | Loss: 0.4250 Acc: 93.58%
Step 65700 | Loss: 0.4371 Acc: 92.60%
Step 65800 | Loss: 0.4508 Acc: 92.20%
Step 65900 | Loss: 0.4339 Acc: 92.77%
Step 66000 | Loss: 0.4508 Acc: 92.25%
Step 66100 | Loss: 0.4318 Acc: 94.34%
Step 66200 | Loss: 0.4244 Acc: 93.60%
Step 66300 | Loss: 0.3991 Acc: 94.44%
Step 66400 | Loss: 0.4339 Acc: 93.14%
Step 66500 | Loss: 0.4422 Acc: 93.07%
Step 66600 | Loss: 0.4388 Acc: 93.68%
Step 66700 | Loss: 0.4329 Acc: 93.52%
Step 66800 | Loss: 0.4366 Acc: 93.22%
Step 66900 | Loss: 0.4325 Acc: 93.34%
Step 67000 | Loss: 0.4014 Acc: 94.51%
Step 67100 | Loss: 0.4260 Acc: 94.04%
Step 67200 | Loss: 0.4376 Acc: 93.06%
Step 67300 | Loss: 0.4194 Acc: 93.66%
Step 67400 | Loss: 0.4227 Acc: 93.97%
Step 67500 | Loss: 0.4585 Acc: 91.57%
Step 67600 | Loss: 0.4253 Acc: 94.46%
Step 67700 | Loss: 0.4311 Acc: 92.93%
Step 67800 | Loss: 0.4566 Acc: 92.74%
Step 67900 | Loss: 0.4334 Acc: 92.39%
Step 68000 | Loss: 0.4575 Acc: 92.52%
Step 68100 | Loss: 0.4347 Acc: 93.37%
Step 68200 | Loss: 0.4533 Acc: 92.21%
Step 68300 | Loss: 0.4357 Acc: 93.35%
Step 68400 | Loss: 0.4628 Acc: 91.78%
Step 68500 | Loss: 0.4316 Acc: 93.52%
Step 68600 | Loss: 0.4294 Acc: 93.33%
Step 68700 | Loss: 0.4406 Acc: 93.74%
Step 68800 | Loss: 0.4204 Acc: 93.60%
Step 68900 | Loss: 0.4374 Acc: 93.37%
Step 69000 | Loss: 0.4169 Acc: 94.02%
Step 69100 | Loss: 0.4629 Acc: 92.53%
Step 69200 | Loss: 0.4357 Acc: 92.61%
Step 69300 | Loss: 0.4412 Acc: 93.03%
Step 69400 | Loss: 0.4394 Acc: 92.74%
Step 69500 | Loss: 0.4155 Acc: 94.02%
Step 69600 | Loss: 0.4079 Acc: 94.10%
Step 69700 | Loss: 0.4857 Acc: 91.40%
Step 69800 | Loss: 0.4399 Acc: 92.62%
Step 69900 | Loss: 0.4455 Acc: 92.15%
Step 70000 | Loss: 0.4254 Acc: 93.80% | 0.0: 495/500 | 1.x: 440/500 | 2.x: 379/500 | 3.x: 346/500 | 4.x+: 288/500 | Total: 1948/2500
Step 70100 | Loss: 0.4187 Acc: 94.17%
Step 70200 | Loss: 0.4560 Acc: 92.57%
Step 70300 | Loss: 0.4476 Acc: 92.63%
Step 70400 | Loss: 0.4195 Acc: 93.99%
Step 70500 | Loss: 0.4313 Acc: 92.97%
Step 70600 | Loss: 0.4350 Acc: 93.41%
Step 70700 | Loss: 0.4275 Acc: 93.41%
Step 70800 | Loss: 0.4508 Acc: 92.30%
Step 70900 | Loss: 0.4571 Acc: 93.20%
Step 71000 | Loss: 0.4493 Acc: 93.11%
Step 71100 | Loss: 0.4371 Acc: 92.44%
Step 71200 | Loss: 0.4259 Acc: 93.51%
Step 71300 | Loss: 0.4332 Acc: 93.52%
Step 71400 | Loss: 0.4165 Acc: 94.47%
Step 71500 | Loss: 0.4689 Acc: 92.31%
Step 71600 | Loss: 0.4298 Acc: 94.19%
Step 71700 | Loss: 0.4502 Acc: 92.88%
Step 71800 | Loss: 0.4420 Acc: 93.20%
Step 71900 | Loss: 0.4338 Acc: 92.80%
Step 72000 | Loss: 0.4399 Acc: 93.17%
Step 72100 | Loss: 0.4568 Acc: 92.17%
Step 72200 | Loss: 0.4725 Acc: 92.78%
Step 72300 | Loss: 0.4276 Acc: 93.66%
Step 72400 | Loss: 0.4364 Acc: 93.59%
Step 72500 | Loss: 0.4301 Acc: 94.17%
Step 72600 | Loss: 0.4547 Acc: 93.12%
Step 72700 | Loss: 0.4384 Acc: 92.95%
Step 72800 | Loss: 0.4312 Acc: 93.62%
Step 72900 | Loss: 0.4492 Acc: 93.13%
Step 73000 | Loss: 0.4636 Acc: 91.80%
Step 73100 | Loss: 0.4358 Acc: 93.37%
Step 73200 | Loss: 0.4622 Acc: 92.19%
Step 73300 | Loss: 0.4450 Acc: 93.50%
Step 73400 | Loss: 0.4604 Acc: 92.18%
Step 73500 | Loss: 0.4269 Acc: 93.48%
Step 73600 | Loss: 0.4419 Acc: 92.89%
Step 73700 | Loss: 0.4419 Acc: 92.89%
Step 73800 | Loss: 0.4495 Acc: 92.19%
Step 73900 | Loss: 0.4217 Acc: 93.72%
Step 74000 | Loss: 0.4322 Acc: 92.74%
Step 74100 | Loss: 0.4242 Acc: 93.73%
Step 74200 | Loss: 0.4293 Acc: 93.12%
Step 74300 | Loss: 0.4348 Acc: 93.85%
Step 74400 | Loss: 0.4347 Acc: 93.21%
Step 74500 | Loss: 0.4490 Acc: 92.22%
Step 74600 | Loss: 0.4223 Acc: 93.97%
Step 74700 | Loss: 0.4198 Acc: 94.64%
Step 74800 | Loss: 0.4393 Acc: 93.28%
Step 74900 | Loss: 0.4443 Acc: 93.18%
Step 75000 | Loss: 0.4393 Acc: 92.65% | 0.0: 493/500 | 1.x: 436/500 | 2.x: 394/500 | 3.x: 343/500 | 4.x+: 313/500 | Total: 1979/2500
Step 75100 | Loss: 0.4409 Acc: 93.41%
Step 75200 | Loss: 0.4109 Acc: 94.22%
Step 75300 | Loss: 0.4492 Acc: 92.29%
Step 75400 | Loss: 0.4398 Acc: 92.76%
Step 75500 | Loss: 0.4609 Acc: 93.50%
Step 75600 | Loss: 0.4342 Acc: 93.08%
Step 75700 | Loss: 0.4304 Acc: 93.03%
Step 75800 | Loss: 0.4255 Acc: 93.14%
Step 75900 | Loss: 0.4578 Acc: 92.23%
Step 76000 | Loss: 0.4657 Acc: 92.19%
Step 76100 | Loss: 0.4462 Acc: 93.58%
Step 76200 | Loss: 0.4496 Acc: 92.43%
Step 76300 | Loss: 0.4970 Acc: 91.46%
Step 76400 | Loss: 0.4463 Acc: 92.19%
Step 76500 | Loss: 0.4734 Acc: 91.70%
Step 76600 | Loss: 0.4655 Acc: 91.88%
Step 76700 | Loss: 0.4623 Acc: 92.49%
Step 76800 | Loss: 0.4174 Acc: 93.79%
Step 76900 | Loss: 0.4261 Acc: 93.49%
Step 77000 | Loss: 0.4625 Acc: 92.01%
Step 77100 | Loss: 0.4009 Acc: 94.57%
Step 77200 | Loss: 0.4486 Acc: 92.88%
Step 77300 | Loss: 0.4580 Acc: 92.42%
Step 77400 | Loss: 0.4435 Acc: 92.58%
Step 77500 | Loss: 0.4176 Acc: 94.29%
Step 77600 | Loss: 0.4446 Acc: 93.90%
Step 77700 | Loss: 0.4449 Acc: 93.57%
Step 77800 | Loss: 0.4487 Acc: 92.99%
Step 77900 | Loss: 0.4278 Acc: 93.58%
Step 78000 | Loss: 0.4256 Acc: 93.60%
Step 78100 | Loss: 0.4455 Acc: 92.45%
Step 78200 | Loss: 0.4746 Acc: 92.44%
Step 78300 | Loss: 0.4339 Acc: 93.81%
Step 78400 | Loss: 0.4503 Acc: 92.27%
Step 78500 | Loss: 0.4197 Acc: 93.49%
Step 78600 | Loss: 0.4340 Acc: 93.63%
Step 78700 | Loss: 0.4231 Acc: 94.02%
Step 78800 | Loss: 0.4164 Acc: 94.26%
Step 78900 | Loss: 0.4213 Acc: 94.84%
Step 79000 | Loss: 0.4625 Acc: 91.94%
Step 79100 | Loss: 0.4345 Acc: 94.22%
Step 79200 | Loss: 0.4477 Acc: 93.38%
Step 79300 | Loss: 0.4341 Acc: 93.21%
Step 79400 | Loss: 0.4535 Acc: 92.84%
Step 79500 | Loss: 0.4655 Acc: 92.71%
Step 79600 | Loss: 0.4465 Acc: 92.34%
Step 79700 | Loss: 0.4333 Acc: 93.01%
Step 79800 | Loss: 0.4535 Acc: 93.08%
Step 79900 | Loss: 0.4300 Acc: 92.93%

============================================================
Step 80000: Entering Phase 5: All (0.0+)
Training pool: 2997500 puzzles
============================================================

Step 80000 | Loss: 0.4459 Acc: 92.77% | 0.0: 495/500 | 1.x: 445/500 | 2.x: 396/500 | 3.x: 349/500 | 4.x+: 296/500 | Total: 1981/2500
Step 80100 | Loss: 0.3836 Acc: 95.38%
Step 80200 | Loss: 0.4439 Acc: 93.22%
Step 80300 | Loss: 0.4225 Acc: 93.30%
Step 80400 | Loss: 0.4514 Acc: 92.51%
Step 80500 | Loss: 0.4464 Acc: 92.95%
Step 80600 | Loss: 0.4213 Acc: 93.63%
Step 80700 | Loss: 0.4312 Acc: 93.15%
Step 80800 | Loss: 0.4609 Acc: 93.39%
Step 80900 | Loss: 0.4262 Acc: 94.03%
Step 81000 | Loss: 0.4567 Acc: 91.80%
Step 81100 | Loss: 0.4677 Acc: 92.05%
Step 81200 | Loss: 0.4083 Acc: 93.86%
Step 81300 | Loss: 0.4207 Acc: 94.15%
Step 81400 | Loss: 0.4497 Acc: 92.44%
Step 81500 | Loss: 0.4323 Acc: 94.19%
Step 81600 | Loss: 0.4378 Acc: 93.42%
Step 81700 | Loss: 0.4321 Acc: 93.30%
Step 81800 | Loss: 0.5437 Acc: 90.06%
Step 81900 | Loss: 0.4484 Acc: 92.48%
Step 82000 | Loss: 0.4371 Acc: 92.96%
Step 82100 | Loss: 0.4360 Acc: 92.98%
Step 82200 | Loss: 0.4644 Acc: 91.41%
Step 82300 | Loss: 0.4758 Acc: 91.64%
Step 82400 | Loss: 0.4539 Acc: 92.68%
Step 82500 | Loss: 0.4541 Acc: 92.92%
Step 82600 | Loss: 0.4284 Acc: 93.68%
Step 82700 | Loss: 0.4219 Acc: 93.64%
Step 82800 | Loss: 0.4152 Acc: 93.97%
Step 82900 | Loss: 0.4899 Acc: 91.85%
Step 83000 | Loss: 0.4354 Acc: 93.15%
Step 83100 | Loss: 0.4457 Acc: 92.28%
Step 83200 | Loss: 0.4457 Acc: 93.41%
Step 83300 | Loss: 0.4497 Acc: 92.86%
Step 83400 | Loss: 0.4290 Acc: 93.25%
Step 83500 | Loss: 0.4511 Acc: 92.74%
Step 83600 | Loss: 0.4377 Acc: 93.71%
Step 83700 | Loss: 0.3956 Acc: 94.72%
Step 83800 | Loss: 0.4477 Acc: 93.12%
Step 83900 | Loss: 0.4361 Acc: 92.49%
Step 84000 | Loss: 0.4104 Acc: 94.30%
Step 84100 | Loss: 0.4493 Acc: 93.07%
Step 84200 | Loss: 0.4330 Acc: 93.04%
Step 84300 | Loss: 0.4888 Acc: 91.31%
Step 84400 | Loss: 0.4402 Acc: 93.09%
Step 84500 | Loss: 0.4316 Acc: 93.31%
Step 84600 | Loss: 0.4644 Acc: 92.45%
Step 84700 | Loss: 0.4343 Acc: 93.28%
Step 84800 | Loss: 0.4318 Acc: 94.09%
Step 84900 | Loss: 0.4322 Acc: 93.26%
Step 85000 | Loss: 0.4275 Acc: 93.95% | 0.0: 496/500 | 1.x: 441/500 | 2.x: 384/500 | 3.x: 342/500 | 4.x+: 299/500 | Total: 1962/2500
Step 85100 | Loss: 0.4132 Acc: 93.85%
Step 85200 | Loss: 0.4008 Acc: 94.28%
Step 85300 | Loss: 0.4526 Acc: 92.13%
Step 85400 | Loss: 0.4496 Acc: 92.65%
Step 85500 | Loss: 0.4309 Acc: 93.15%
Step 85600 | Loss: 0.4315 Acc: 93.57%
Step 85700 | Loss: 0.4428 Acc: 93.36%
Step 85800 | Loss: 0.4444 Acc: 92.35%
Step 85900 | Loss: 0.4357 Acc: 93.07%
Step 86000 | Loss: 0.4424 Acc: 93.26%
Step 86100 | Loss: 0.4261 Acc: 94.09%
Step 86200 | Loss: 0.4354 Acc: 93.11%
Step 86300 | Loss: 0.4379 Acc: 93.51%
Step 86400 | Loss: 0.4639 Acc: 92.05%
Step 86500 | Loss: 0.4189 Acc: 93.88%
Step 86600 | Loss: 0.4261 Acc: 94.05%
Step 86700 | Loss: 0.4373 Acc: 92.80%
Step 86800 | Loss: 0.4516 Acc: 92.05%
Step 86900 | Loss: 0.4156 Acc: 93.98%
Step 87000 | Loss: 0.4974 Acc: 90.71%
Step 87100 | Loss: 0.4334 Acc: 93.24%
Step 87200 | Loss: 0.4153 Acc: 94.42%
Step 87300 | Loss: 0.4057 Acc: 93.97%
Step 87400 | Loss: 0.4356 Acc: 93.49%
Step 87500 | Loss: 0.4527 Acc: 92.15%
Step 87600 | Loss: 0.4213 Acc: 93.75%
Step 87700 | Loss: 0.4404 Acc: 93.49%
Step 87800 | Loss: 0.4292 Acc: 93.59%
Step 87900 | Loss: 0.4327 Acc: 92.99%
Step 88000 | Loss: 0.4342 Acc: 92.71%
Step 88100 | Loss: 0.4284 Acc: 93.53%
Step 88200 | Loss: 0.4508 Acc: 93.06%
Step 88300 | Loss: 0.4470 Acc: 92.98%
Step 88400 | Loss: 0.4142 Acc: 94.27%
Step 88500 | Loss: 0.4125 Acc: 93.81%
Step 88600 | Loss: 0.4308 Acc: 93.16%
Step 88700 | Loss: 0.4241 Acc: 94.29%
Step 88800 | Loss: 0.4254 Acc: 93.55%
Step 88900 | Loss: 0.4334 Acc: 93.19%
Step 89000 | Loss: 0.4424 Acc: 92.39%
Step 89100 | Loss: 0.4348 Acc: 92.79%
Step 89200 | Loss: 0.4379 Acc: 93.05%
Step 89300 | Loss: 0.4275 Acc: 93.75%
Step 89400 | Loss: 0.4585 Acc: 92.29%
Step 89500 | Loss: 0.4309 Acc: 93.13%
Step 89600 | Loss: 0.4384 Acc: 92.78%
Step 89700 | Loss: 0.4208 Acc: 94.34%
Step 89800 | Loss: 0.4313 Acc: 93.94%
Step 89900 | Loss: 0.4337 Acc: 93.13%
Step 90000 | Loss: 0.4534 Acc: 91.83% | 0.0: 498/500 | 1.x: 447/500 | 2.x: 381/500 | 3.x: 340/500 | 4.x+: 301/500 | Total: 1967/2500
Step 90100 | Loss: 0.4171 Acc: 93.48%
Step 90200 | Loss: 0.4509 Acc: 92.76%
Step 90300 | Loss: 0.4655 Acc: 92.13%
Step 90400 | Loss: 0.4328 Acc: 93.23%
Step 90500 | Loss: 0.4060 Acc: 94.40%
Step 90600 | Loss: 0.5527 Acc: 89.90%
Step 90700 | Loss: 0.4414 Acc: 92.85%
Step 90800 | Loss: 0.4547 Acc: 92.85%
Step 90900 | Loss: 0.4352 Acc: 93.35%
Step 91000 | Loss: 0.4702 Acc: 91.43%
Step 91100 | Loss: 0.4296 Acc: 93.26%
Step 91200 | Loss: 0.4514 Acc: 91.88%
Step 91300 | Loss: 0.4312 Acc: 93.46%
Step 91400 | Loss: 0.4552 Acc: 92.90%
Step 91500 | Loss: 0.4147 Acc: 93.85%
Step 91600 | Loss: 0.4558 Acc: 92.27%
Step 91700 | Loss: 0.4856 Acc: 90.63%
Step 91800 | Loss: 0.4414 Acc: 93.50%
Step 91900 | Loss: 0.4559 Acc: 91.75%
Step 92000 | Loss: 0.4262 Acc: 93.04%
Step 92100 | Loss: 0.4563 Acc: 93.21%
Step 92200 | Loss: 0.4324 Acc: 92.96%
Step 92300 | Loss: 0.4506 Acc: 92.89%
Step 92400 | Loss: 0.4534 Acc: 92.36%
Step 92500 | Loss: 0.4481 Acc: 93.11%
Step 92600 | Loss: 0.4464 Acc: 92.43%
Step 92700 | Loss: 0.4461 Acc: 92.40%
Step 92800 | Loss: 0.4208 Acc: 93.94%
Step 92900 | Loss: 0.4151 Acc: 94.54%
Step 93000 | Loss: 0.4908 Acc: 91.64%
Step 93100 | Loss: 0.4404 Acc: 92.52%
Step 93200 | Loss: 0.4632 Acc: 92.60%
Step 93300 | Loss: 0.4398 Acc: 93.00%
Step 93400 | Loss: 0.4698 Acc: 92.86%
Step 93500 | Loss: 0.4631 Acc: 92.06%
Step 93600 | Loss: 0.4390 Acc: 92.97%
Step 93700 | Loss: 0.4451 Acc: 92.03%
Step 93800 | Loss: 0.4229 Acc: 93.91%
Step 93900 | Loss: 0.4527 Acc: 91.92%
Step 94000 | Loss: 0.4119 Acc: 93.57%
Step 94100 | Loss: 0.4551 Acc: 92.30%
Step 94200 | Loss: 0.4191 Acc: 94.16%
Step 94300 | Loss: 0.4203 Acc: 94.12%
Step 94400 | Loss: 0.4333 Acc: 93.39%
Step 94500 | Loss: 0.4425 Acc: 92.95%
Step 94600 | Loss: 0.4560 Acc: 92.19%
Step 94700 | Loss: 0.4383 Acc: 92.99%
Step 94800 | Loss: 0.4452 Acc: 92.64%
Step 94900 | Loss: 0.4393 Acc: 93.19%
Step 95000 | Loss: 0.4305 Acc: 94.07% | 0.0: 497/500 | 1.x: 446/500 | 2.x: 397/500 | 3.x: 348/500 | 4.x+: 290/500 | Total: 1978/2500
Step 95100 | Loss: 0.4323 Acc: 93.51%
Step 95200 | Loss: 0.4384 Acc: 93.53%
Step 95300 | Loss: 0.4563 Acc: 92.68%
Step 95400 | Loss: 0.4364 Acc: 93.47%
Step 95500 | Loss: 0.4449 Acc: 92.82%
Step 95600 | Loss: 0.4425 Acc: 93.16%
Step 95700 | Loss: 0.4087 Acc: 95.01%
Step 95800 | Loss: 0.4261 Acc: 93.78%
Step 95900 | Loss: 0.4535 Acc: 93.38%
Step 96000 | Loss: 0.5034 Acc: 91.16%
Step 96100 | Loss: 0.4279 Acc: 93.61%
Step 96200 | Loss: 0.4051 Acc: 94.28%
Step 96300 | Loss: 0.4452 Acc: 92.80%
Step 96400 | Loss: 0.4494 Acc: 92.02%
Step 96500 | Loss: 0.4317 Acc: 92.92%
Step 96600 | Loss: 0.4650 Acc: 91.99%
Step 96700 | Loss: 0.4548 Acc: 92.29%
Step 96800 | Loss: 0.4373 Acc: 93.70%
Step 96900 | Loss: 0.4688 Acc: 92.28%
Step 97000 | Loss: 0.4397 Acc: 93.05%
Step 97100 | Loss: 0.4288 Acc: 93.78%
Step 97200 | Loss: 0.4537 Acc: 93.18%
Step 97300 | Loss: 0.4364 Acc: 93.50%
Step 97400 | Loss: 0.4386 Acc: 92.88%
Step 97500 | Loss: 0.4607 Acc: 92.49%
Step 97600 | Loss: 0.4480 Acc: 92.65%
Step 97700 | Loss: 0.4413 Acc: 93.91%
Step 97800 | Loss: 0.4601 Acc: 92.22%
Step 97900 | Loss: 0.4465 Acc: 93.00%
Step 98000 | Loss: 0.4304 Acc: 92.74%
Step 98100 | Loss: 0.4721 Acc: 92.58%
Step 98200 | Loss: 0.4109 Acc: 94.20%
Step 98300 | Loss: 0.3947 Acc: 95.04%
Step 98400 | Loss: 0.4180 Acc: 94.05%
Step 98500 | Loss: 0.4323 Acc: 93.24%
Step 98600 | Loss: 0.4399 Acc: 93.41%
Step 98700 | Loss: 0.4322 Acc: 92.95%
Step 98800 | Loss: 0.4416 Acc: 92.88%
Step 98900 | Loss: 0.4274 Acc: 93.40%
Step 99000 | Loss: 0.4334 Acc: 93.32%
Step 99100 | Loss: 0.4396 Acc: 92.81%
Step 99200 | Loss: 0.4087 Acc: 94.36%
Step 99300 | Loss: 0.4224 Acc: 94.01%
Step 99400 | Loss: 0.4370 Acc: 93.09%
Step 99500 | Loss: 0.4581 Acc: 92.73%
Step 99600 | Loss: 0.4299 Acc: 93.59%
Step 99700 | Loss: 0.4173 Acc: 93.92%
Step 99800 | Loss: 0.4327 Acc: 93.50%
Step 99900 | Loss: 0.4492 Acc: 92.68%
Step 99999 | Loss: 0.4087 Acc: 94.43% | 0.0: 498/500 | 1.x: 452/500 | 2.x: 395/500 | 3.x: 339/500 | 4.x+: 310/500 | Total: 1994/2500

============================================================
FINAL RESULTS - Reverse Curriculum Learning (Hard -> Easy)
============================================================
Difficulty 0.0   : 498/500 solved ( 99.6%), cell acc: 99.9%
Difficulty 1.x   : 452/500 solved ( 90.4%), cell acc: 96.4%
Difficulty 2.x   : 395/500 solved ( 79.0%), cell acc: 91.9%
Difficulty 3.x   : 339/500 solved ( 67.8%), cell acc: 87.9%
Difficulty 4.x+  : 310/500 solved ( 62.0%), cell acc: 85.6%

Total: 1994/2500 solved
Model saved to model_curriculum_reverse.pt
